﻿DLC1Colon,：,：
DLC1ComprehendForgetTip,Do you want to forget {0}? All levels will be lost after forgetting.,"คุณแน่ใจว่าต้องการลืม {0} หรือไม่, หากลืมแล้วจะสูญเสียระดับทั้งหมด"
DLC1ItemPageTip,Please select a character for item information,กรุณาเลือกตัวละครเพื่อตรวจสอบสิ่งของ
DLC1ChangeFactionNameTip,Change selected faction name,แก้ไขชื่อฝ่ายที่เลือกแล้ว
DLC1JSMovePoint,Move cursor,เคลื่อนเม้าส์
DLC1JSSelectTarget,Select target,เลือกเป้าหมาย
DLC1JSIncomeNext,Income estimate,คาดการณ์รายได้
DLC1JSSelectAction,Select action,เลือกการกระทำ
DLC1JSDoAction,Execute,ดำเนินการ
DLC1JSInformation,Message,ข้อความ
DLC1JSSetting,Settings,ตั้งค่า
DLC1JSTipShow,Key Prompt,เคล็ดลับปุ่ม
DLC1JSClickAction,Perform action,ดำเนินการ
DLC1JSMapStage,Select location,เลือกสถานที่
DLC1Compet0,The <color=#a94e37>{0}</color> round of competition is about to begin.,การแข่งขันรอบที่ <color=#a94e37>{0}</color> กำลังจะเริ่มขึ้น
DLC1Compet1,<color=#a94e37>{0}</color>'s <color=#a94e37>{1}</color> is fighting against <color=#a94e37>{2}</color>'s <color=#a94e37>{3}</color>.,<color=#a94e37>{0}</color> ของ <color=#a94e37>{1}</color> จะต่อสู้กับ <color=#a94e37>{2}</color> ของ <color=#a94e37>{3}</color>
DLC1Compet2,"Due to the number of participants, congratulations to <color=#a94e37>{0}</color>'s <color=#a94e37>{1}</color> for advancing directly to the next round of competition.",ด้วยจำนวนคนที่มีอยู่ ขอแสดงความยินดีกับ <color=#a94e37>{0}</color> ของ <color=#a94e37>{1}</color> ที่ได้เข้าสู่รอบถัดไปโดยตรง
DLC1Compet3,The <color=#a94e37>{0}</color> round of competition officially begins.,การแข่งขันรอบที่ <color=#a94e37>{0}</color> ของการแข่งขันอย่างเป็นทางการ กำลังเริ่มต้นขึ้น
DLC1Compet4,"After an exciting competition, the champion of this martial arts tournament is <color=#a94e37>{0}</color>'s <color=#a94e37>{1}</color>, rewarded with <color=#a94e37>100 martial arts certificates</color>.",หลังจากการแข่งขันที่น่าตื่นเต้น ผู้ชนะของงานชุมนุมยุทธภพครั้งนี้คือ <color=#a94e37>{0}</color> ของ <color=#a94e37>{1}</color> รางวัล <color=#a94e37>100 เหรียญยุทธภพ</color>
DLC1Compet5,"The runner-up is <color=#a94e37>{0}</color>'s <color=#a94e37>{1}</color>, rewarded with <color=#a94e37>60 martial arts certificates</color>.",รองชนะเลิศคือ <color=#a94e37>{0}</color> ของ <color=#a94e37>{1}</color> รางวัล <color=#a94e37>60 เหรียญยุทธภพ</color>
DLC1Compet6,"The third place is <color=#a94e37>{0}</color>'s <color=#a94e37>{1}</color>, rewarded with <color=#a94e37>30 martial arts certificates</color>.",อันดับสามคือ <color=#a94e37>{0}</color> ของ <color=#a94e37>{1}</color> รางวัล <color=#a94e37>30 เหรียญยุทธภพ</color>
DLC1Compet7,"The martial arts tournament is over, thank you all for your support.",งานชุมนุมยุทธภพครั้งนี้สิ้นสุดลง ขอบคุณทุกท่านที่ให้การสนับสนุน
AiProgressText,{0} is taking action,{0} กำลังลงมือ
DLC1JSProvinceInfoCheck,Info,ข้อมูล
DLC1JSProvinceInfoClose,Close interface,ปิดหน้าต่าง
DLC1TipNextIncomeTitle,Income estimate,คาดการณ์รายได้
DLC1TipDiff1Title,Easy,ง่าย
DLC1TipDiff1Content,"A relatively easy gameplay difficulty, AI's damage is reduced by <color=#0cf045>50%</color>, AI's resource acquisition is reduced by <color=#0cf045>50%</color>.","ความยากในการเล่น ""ง่าย"", ความเสียหายของ AI ลดลง <color=#0cf045>50%</color>, การได้รับทรัพยากรของ AI ลดลง <color=#0cf045>50%</color>"
DLC1TipDiff2Title,Normal,ปกติ
DLC1TipDiff2Content,"Recommended gameplay difficulty, AI will cause normal damage and normal resource acquisition.","ความยากในการเล่นที่แนะนำ, AI จะสร้างความเสียหายตามปกติและได้รับทรัพยากรตามปกติ"
DLC1TipDiff3Title,Hard,ยาก
DLC1TipDiff3Content,"A gameplay difficulty relative to Hard, AI's Increases Damage by <color=#d70ced>50%</color>, AI's resource acquisition increases by <color=#d70ced>50%</color>.","ยากความยากในการเล่นที่ ""ยาก"", ความเสียหายของ AI เพิ่มขึ้น <color=#d70ced>50%</color>, การได้รับทรัพยากรของ AI เพิ่มขึ้น <color=#d70ced>50%</color>"
DLC1TipDiff4Title,Nightmare,ฝันร้าย
DLC1TipDiff4Content,"A very Hard gameplay difficulty, AI's Increases Damage by <color=#c02b10>100%</color>, AI's resource acquisition increases by <color=#c02b10>100%</color>.","ความยากในการเล่น ""ฝันร้าย"", ความเสียหายของ AI เพิ่มขึ้น <color=#c02b10>100%</color>, การได้รับทรัพยากรของ AI เพิ่มขึ้น <color=#c02b10>100%</color>"
DLC1TipIdlerTitle,Inactive Character,ตัวละครที่ยังไม่ได้ลงมือ
DLC1TipIdlerContent,There are {0} Disciples who have not acted in the current round.,ในรอบปัจจุบันมีลูกศิษย์ {0} คนที่ยังไม่ได้ลงมือ
DLC1TipOverTitle,Disciples Overstaffed,จำนวนลูกศิษย์เกิน
DLC1TipOverContent,"Current Disciples exceed the sect's capacity limit, other Disciples will lose a lot of Mood each round.\nThrough the ""management"" function, force the excess Disciples to ""leave the sect"" (in story mode, it is ""rest"").","ลูกศิษย์ในปัจจุบันเกินขีดจำกัดที่สำนักรองรับได้, ศิษย์คนอื่นๆ ค่าอารมณ์จะลดลงอย่างมากในแต่ละรอบ\nผ่านฟังก์ชัน “บริหารสำนัก” จะบังคับให้ลูกศิษย์ส่วนเกิน “ออกจากสำนัก” (ในโหมดเรื่องจะเป็น “พักผ่อน”)"
DLC1JSScrollMap,Scroll Map,เลื่อนแผนที่
DLC1JSScrollCheck,Scroll Info,เลื่อนข้อมูล
DLC1JSTradeItemInfo,Product Information,ข้อมูลสินค้า
DLC1JSTraderChange,Switch Merchant,เปลี่ยนพ่อค้า
DLC1RealIncomeTip,Actual {0}-Disciple consumption {1},รายรับจริง {0} - ลูกศิษย์ใช้ {1}
DLC1LogPractiseSuccess,%lc%{0}'s {1} gained {2} points of Experience,%lc% {0} ของ {1} ได้รับ {2} แต้มประสบการณ์
DLC1RecruitLimitTip,%lc%Recruitment limit for this month has been reached,%lc% การรับสมัครในเดือนนี้ถึงขีดจำกัดแล้ว
DLC1AttackTip2,Please select a target to attack,กรุณาเลือกเป้าหมายที่จะโจมตี
DLC1AutoSaveClose,Disable auto-save,ยกเลิกบันทึกอัตโนมัติ
DLC1AutoSaveRound,Every {0} rounds,ทุก {0} รอบ
DLC1JSShowMoreInfoEnd,Show more,แสดงเพิ่มเติม
DLC1CharacterInfoRoundCost,Monthly consumption,ใช้จ่ายรายเดือน
DLC1CharacterInfoMood,Mood,อารมณ์
DLC1CharPropInfo_心情,"When a Character's Mood is too low, they will be unable to act. You can recover Mood by letting the Character not perform any actions or use items within a round.",เมื่อตัวละครมีอารมณ์ต่ำเกินไป จะไม่สามารถลงมือได้ สามารถฟื้นฟูอารมณ์ได้โดยให้ตัวละครไม่ทำกิจกรรมใดๆ ในรอบนั้นหรือใช้ไอเท็ม
DLC1CharPropInfo_每日消耗,The amount of money a Character needs to consume each month.,เงินที่ตัวละครต้องใช้จ่ายในแต่ละเดือน
DLC1CharPropInfo_体质,"The higher this value, the more <color=#a94e37>HP</color> will be increased each time you level up.",ยิ่งค่านี้สูงเท่าไร <color=#a94e37>HP</color> ที่เพิ่มขึ้นทุกครั้งที่เลื่อนระดับก็จะยิ่งสูงขึ้นเท่านั้น
DLC1CharPropInfo_臂力,"The higher this value, the more <color=#a94e37>Attack power</color> will be increased each time you level up.",ยิ่งค่านี้สูงเท่าไร <color=#a94e37>พลังโจมตี</color> ที่เพิ่มขึ้นทุกครั้งที่เลื่อนระดับก็จะยิ่งสูงขึ้นเท่านั้น
DLC1CharPropInfo_悟性,"The higher this value, the more <color=#a94e37>MP</color> will be increased each time you level up.",ยิ่งค่านี้สูงเท่าไร <color=#a94e37>MP</color> ที่เพิ่มขึ้นทุกครั้งที่เลื่อนระดับก็จะยิ่งสูงขึ้นเท่านั้น
DLC1CharPropInfo_敏捷,"The higher this value, the more <color=#a94e37>Action Speed</color> will be increased each time you level up.",ยิ่งค่านี้สูงเท่าไร <color=#a94e37>ความเร็วท่าร่าง</color> ที่เพิ่มขึ้นทุกครั้งที่เลื่อนระดับก็จะยิ่งสูงขึ้นเท่านั้น
DLC1CharPropInfo_福缘,"The higher this value, the more <color=#a94e37>Critical</color> will be increased each time you level up.",ยิ่งค่านี้สูงเท่าไร <color=#a94e37>คริติคอล</color> ที่เพิ่มขึ้นทุกครั้งที่เลื่อนระดับก็จะยิ่งสูงขึ้นเท่านั้น
DLC1CharPropInfo_生命,"In battle, having 0 HP means defeat.",ในการต่อสู้ เมื่อค่า HP เหลือ 0 จะหมายความว่า พ่ายแพ้
DLC1CharPropInfo_内力,The resource used to release martial arts in battle.,ทรัพยากรในการใช้วรยุทธ์ในการต่อสู้
DLC1CharPropInfo_攻击,"The higher this value, the more damage you will cause.",ยิ่งค่านี้สูงเท่าไร จะยิ่งสร้างความเสียหายสูงขึ้นเท่านั้น
DLC1CharPropInfo_防御,"The higher this value, the less damage you will take when hit.",ยิ่งค่านี้สูงเท่าไร จะทำให้เมื่อถูกโจมตีความเสียหายที่เกิดขึ้นจะน้อยลงเท่านั้น
DLC1CharPropInfo_拳掌,The condition for learning Fist-type martial arts.,เงื่อนไขการเรียนรู้วรยุทธ์ประเภทหมัดและฝ่ามือ
DLC1CharPropInfo_耍刀,The condition for learning Blade-type martial arts.,เงื่อนไขการเรียนรู้วรยุทธ์ประเภทดาบ
DLC1CharPropInfo_御剑,The condition for learning Sword-type martial arts.,เงื่อนไขการเรียนรู้วรยุทธ์ประเภทกระบี่
DLC1CharPropInfo_短兵,The condition for learning Short-type martial arts.,เงื่อนไขการเรียนรู้วรยุทธ์ประเภทอาวุธสั้น
DLC1CharPropInfo_长兵,The condition for learning Long-type martial arts.,เงื่อนไขการเรียนรู้วรยุทธ์ประเภทอาวุธยาว
DLC1CharPropInfo_命中,The probability of hitting an enemy (will be offset by the enemy's Evasion rate).,โอกาสที่จะโดนโจมตีศัตรู (จะถูกลดทอนด้วยอัตราหลบหลีกของศัตรู)
DLC1CharPropInfo_乐器,The condition for learning Musical-type martial arts.,เงื่อนไขในการเรียนรู้วรยุทธ์ดนตรี
DLC1CharPropInfo_暴击,"The probability of a Critical hit when hitting, if a Critical hit occurs, the damage will be doubled.",โอกาสที่เกิดการโจมตีคริติคอลเมื่อโจมตีโดน หากเกิดขึ้น ความเสียหายจะเพิ่มเป็นสองเท่า
DLC1CharPropInfo_闪避,"The probability of Evasion when hit, if Evasion is successful, the enemy's current attack will be invalid.",โอกาสที่จะหลบหลีกเมื่อถูกโจมตี หากหลบได้สำเร็จ การโจมตีของศัตรูในครั้งนั้นจะไม่มีผล
DLC1CharPropInfo_格挡,"The probability of Parry when hit, if Parry is successful, the enemy's current attack will only cause 50% damage.",โอกาสที่จะปัดป้องเมื่อถูกโจมตี หากปัดป้องสำเร็จ การโจมตีของศัตรูในครั้งนั้นจะทำให้เกิดความเสียหายเพียง 50%
DLC1CharPropInfo_集气速度,"The higher this value, the shorter the interval between each action.",ยิ่งค่านี้สูงเท่าไร จะทำให้ระยะเวลาระหว่างการโจมตีแต่ละครั้งสั้นลงเท่านั้น
DLC1AttackCharacterLimit,%lc% has reached the maximum number of people,%lc% ถึงขีดจำกัดจำนวนคนแล้ว
DLC1TaskShowOrHide,Task tracking,ติดตามภารกิจ
DLC1ActionsTip1,%lc% This door has launched an attack on {0}'s {1}.,%lc% สำนักนี้ได้ทำการโจมตี {0} ที่ {1}
DLC1ActionsTip2,%lc% The stability of {0} will increase by {1} points next month.,%lc% ความมั่นคงของ {0} จะเพิ่มขึ้น {1} แต้มในเดือนหน้า
DLC1ActionsTip3,%lc% {0} has comprehended {1}.,%lc% {0} ได้เข้าใจ {1}
DLC1ActionsTip4,%lc%{0}'s stationed Disciple has been resupplied.,%lc% ศิษย์ประจำการที่ {0} ได้รับการจัดส่งเสบียง
DLC1ActionsTip5,%lc% {0}'s {1} gained {2} points of Experience.,%lc% {0} ของ {1} ได้รับ {2} แต้มประสบการณ์
DLC1ActionsTip6,%lc% gained {0} points of Meditation.,%lc% ได้รับ {0} แต้มสมาธิ
DLC1ActionsTip7,%lc% {0} has been expelled from the sect,%lc% {0} ถูกขับไล่ออกจากสำนัก
DLC1ActionsTip8,%lc% {0} has been promoted to inner Disciple,%lc% {0} ได้เลื่อนตำแหน่งเป็นศิษย์ภายใน
DLC1ActionsTip9,%lc% {0} has joined the Sect,%lc% {0} เข้าร่วมสำนัก
DLC1ActionsTip10,%lc% has unlocked {0},%lc% ได้ปลดล็อก {0} แล้ว
DLC1ActionsTip11,%lc% has established trade relations with {0},%lc% ได้ทำการค้ากับ {0} สำเร็จแล้ว
DLC1ActionsTip12,%lc%Equipped with the same feature,%lc% ได้สวมใส่ทักษะพิเศษที่เหมือนกันแล้ว
DLC1ActionsTip13,%lc%Insufficient remaining points,%lc% แต้มที่เหลือไม่เพียงพอ
DLC1ActionsTip14,%lc% {0} has forgotten {1}.,%lc% {0} ลืม {1} ไปแล้ว
DLC1ActionsTip15,%lc% Character has reached max level,%lc% ตัวละครถึงระดับสูงสุดแล้ว
DLC1JoySelectCancel,"Select, cancel","เลือก, ยกเลิก"
DLC1JoyGo,Depart,ออกเดินทาง
DLC1JoyStoryToggle,Select event,เลือกเหตุการณ์
DLC1JoyInfoScroll,Scroll information,เลื่อนข้อมูล
DLC1JoyExit,Return,กลับ
DLC1ActionsTip16,"%lc% Relations with {0} have increased by {1}, currently at {2}.","%lc% กับ {0} ความสัมพันธ์เพิ่มขึ้น {1}, ขณะนี้อยู่ที่ {2}"
DLC1NameInput,Enter,กรอกข้อมูล
DLC1GameLog_InBattle_KungfuExpLevelUp,%lc%<#61C3C8>{0}</color>'s {1} has been upgraded to <#ff822f>{2}</color>,%lc%<#61C3C8>{0}</color> ของ {1} เพิ่มขึ้น至<#ff822f>{2}</color>
DLC1GameLog_InBattle_KungfuExpLevelUpNew,%lc%<#ff5555>{0}</color> successfully comprehended {1},%lc%<#ff5555>{0}</color> เข้าใจ {1} สำเร็จ
DLC1JSLocateFaction,Return to the sect,กลับสำนัก
DLC1TipLocateTitle,Focus on the sect,มุ่งเน้นไปที่สำนัก
DLC1TipLocateContent,"Click to focus the view on your own sect's headquarters.\nShortcut key【space】","คลิกเพื่อปรับมุมมองไปที่สำนักหลักของตนเอง\nปุ่มลัด【space】"
DLC1TipSettingTitle,Settings,ตั้งค่า
DLC1TipSettingContent,"Click to open the settings menu.\nShortcut key【ESC】","คลิกเพื่อเปิดเมนูการตั้งค่า\nปุ่มลัด【ESC】"
CharPropName_DLC1心情,DiscipleMood,อารมณ์ของลูกศิษย์
DLC1RecruitMemberTip,Number of Disciples: {1}/{0},จำนวนลูกศิษย์: {1}/{0}
SaveInfo_SlgSave,Manual Save,บันทึกเอง
SaveInfo_SlgAutoSave,Auto Save,บันทึกอัตโนมัติ
DLC1职位_掌门,Sect Leader,เจ้าสำนัก
DLC1职位_内门弟子,Inner Disciple,ศิษย์ใน
DLC1职位_外门弟子,Outer Disciple,ศิษย์นอก
DLC1职位简写_掌门,SL,SL
DLC1职位简写_内门弟子,In,เข้า
DLC1职位简写_外门弟子,Out,ออก
DLC1SlgMainCheckCharacter,InfoCharacter,ข้อมูลตัวละคร
DLC1Naming_Denied,"%c%The input contains sensitive words, please re-enter",%c% เนื้อหาที่กรอกมีคำต้องห้าม กรุณากรอกใหม่
DLC1ResourceNotEnough,%c%Insufficient resources,%c% ทรัพยากรไม่เพียงพอ
DLC1StartNewGameFail,%c%Force not unlocked,%c% อำนาจยังไม่ถูกปลดล็อก
DLC1EndText1,Sect,สำนัก
DLC1EndText2,Duration,ระยะเวลา
DLC1EndText3,Acquire resources,ได้รับทรัพยากร
DLC1EndText4,Disciple,ลูกศิษย์
DLC1EndText5,Journey,ประวัติ
DLC1EndText6,Return to main interface,กลับสู่หน้าหลัก
DLC1TechUnlockTip,<#E2BE59>Click the icon to unlock</color>,<#E2BE59>คลิกที่ไอคอนเพื่อปลดล็อก</color>
DLC1CharPropInfo_等级,"CharacterLevel:\nBased on the five dimensions of the Character, the higher the Level, the higher the Character's combat attributes.\nThe higher the Level, the more martial arts can be learned (up to 4).\nThe higher the Level, the more feature points can be used.","ระดับตัวละคร:\nระดับของตัวละครจะเพิ่มขึ้นตามค่าพลังทั้ง 5 ของตัวละครนั้น ยิ่งระดับสูงขึ้น ตัวละครก็จะยิ่งเก่งขึ้นในการต่อสู้\nยิ่งระดับสูงขึ้น ก็จะเรียนรู้วรยุทธ์ใหม่ๆ ได้มากขึ้น (สูงสุด 4 วิชา)\nยิ่งระดับสูงขึ้น ก็จะสามารถใช้แต้มพัฒนาตัวละครได้มากขึ้น"
DLC1CharPropInfo_职位,"Position:\nPalm, inner, and outer, respectively, mean that the position is the head of the sect, the inner Disciple, and the outer Disciple.\nThe maximum Level of the head of the sect is 10.\nThe maximum Level of the inner Disciple is 10, but the higher the salary to be paid each month.\nThe maximum Level of the outer Disciple is 6.","ตำแหน่ง:\nเจ้าสำนัก ศิษย์ภายในสำนัก และศิษย์ภายนอกสำนัก\nเจ้าสำนักมีระดับสูงสุดที่ 10\nศิษย์ภายในสำนักมีระดับสูงสุดที่ 10 แต่ต้องจ่ายเงินเดือนสูงขึ้นทุกเดือน\nศิษย์ภายนอกสำนักมีระดับสูงสุดที่ 6"
DLC1PageForeign_交好,"Make friends:\nYou can execute once per month for each force.\nYou can give Coins, items, and improve the Relations between the other sect and my sect.","ผูกมิตร:\nทุกเดือนสามารถทำการกระทำเพื่อปรับปรุงความสัมพันธ์กับสำนักอื่นได้ 1 ครั้ง\nสามารถมอบเงิน, สิ่งของ ให้กับสำนักอื่นเพื่อเพิ่มความสัมพันธ์"
DLC1PageForeign_贸易,"Trade:\nWhen Relations with other sects are good, you can apply to trade with them.\nAfter reaching a trade, my sect will receive the equivalent income of the other's base camp every month.\nYou can Info the estimated resources of the trade through the interface below.","แลกเปลี่ยน:\nเมื่อความสัมพันธ์กับสำนักอื่นดีขึ้น สามารถทำการค้าขายกับสำนักนั้นได้\nการทำการค้าจะทำให้ได้รับทรัพยากรจากสำนักที่ทำการค้าด้วยทุกเดือน\nสามารถตรวจสอบปริมาณทรัพยากรที่จะได้รับจากการค้าได้จากหน้าจอด้านล่าง"
DLC1PageForeign_和解,"Reconciliation:\nWhen Relations are very poor, you can pay Coins to reconcile with the other party, and the worse the Relations, the more Coins you need to consume.\nReconciliation may not be successful, the other sect will decide whether to reconcile with you based on the power gap between each other.\nAfter successful reconciliation, the Relations of both parties will return to 0.","การไกล่เกลี่ย:\nเมื่อมีความสัมพันธ์กับสำนักอื่นแย่มาก สามารถใช้เงินเพื่อไกล่เกลี่ย ยิ่งความสัมพันธ์แย่มากเท่าไหร่ ก็ต้องใช้เหรียญทองมากขึ้นเท่านั้น\nการไกล่เกลี่ยอาจจะสำเร็จหรือล้มเหลว ขึ้นอยู่กับความแตกต่างของพลังอำนาจระหว่างทั้งสองสำนัก\nหากไกล่เกลี่ยสำเร็จ ความสัมพันธ์จะกลับมาเป็นศูนย์"
