﻿sto-notice-1,"Within two months, send Disciple to hunt down the escaped Ding siblings."
sto-notice-2,Accompany Duke Kang to Langya Sword Pavilion for the ceremony.
sto-notice-3,Go to Peak of Challenge for a martial arts competition.
sto-notice-4,Continue to develop the sect.
sto-notice-5,Deal with the ronin from Great Ant City who came to challenge.
sto-notice-6,"Within two months, send Disciple to hunt down the escaped Ding siblings."
sto-notice-7,Accompany King Chai to Taoist Sect for the ceremony.
sto-notice-8,Deal with the ronin from Great Ant City who came to challenge.
sto-notice-9,Collect supplies for King Chai.
sto-notice-10,"You have discovered King Chai's ambush, strike first for the advantage. (Failure or expiration of this event may result in game over)"
sto-notice-11,Defeat the arrogant official army that came to suppress the bandits (Failure of this event may result in game over)
sto-notice-12,Dealing with the government's extortionate levies
sto-notice-13,Deal with the attack from Crime Investigation Bureau (Failure or expiration of this event may result in game failure)
sto-notice-14,Dealing with the Imperial City Bureau's unreasonable taxation
sto-notice-15,Deal with the revenge of Tong Daofu (Failure or expiration of this event may result in game failure)
sto-notice-16,Dealing with Duke Kang's manor's forced requisition of supplies
sto-notice-17,Negotiate with Ye Family Battalion of Bao Sect (Failure or expiration of this event may result in game failure)
sto-notice-18,Meet with the heads of the three sects at Peak of Challenge.
sto-notice-19,Attend the amnesty conference hosted by Qin Huizhi.
sto-notice-20,Deal with the ronin from Great Ant City who came to challenge.
sto-notice-21,"You have discovered King Chai's ambush, strike first for the advantage. (Failure or expiration of this event may result in game over)"
sto-main-1_1_1,"Although not everyone has the chance to enter a different world,\nBut like you screaming loudly from the sky \nAnd landing on a tree branch is a one in a million encounter.\nThe good news is, this is a martial arts world that you dream about.\nThe bad news is, a difficult and life-threatening choice is imminent..."
sto-main-1_1_2,"Ouch, ouch, ouch, ouch, ouch!"
sto-main-1_1_3,Damn it... I have to be thrown down from the sky after crossing over!
sto-main-1_1_4,"Wait, why is there suddenly the sound of girls arguing below?"
sto-main-1_1_5,Why is there no road...
sto-main-1_1_6,"Luo Qianxue, if you continue to pursue me relentlessly, don't blame me for being ruthless!"
sto-main-1_1_7,"I'm not afraid of you, little thief! Take this, Sumeru Sword!"
sto-main-1_1_8,"Hmph, take my Wind Stab!"
sto-main-1_1_9,"Both parties are injured and kneel on the ground after exchanging blows,\nThis awkward stalemate might continue indefinitely without outside interference..."
sto-main-1_1_10,<size=200%>Achoo!!!!!
sto-main-1_1_11,"Sorry, I didn't mean to interrupt you two.\nYou continue to shout your move names, I'll go back to sleep in the tree."
sto-main-1_1_12,"Help me deal with this woman, I'll give you money!"
sto-main-1_1_13,"Young hero, this woman is a notorious female thief, capturing her is a great merit!"
sto-main-1_1_14,"Strange, why does this scene seem so familiar... Who should I help? What a headache..."
sto-main-1_op_1_1,Help the cold masked woman.
sto-main-1_op_1_2,Help the handsome young constable.
sto-main-1_2_1,"I'm suspicious myself, how can I help the official?"
sto-main-1_3_1,"...I didn't expect you to be in the same league with that thief, I'll come back another day to learn from you!"
sto-main-1_3_2,"By the way, I am Swallow's Nest Disciple Hua Qingqing, thank you for saving my life!"
sto-main-1_3_3,"I am {PlayerName}, Miss Hua, are your injuries serious?"
sto-main-1_3_4,{PlayerName}... I will remember this name.
sto-main-1_3_5,"My injuries are not severe, just a bit painful... It's getting late, and it's not safe to stay here for long. There's a Nameless village ahead, could you escort me there for treatment?"
sto-main-1_4_1,"Luo Qianxue, if you dare, take this move from me!"
sto-main-1_4_2,"I'll take it, cough cough... Shameless scoundrel, you actually used Lime powder to sneak attack!"
sto-main-1_4_3,"You fool, what are you standing there for? If we don't leave now, it'll be too late!"
sto-main-1_5_1,"It seems that the Constable is catching thieves, let me lend a hand."
sto-main-1_6_1,You... you'll regret this! Just you wait!
sto-main-1_6_2,"I am Luo Qianxue, a Constable from the Crime Investigation Bureau. Thank you for your help, young hero!"
sto-main-1_6_3,"I am {PlayerName}, I hope Miss Luo's injuries are not serious?"
sto-main-1_6_4,"Thank you for your concern, {PlayerSurName}... Although I'm injured, it's not serious."
sto-main-1_6_5,"It's getting late, and it's dangerous to stay here. There's a Nameless village nearby, it's safe to rest there for a few days."
sto-main-1_7_1,"Thief, take my unique Throwing move!"
sto-main-1_7_2,"Luckily, I dodged in time... Wait, you're tricking me!"
sto-main-1_7_3,"Young hero, let's take this opportunity to run away!"
sto-main-2_1_1,"The mountain road is difficult to traverse. Hua Qingqing stubbornly insisted on walking by herself, but almost fell. Fortunately, you were quick to react and saved her from a disaster. The weak her finally put down her pride, silently leaning her head on your shoulder, breathing softly."
sto-main-2_1_2,"Miss Hua, the Nameless village you mentioned should be just ahead."
sto-main-2_1_3,"Gentlemen from the Blue Wind Camp, our village is really poor, please spare us..."
sto-main-2_1_4,"You old liar, trying to fool us with lies. If the village has no money, how come your grandson is so well-fed!"
sto-main-2_1_5,"Stop wasting time with this old man, let's search the whole village. If we find a single coin, we'll slaughter his grandson first!"
sto-main-2_1_6,Grandpa! Grandpa! Xiao Bao is in pain!
sto-main-2_1_7,Stop! Let the child go!
sto-main-2_1_8,"Where did this wild boy come from? Trying to be a hero, haha, go back to your milk!"
sto-main-2_1_9,"He alone is not your match, but with me, it's more than enough."
sto-main-2_2_1,"You wait for me! When I get back to the camp, I'll make sure our leader kills you all!"
sto-main-2_2_2,"Damn, the Mountain Bandit ran too fast, we couldn't annihilate them all..."
sto-main-2_2_3,"On behalf of the entire Nameless village, thank you both for saving our lives!"
sto-main-2_2_4,"Don't thank me, thank that fool. If it wasn't for him, I wouldn't have risked my life for you."
sto-main-2_2_5,"Grandpa, the big brother and big sister are so powerful, just like the heroes in the storybooks!"
sto-main-2_2_6,"Young hero, I have a request..."
sto-main-2_2_7,"Please speak, Village Head. As long as I can do it, I won't refuse."
sto-main-2_2_8,"That Mountain Bandit managed to escape from you two, he will definitely go back to the camp and report. As you've seen, the villagers can't resist the Blue Wind Camp's revenge."
sto-main-2_2_9,"Both of you are highly skilled, I beg you to stay for a while and protect our village. I have some savings at home, which you can use to train the villagers, recruit soldiers and buy horses."
sto-main-2_2_10,"Well, this is interesting. You say protector, but it sounds more like the leader of a small sect."
sto-main-2_2_11,"Young hero, if you wish to manage this humble village into a sect, it's not a problem. Apart from my grandson and I who are incapable of fighting, the other villagers would be blessed to receive martial arts teachings from the two of you."
sto-main-2_2_12,"Starting with a sect and then dominating the martial world, this is too cool!"
sto-main-2_2_13,What should I name my sect?
sto-main-2_2_14,"Don't run away if you dare, let's see if our Blue Wind Camp can flatten this broken village <color=#a94e37>three months later</color>. If you know what's good for you, clean yourself up and wait for death!"
sto-main-2_2_15,"The young ladies in the village don't need to worry, our brothers in the Blue Wind Camp know how to cherish beauty, we guarantee to let you wear gold and silver, eat and drink well."
sto-main-2_2_16,"Bold bandits, dare to speak wildly to this lady, leave your life behind!"
sto-main-2_2_17,"I dodged~ Didn't hit me, hehe!"
sto-main-2_3_1,"I've decided, let's call it {MyFaction}!"
sto-main-2_3_2,Good name! I can finally retire behind the scenes and resign from the position of Village Head.
sto-main-2_3_3,"{MyFaction}, interesting, you are quite good at naming."
sto-main-2_3_4,"Miss Hua, you always praise me, it's really embarrassing~"
sto-main-2_3_5,"I say, your little sect now has two or three cats, do you need this lady to show mercy and temporarily join to help you deal with Blue Wind Camp~"
sto-main-2_3_6,"That would be great! But... Miss Hua, don't you already have a sect?"
sto-main-2_3_7,"Stubborn, who says we martial artists can only have one sect? But let's make it clear in advance, this lady won't be the one doing the chores like cooking, washing dishes, mopping the floor, planting vegetables, don't look for me!"
sto-main-2_3_8,"Miss Hua, our sect warmly welcomes your joining!"
sto-main-2_3_9,"We have experienced inseparable friendship, if you continue to be so polite, I will be angry! Just call me Qingqing~"
sto-main-2_3_10,"Qingqing, let's make a big splash together!"
sto-main-2_3_11,"By the way, we have experienced inseparable friendship, don't keep calling me Miss Hua, just call me Qingqing."
sto-main-2_3_12,"So Qingqing, our sect has just started, how can we quickly improve our strength to resist those bastards from Blue Wind Camp? To be honest, I'm a little unsure..."
sto-main-2_3_13,"You are good at everything, but lack experience in the martial arts world, let this lady teach you~"
sto-main-2_3_14,"During this time, you can send disciples out for training to improve their level, or let the disciples master a new martial art to directly enhance their combat power."
sto-main-2_3_15,"In addition, you can unlock corresponding martial arts features in the sect planning, and outfitting disciples with them can also quickly improve their strength."
sto-main-2_3_16,"How about it, did you get it~"
sto-main-2_3_17,"With the intelligence of this sect leader, of course I understand clearly. Now everything is ready, just need some handy weapons and treasures!"
sto-main-2_3_18,"In order to help young hero {PlayerSurName} repel Blue Wind Camp and protect the peace of our village, I dare not hide anything anymore."
sto-main-2_3_19,"When I was young, I once helped a young hero with unparalleled martial arts. To express his gratitude, he specially gave me three treasures he carried with him."
sto-main-2_3_20,"I later learned that this person was the unnamed hero who dominated the martial arts world forty years ago, and even the three treasures he gave were all famous treasures in the martial arts world!"
sto-main-2_3_21,"These treasures are indeed too precious, I originally intended to let them accompany me to the grave. Alas, I didn't expect to have to part with them today... {PlayerSurName} young hero, you must not let down my intentions!"
sto-main-2_3_22,"Rest assured, sir, although I don't know who this nameless hero is, I will definitely make good use of these three martial arts treasures and vow to protect the village at the cost of my life!"
sto-main-2_3_23,"Grandpa, didn't you say something similar to the antique collector who came to the village before?"
sto-main-2_3_24,……
sto-main-2_3_25,"Xiao Bao, don't be silly, how could grandpa sell the treasures of the nameless hero as antiques?"
sto-main-2_3_26,"Grandpa did say that! But you also said that these three treasures were won in a competition with the nameless hero for digging earthworms, Xiao Bao doesn't know which one is true!"
sto-main-2_3_27,"Cough cough... how they came is not important, not important..."
sto-main-2_3_28,"Although the origins of these three treasures are suspicious, in order to resist the attack of the Blue Wind Camp, it's better to try them on quickly..."
sto-main-2_4_1,"In the vast night, Luo Qianxue supported her injured body with her sword and slowly moved forward. You, who couldn't bear to see this, offered to carry her the rest of the way. The imposing female constable's face flashed with a hint of shyness, but she didn't refuse at all."
sto-main-2_4_2,"Miss Luo, the Nameless village you mentioned should be just ahead."
sto-main-2_4_3,"Gentlemen from the Blue Wind Camp, our village is really poor, please spare us..."
sto-main-2_4_4,"You old liar, trying to fool us with lies. If the village has no money, how come your grandson is so well-fed!"
sto-main-2_4_5,"Stop wasting time with this old man, let's search the whole village. If we find a single coin, we'll slaughter his grandson first!"
sto-main-2_4_6,Grandpa! Grandpa! Xiao Bao is in pain!
sto-main-2_4_7,Stop! Let the child go!
sto-main-2_4_8,"Where did this wild boy come from? Trying to be a hero, haha, go back to your milk!"
sto-main-2_4_9,"Crime Investigation Bureau Luo Qianxue is here... Die, thief!"
sto-main-2_5_1,"You wait for me! When I get back to the camp, I'll make sure our leader kills you all!"
sto-main-2_5_2,"Damn, the Mountain Bandit ran too fast, we couldn't annihilate them all..."
sto-main-2_5_3,"On behalf of the entire Nameless village, thank you both for saving our lives!"
sto-main-2_5_4,"Sir, I just did a little bit, all the credit goes to {PlayerSurName} young hero."
sto-main-2_5_5,"Grandpa, the big brother and big sister are so powerful, just like the heroes in the storybooks!"
sto-main-2_5_6,"Young hero, I have a request..."
sto-main-2_5_7,"Please speak, Village Head. As long as I can do it, I won't refuse."
sto-main-2_5_8,"That Mountain Bandit managed to escape from you two, he will definitely go back to the camp and report. As you've seen, the villagers can't resist the Blue Wind Camp's revenge."
sto-main-2_5_9,"Both of you are highly skilled, I beg you to stay for a while and protect our village. I have some savings at home, which you can use to train the villagers, recruit soldiers and buy horses."
sto-main-2_5_10,"Training villagers, recruiting soldiers and buying horses... Does the Village Head want us to teach the villagers martial arts and let them master self-defense skills?"
sto-main-2_5_11,"Exactly, if the young hero thinks that teaching martial arts is related to the master-disciple relationship, then I will let the villagers all worship you two as masters, and it's no harm to turn this Nameless village into a sect!"
sto-main-2_5_12,"Starting with a sect and then dominating the martial world, this is too cool!"
sto-main-2_5_13,What should I name my sect?
sto-main-2_5_14,"Don't run away if you dare, let's see if our Blue Wind Camp can flatten this broken village <color=#a94e37>three months later</color>. If you know what's good for you, clean yourself up and wait for death!"
sto-main-2_5_15,"The young ladies in the village don't need to worry, our brothers in the Blue Wind Camp know how to cherish beauty, we guarantee to let you wear gold and silver, eat and drink well."
sto-main-2_5_16,"Madman, shut up, take my sword!"
sto-main-2_5_17,"I dodged~ Didn't hit me, hehe!"
sto-main-2_6_1,"I've decided, let's call it {MyFaction}!"
sto-main-2_6_2,Good name! I can finally retire behind the scenes and resign from the position of Village Head.
sto-main-2_6_3,"{PlayerSurName} young hero, I didn't expect you to be so good at naming."
sto-main-2_6_4,"Miss Luo, don't praise me, I'm shy~"
sto-main-2_6_5,"Blue Wind Camp is threatening the villagers here, as a member of the Crime Investigation Bureau, I can't just sit by and do nothing. {PlayerSurName} young hero, can Qianxue join your sect..."
sto-main-2_6_6,"That's great! But... Miss Luo, don't you already have a master?"
sto-main-2_6_7,"The Crime Investigation Bureau is not a strict martial arts sect in the traditional sense, so there aren't many restrictions on accepting a master and learning, so..."
sto-main-2_6_8,"Miss Luo, our sect warmly welcomes your joining!"
sto-main-2_6_9,"{PlayerSurName} young hero is too polite, my life was saved by you, just call me Qianxue..."
sto-main-2_6_10,"Qianxue, let's make a big splash!"
sto-main-2_6_11,"The Crime Investigation Bureau is not a strict martial arts sect in the traditional sense, so there aren't many restrictions on accepting a master and learning, so..."
sto-main-2_6_12,"{PlayerSurName} young hero, since you saved my life, you don't have to be so polite, just call me Qianxue."
sto-main-2_6_13,"So Qianxue, our sect has just started, how can we quickly improve our strength to resist those bastards from Blue Wind Camp? To be honest, I'm a little unsure..."
sto-main-2_6_14,"My brother taught me some strategies for sect development before, um... I remember!"
sto-main-2_6_15,"During this time, you can send disciples out for training to improve their level, or let the disciples master a new martial art to directly enhance their combat power."
sto-main-2_6_16,"In addition, you can unlock corresponding martial arts features in the sect planning, and outfitting disciples with them can also quickly improve their strength."
sto-main-2_6_17,"{PlayerSurName} young hero, do you understand what I'm saying?"
sto-main-2_6_18,"With the intelligence of this sect leader, of course I understand clearly. Now everything is ready, just need some handy weapons and treasures!"
sto-main-2_6_19,"In order to help young hero {PlayerSurName} repel Blue Wind Camp and protect the peace of our village, I dare not hide anything anymore."
sto-main-2_6_20,"When I was young, I once helped a young hero with unparalleled martial arts. To express his gratitude, he specially gave me three treasures he carried with him."
sto-main-2_6_21,"I later learned that this person was the unnamed hero who dominated the martial arts world forty years ago, and even the three treasures he gave were all famous treasures in the martial arts world!"
sto-main-2_6_22,"These treasures are indeed too precious, I originally intended to let them accompany me to the grave. Alas, I didn't expect to have to part with them today... {PlayerSurName} young hero, you must not let down my intentions!"
sto-main-2_6_23,"Rest assured, sir, although I don't know who this nameless hero is, I will definitely make good use of these three martial arts treasures and vow to protect the village at the cost of my life!"
sto-main-2_6_24,"Grandpa, didn't you say something similar to the antique collector who came to the village before?"
sto-main-2_6_25,……
sto-main-2_6_26,"Xiao Bao, don't be silly, how could grandpa sell the treasures of the nameless hero as antiques?"
sto-main-2_6_27,"Grandpa did say that! But you also said that these three treasures were won in a competition with the nameless hero for digging earthworms, Xiao Bao doesn't know which one is true!"
sto-main-2_6_28,"Cough cough... how they came is not important, not important..."
sto-main-2_6_29,"Although the origins of these three treasures are suspicious, in order to resist the attack of the Blue Wind Camp, it's better to try them on quickly..."
sto-main-2_name,Main Quest
sto-main-2_log,"By dispatching experience, learning martial arts and sect planning, quickly improve the sect's strength to resist the attack three months later."
sto-main-3_1_1,"People of {MyFaction}, listen to me!"
sto-main-3_1_2,"The leader Kong has ordered, <color=#a94e37>three months later</color>, the No Name Village will be completely wiped out. If you are wise, clean yourself up and wait for death peacefully!"
sto-main-3_1_3,"The ladies in the village don't have to worry, our brothers in Blue Wind Camp know how to cherish beauty, we guarantee that you will be dressed in gold and silver, eat and drink well, and strive to become the lady of the camp!"
sto-main-3_2_1,"You audacious bandit, dare to speak wildly to my sect? Don't leave, take my sword!"
sto-main-3_2_2,"Qingqing, let it go."
sto-main-3_2_3,{PlayerName}! Don't boost others' morale and destroy your own!
sto-main-3_2_4,"He's using a provocation tactic, specifically to deceive little fools like you..."
sto-main-3_2_5,"Humph, if I'm a little fool, then you're a big fool!"
sto-main-3_2_6,"Let's not argue about who's the fool, if we don't prepare, when the bandit army of Blue Wind Camp arrives in three months, we and the villagers will be done for."
sto-main-3_2_7,"They just got a bloody nose here last time, and they're talking about three months... If you ask me, they might not even come in three years, who can't bluff?"
sto-main-3_2_8,"Then let's wait and see, don't let me save you again. Don't believe me, let's bet."
sto-main-3_2_9,"Bet it is, I've never lost a bet!"
sto-main-3_3_1,Huff...
sto-main-3_3_2,"Our Qianxue is still the most composed, indifferent to the enemy's provocation."
sto-main-3_3_3,"Young hero {PlayerSurName}, give me a moment, I'll go down and kill him now."
sto-main-3_3_4,"...Impulsiveness is the devil, Qianxue!"
sto-main-3_3_5,"Here's what, I promise you, when the day comes that Blue Wind Camp launches a major attack, I'll make this arrogant guy kneel on the ground crying for mercy."
sto-main-3_3_6,I believe you... What should we do now?
sto-main-3_3_7,"Of course, seize the opportunity to quickly develop our {MyFaction}, accumulate strength and give them a hard hit!"
sto-main-3_3_8,"Good, count me in when the time comes!"
sto-main-3_name,Main Quest
sto-main-3_log,Resist the major attack of Blue Wind Camp after 3 rounds
sto-main-3_4_1,"Indeed, heroes come from youth, I didn't misjudge you!"
sto-main-3_4_2,"In order to help young hero {PlayerSurName} repel Blue Wind Camp and protect the peace of our village, I dare not hide anything anymore."
sto-main-3_4_3,"When I was young, I once helped a young hero with unparalleled martial arts. To express his gratitude, he specially gave me three treasures he carried with him."
sto-main-3_4_4,"I later learned that this person was the unnamed hero who dominated the martial arts world forty years ago, and even the three treasures he gave were all famous treasures in the martial arts world!"
sto-main-3_4_5,"These treasures are indeed too precious, I originally intended to let them accompany me to the grave. Alas, I didn't expect to have to part with them today... {PlayerSurName} young hero, you must not let down my intentions!"
sto-main-3_4_6,"Rest assured, sir, although I don't know who this nameless hero is, I will definitely make good use of these three martial arts treasures and vow to protect the village at the cost of my life!"
sto-main-3_4_7,"Grandpa, didn't you say something similar to the antique collector who came to the village before?"
sto-main-3_4_8,……
sto-main-3_4_9,"Xiao Bao, don't be silly, how could grandpa sell the treasures of the nameless hero as antiques?"
sto-main-3_4_10,"Grandpa did say that! But you also said that these three treasures were won in a competition with the nameless hero for digging earthworms, Xiao Bao doesn't know which one is true!"
sto-main-3_4_11,"Cough cough... how they came is not important, not important..."
sto-main-3_4_12,"Although the origins of these three treasures are suspicious, in order to resist the attack of the Blue Wind Camp, it's better to try them on quickly..."
sto-main-4_1_1,"Leader {PlayerSurName}, that Kong Yidao has surrounded our sect with numerous mountain bandits from Blue Wind Camp, they could attack at any time..."
sto-main-4_1_2,"Don't panic, a trained army takes time to deploy, I've been working hard for the past three months, I'm not afraid of a few mountain bandits."
sto-main-4_2_1,"How about it, Qingqing, willing to admit defeat in the bet?"
sto-main-4_2_2,"Humph, didn't expect those stupid mountain bandits to really dare to come, good, I'll kill one for each one that comes, and a pair for two!"
sto-main-4_2_3,"Don't rush to kill, first give me the dried sweet potatoes you lost in the bet."
sto-main-4_2_4,"No dried sweet potatoes, only one life! I ate them all!"
sto-main-4_2_5,"You, Hua Qingqing..."
sto-main-4_2_6,"I really can't do anything with you, let's go, let's go kill some mountain bandits together."
sto-main-4_2_7,"Hehe, let's go, let's go kill some mountain bandits!"
sto-main-4_3_1,"How about it, Qianxue, have you found that ugly monster who was rude to you?"
sto-main-4_3_2,"Yes, I'm watching him."
sto-main-4_3_3,"Keep an eye on him, don't let this guy run away when the fight starts."
sto-main-4_3_4,"Young hero {PlayerSurName}, don't forget I'm from the Crime Investigation Bureau! There's only the ones I can't beat, not the ones I can't chase."
sto-main-4_3_5,"Alright, let's divide the work. You take on that ugly monster, and I'll fight Kong Yidao. Let's have a good cooperation~"
sto-main-4_3_6,Hmm...
sto-main-4_3_7,Happy cooperation!
sto-main-4_name,Main Quest
sto-main-4_log,"Dispatch disciples through ""Events"" to counterattack Blue Wind Camp (Failure or overdue of this event will result in game failure)"
sto-fj-1_name,Attack of Blue Wind Camp
sto-fj-1_log,"Blue Wind Camp has completely surrounded your sect, intending to completely eradicate this thorn in their eye!"
sto-fj-1_1_1,"Your name is all wrong, a single slash can't split an invincible person. I'll show some kindness and give you a new name, how about Kong Hundred Blades? Hahaha!"
sto-fj-1_1_2,"You're just a sharp-tongued woman, watch me tear your mouth apart!"
sto-fj-1_1_3,"Take a good look around, Master Kong. What are you going to use to tear our Qingqing's mouth?"
sto-fj-1_1_4,"Master Kong, our {0} sect leader has ordered to completely eradicate Blue Wind Camp in three months. If you know what's good for you, clean yourself up and wait for death!"
sto-fj-1_1_5,"Hmph, let's go!"
sto-fj-1_1_6,"{1}, give me a high five to celebrate this great victory!"
sto-fj-1_1_7,"No need for a high five, just give me the dried sweet potatoes."
sto-fj-1_1_8,Don't even think about it!
