Story-part9_2_3,"Such a wonderful sound of nature, really makes me miss the time when I was still at home..."
Story-part9_2_4,"My lost son should still be alive somewhere, maybe he even has a baby now..."
Story-part9_2_5,"Fellow villagers, Qincheng will run away from here later, and I want to play a few more songs while there is still a little time left."
Story-part9_2_6,"Miss Qincheng, your hands must be sore from playing the piano for so long, come down and rest for a while."
Story-part9_2_7,"Qincheng has been with the piano since she was a child, as long as she can bring strength to everyone, no matter how long she plays, she will not be tired."
Story-part9_2_8,"Eh? It's {PlayerSurName} Sect Leader, why are you here..."
Story-part9_2_9,"This is the territory of my sect, {PlayerSurName} can come here of course, on the contrary, Miss Qincheng, you are the one who came uninvited haha~"
Story-part9_2_10,"After the fall of Melody House, Gu Qingcheng originally planned to travel overseas to study foreign instruments, but when she passed by the Refugee Camp, she saw these pitiful people who were sad because they had to leave their homes."
Story-part9_2_11,"Gu Qingcheng couldn't bear to see their suffering, so she played a song called ""Dancing Butterfly Over Skyline"" to soothe their pain, which unexpectedly became very popular."
Story-part9_2_12,"In order not to disappoint everyone, she decided to stay a few more days... Gu Qingcheng will leave now, promising not to cause any trouble for your faction."
Story-part9_op_1_1,Support Gu Qingcheng
Story-part9_op_1_2,Retain Gu Qingcheng
Story-part9_3_1,"There's no need to worry about bothering or not bothering, if Miss Gu Qingcheng has the heart to study abroad, let the head of this faction send you off."
Story-part9_3_2,"When Gu Qingcheng returns from her studies, she will definitely visit your faction. This music score can be considered as an apology for my two visits."
Story-part9_4_1,"These refugees were depressed all day long, but now they are calm and satisfied. Is this the power of music..."
Story-part9_4_2,"Miss Gu Qingcheng, why don't you stay here? Your music will definitely be a great help to comfort the people!"
Story-part9_4_3,"Gu Qingcheng really wants to join your faction, but she can't betray her ideals..."
Story-part9_4_4,"How about this, when Gu Qingcheng returns from her studies, she will definitely visit your faction. This music score can be considered as an apology for my two visits."
Story-part9_5_1,"Leader, the girl who performed at the Refugee Camp suddenly left, and we don't know where she went."
Story-part9_5_2,"It's good that such a person who disturbs the people's minds has left, so the leader doesn't have to worry about it."
Story-part10_1_1,"Leader, Miss Gu Qingcheng suddenly came to visit."
Story-part10_1_2,"I didn't expect Miss Gu Qingcheng to return from abroad so soon, I wonder if her studies went smoothly?"
Story-part10_name,Gu Qingcheng visits
Story-part10_log,Gu Qingcheng returns from her overseas journey and visits your faction.
Story-part10_2_1,"{PlayerSurName} Leader, Gu Qingcheng greets you~"
Story-part10_2_2,"Miss Gu Qingcheng, it's been a long time. Was your overseas study journey as smooth as you imagined?"
Story-part10_2_3,"Although it was different from what Gu Qingcheng thought, overall it was smooth. I wonder if {PlayerSurName} leader has the leisure to listen to what Gu Qingcheng saw and thought on the way?"
Story-part10_2_4,"Miss Gu Qingcheng, just say it, I will definitely listen attentively!"
Story-part10_2_5,"My first stop after going out to sea was the country of Xinji, which is good at playing the Gayageum."
Story-part10_2_6,"This instrument is said to be made by imitating the Guzheng of our country, with one string and one pillar, but with a wider range and louder volume."
Story-part10_2_7,"Xinji is weak, and the king often has to fuel war with warfare to protect himself, but he loses more than he wins. Therefore, the people of Xinji often play this instrument to express their sorrow for the country, which is sad and melodious, but also long and melodious."
Story-part10_2_8,I didn't expect that there would be such a lamentable story behind an instrument...
Story-part10_2_9,"Gu Qingcheng wants to ask {PlayerSurName} leader, how do you view the choice of this king of Xinji?"
Story-part10_op_1_1,"Better to be a broken jade than a complete tile, he has done his best"
Story-part10_op_1_2,"For his own honor and disgrace, he just forced the people"
Story-part10_3_1,"As the saying goes, it's better to be a broken jade than a complete tile. From the king's point of view, he has done his best and left the rest to fate."
Story-part10_3_2,"I see, Gu Qingcheng understands..."
Story-part10_4_1,"This choice is just to preserve his own honor and face, forcing the people to suffer."
Story-part10_4_2,"Such relentless warfare, if defeated, needless to say, even if victorious, what's the point? Countless resources are wasted on armaments, and the people are still not clothed and fed properly."
Story-part10_4_3,"Qingcheng shares the same view with the head of {PlayerSurName}, as Han Feizi once said: ""A small country that does not humble itself, a weak country that does not fear the strong, is doomed to perish."""
Story-part10_4_4,"In the end, this new king of Jixi is just unwilling to bear the responsibility of the country's demise, but he didn't realize that his actions would only hasten the downfall of the nation."
Story-part10_5_1,"After that, Qingcheng continued her journey westward and arrived in Ryukyu."
Story-part10_5_2,"There is a musical instrument here called the Shamisen, which is said to have been invented by a blind artist."
Story-part10_5_3,"The biggest feature of this instrument is that it doesn't need tuning, it can be played improvisationally, and it can even be used as a drum by striking the body of the instrument with a plectrum."
Story-part10_5_4,"It is said that the blind artist once bet with a rich man using the Shamisen, that if he could play continuously for three days and nights without rest, his son could have a bowl of white rice."
Story-part10_5_5,Qingcheng has a question and hopes that the head of {PlayerSurName} can help answer it.
Story-part10_5_6,"Although white rice is not readily available in my Zhao country, it is not a rare commodity. Why did the blind artist go to such lengths just to let his son taste rice?"
Story-part10_op_2_1,The artist is blind and cannot discern the quality of food.
Story-part10_op_2_2,The son is picky and insists on eating the rice from the general's house.
Story-part10_op_2_3,The wise king determines the value based on the country's situation.
Story-part10_6_1,"It must be that the old artist is blind, his cognition is reversed since childhood, and he cannot discern the quality of food."
Story-part10_6_2,"I see, Gu Qingcheng understands..."
Story-part10_7_1,"It must be that the son is picky, does not appreciate his father's hard work, and insists on eating the rice from the rich man's house."
Story-part10_7_2,"I see, Gu Qingcheng understands..."
Story-part10_8_1,"It must be that the wise king, knowing that the country's agriculture is backward, deliberately inflated the value of grain to attract the people to plant widely."
Story-part10_8_2,"Exactly! Ryukyu is surrounded by sea and mountains, relying on the sea for food but lacking in grain. Once the luck is bad and the sea products are short, many people starve to death."
Story-part10_8_3,"The king of Ryukyu does not want the people to rely solely on the grace of God for food and not know how to farm, so he tries to raise the price of grain to encourage the people to reclaim wasteland, and ultimately save as many people as possible during the famine."
Story-part10_9_1,"After studying in these two countries, Qingcheng suddenly felt homesick and returned to Zhao country."
Story-part10_10_1,"The question Qingcheng just asked is not only an impression from the journey, but also a presumptuous test of the character of the head of {PlayerSurName}..."
Story-part10_10_2,"Unexpectedly, the head of {PlayerSurName} is not only a martial arts master, but also a virtuous person who cares about the common people. What's more rare is that it completely aligns with what I think..."
Story-part10_10_3,"Qingcheng is determined to join {MyFaction}, and hopes that the head of {PlayerSurName} will fulfill her wish!"
Story-part10_10_4,"I didn't expect that Miss Qingcheng is not only stunningly beautiful, but also has such an orchid heart, worrying about the country and the people!"
Story-part10_10_5,"From now on, you are a part of my {MyFaction}!"
Story-part10_11_1,"Head of {PlayerSurName}, Qingcheng is feeling a bit tired for some reason..."
Story-part10_11_2,"These are some exotic specialties I brought back, Qingcheng will go back to rest today, please forgive me."
Story-part10_11_3,"Miss Qingcheng, you must be tired from the journey, go back and rest first!"
Story-part10_12_1,"Head, Miss Qingcheng comes to our sect every day to ask if you are busy, today is the first day she didn't come."
Story-part10_12_2,"Damn, I actually neglected the beauty, help me find her back quickly!"
Story-part11_1_1,"Head, an auction house named Rimobang sent an invitation, inviting our sect to participate."
Story-part11_1_2,"Strange, the Night Auction Market has already been destroyed, how come there is another Sun Mo Fang, send someone to check it out."
Story-part11_name,Owner of Sun Mo Fang
Story-part11_log,"After the destruction of the Night Auction Market, a new Sun Mo Fang has appeared and invites you to attend the auction."
Story-part11_2_1,"What a crappy Sun Mo Fang... It's simply set up in a civilian house, without a single bodyguard, it doesn't have half the style of the old Night Auction Market!"
Story-part11_2_2,"You must be from {MyFaction}, I am Shen Wuqi, the owner of Sun Mo Fang, nice to meet you!"
Story-part11_2_3,"Brother Shen... We have not only met, but also fought several times..."
Story-part11_2_4,"Ah? Really, I guess I must have had another bout of amnesia. But it doesn't matter, no matter what happened before, today you are all my honored guests!"
Story-part11_2_5,"After the destruction of the Night Auction Market, almost all the clerks and goods were lost, I had to take the remaining three treasures and go far away, ready to sell at a low price."
Story-part11_2_6,"In order to raise funds for a comeback, I plan to auction these three treasures publicly, the highest bidder wins."
Story-part11_2_7,"Unlike before, this time it's a thrilling blind auction, I will hide the treasures in a box and give a description, please bid according to your judgment."
Story-part11_2_8,"The first treasure is a round spherical object, it seems to have a faint fragrance, the starting price is 1000 coins."
Story-part11_2_9,"Ladies and gentlemen, according to my experience, this is a common small pill, don't fall for such a low-level trick."
Story-part11_2_10,"Still Small pill... Let me tell you, these foreigners have bad consciences, deliberately vague words let you imagine. Round, and fragrant, ha! Be careful, 1000 Coin for a Candied fruit!"
Story-part11_2_11,"Shen Wuqi is indeed too vague, if he cheats, no one can do anything about it, should I bid?"
Story-part11_op_1_1,I bid 1100 coins!
Story-part11_op_1_2,Refuse to bid
Story-part11_3_1,"When Shen Wuqi opened the Night Auction Market, he always used sincerity as his trademark, trust him once, I bid 1100 coins!"
Story-part11_3_2,"Once, twice, three times! Congratulations on winning the treasure, please check it yourself."
Story-part11_3_3,"Let me see, it turns out to be a high-quality Dzi bead, not bad at all!"
Story-part11_3_4,Eh... How did I misjudge it?
Story-part11_3_5,"Hmph, this must be the bait he threw out to lure us into the game, and then cheat a big one later."
Story-part11_4_1,"So many people doubt him, it seems not without reason, I won't bid."
Story-part11_5_1,"Okay, let's look at the second treasure. This is a neatly shaped jade pendant, it feels cool to the touch, the color is beautiful, the starting price is 3000 coins."
Story-part11_5_2,"I've been playing with antiques for ten years, this kind of thing is a common ""GONG"" inscripted jade ornament, what color, it's actually just mixed color."
Story-part11_5_3,"As for the cool feeling, it's more of a common saying among you unscrupulous merchants, jade itself is not heat-conductive, if you have the ability, find a hot jade pendant!"
Story-part11_5_4,"No one is bidding, everyone seems to agree with the merchant's words, should I bid..."
Story-part11_op_2_1,I bid 3100 coins!
Story-part11_op_2_2,Refuse to bid
Story-part11_6_1,"I believe in Shen Wuqi's business principles, he can't possibly knockoff, I bid 3100 coins!"
Story-part11_6_2,"Once, twice, three times! Congratulations on winning the treasure, please check it yourself."
Story-part11_6_3,"Let me see, it turns out to be a rare Cold gem, big profit!"
Story-part11_6_4,Impossible! How can this quality of Cold gem start at 3000 Coin?
Story-part11_7_1,"What that Merchant said makes sense, Shen Wuqi's Sincere is just a facade, I won't bid anymore."
Story-part11_8_1,"The first two treasures have been auctioned off, this third one..."
Story-part11_8_2,"What exactly is this third treasure... stop keeping us in suspense, it's so frustrating!"
Story-part11_8_3,"Master Shen, I was just being suspicious earlier, please bring out the third treasure!"
Story-part11_8_4,"This third treasure is me, Shen Wuqi."
Story-part11_8_5,"Master Shen, you must be joking! Who would auction themselves..."
Story-part11_8_6,"This is no joke, the most precious thing in the Night Auction Market in the past was not any treasure or antique, but my Shen Wuqi's ""Sincere, genuine"" reputation."
Story-part11_8_7,"Whoever wins me, Shen Wuqi, will have the right to command me.\nThe starting price is..."
Story-part11_9_1,The starting price is 1 Coin!
Story-part11_9_2,"But only {PlayerName} is eligible to bid, because you are the only one in the room who chose to trust me."
Story-part11_9_3,"I'll bid this one Coin, our sect welcomes Master Shen's joining!"
Story-part11_9_4,"{PlayerSurName} Sect Leader is generous, this Celestial Star Manual is a small gift for buying me."
Story-part11_10_1,The starting price is 6000 Coin!
Story-part11_10_2,"Shen Wuqi is quite powerful, his price was quickly driven up, it's estimated that it will take 10000 Coin to win..."
Story-part11_op_3_1,Shen Wuqi is not worth this price
Story-part11_op_3_2,Just a mere 10000 Coin
Story-part11_11_1,"Shen Wuqi, although he was once a master of a sect, is not worth this price. All three treasures have been seen, let's go home."
Story-part11_12_1,"Just a mere 10000 Coin, buying such a master, it's not a loss."
Story-part11_12_2,"I'll bid this 10000 Coin, our sect welcomes Master Shen's joining!"
Story-part11_12_3,"{PlayerSurName} Sect Leader is generous, this Celestial Star Manual is a small gift for buying me."
Story-part11_13_1,"Leader, the Day Mo Sect that invited you suddenly disappeared without a trace."
Story-part11_13_2,"It's good that we didn't go, it was indeed a scam!"
Story-part12_1_1,"Leader, Young Master Cai from the Confucius Temple has sent a letter, please take a look."
Story-part12_1_2,"So this young master wants to become the Confucius Temple's junior Dojokeeper, asking me to help him break the Four Sages Formation, saying there will be a big reward."
Story-part12_1_3,"Although the relations between the two sects are good, considering Cai Dojokeeper's likes and dislikes, the leader should think it over."
Story-part12_name,Four Sages Formation
Story-part12_log,"Cai Youzhi sent you a letter, asking you to help him break the Four Sages Formation in the temple."
Story-part12_2_1,"{PlayerSurName} Brother, you are indeed trustworthy, I didn't expect you to come!"
Story-part12_2_2,"Can Brother Cai tell me, what does this matter of becoming the junior Dojokeeper have to do with breaking this formation?"
Story-part12_2_3,"Although I was designated as the next Dojokeeper of the Confucius Temple by my father since birth, both my experience and martial arts are hard to convince others. To gain recognition within the Confucius Temple, one must break through the Four Sages Formation in the temple."
Story-part12_2_4,"As long as {PlayerSurName} Brother is willing to help break this formation, I will definitely reward you heavily!"
Story-part12_2_5,"Understood, lead the way."
Story-part12_2_6,"{PlayerSurName} Brother, we have entered the formation, this formation is guarded by four wise men of our sect, please be careful!"
Story-part12_3_1,"This formation is not to be underestimated, I don't expect to succeed in one go."
Story-part12_3_2,"Sigh... Even if I fail to break the formation and can't become the junior Dojokeeper, when can I finally go outside the Confucius Temple..."
Story-part12_4_1,"Successfully broke through the formation, Me can finally go to see the places outside the Confucius Temple!"
Story-part12_4_2,"Thanks to the help of {PlayerSurName} brother this time, this Manual is a token of my gratitude. If there is any need for Cai in the future, I will not refuse!"
Story-part12_5_1,"Leader, Young Master Cai has sent another letter, saying that the person who can break the formation has been found, so you don't need to bother anymore."
Story-part12_5_2,"That's good, so the leader doesn't have to make another trip."
Story-part12_6_1,"Leader, the Confucius Temple has suddenly been destroyed, I'm afraid your plan to help Young Master Cai can't be realized..."
Story-part12_6_2,"It's fate, I hope he can take care of himself."
Story-part13_1_1,"Leader, the former Confucius Temple's young Dojokeeper Cai Youzhi is now wandering around the world, and I heard that he just found a job as a teacher."
Story-part13_1_2,"Alas, the once great Confucius Temple is now scattered, send someone to check on him."
Story-part13_name,Honorable Unworthy
Story-part13_log,Cai Youzhi seems to have found a job as a teacher after the destruction of the Confucius Temple.
Story-part13_2_1,This should be the private school where Cai Youzhi is.
Story-part13_2_2,"From the high-ranking young Dojokeeper of the Confucius Temple to a common teacher, I didn't expect Brother Cai to not be discouraged."
Story-part13_2_3,"Enter the path of Honorable, to learn the conduct of Honorable."
Story-part13_2_4,"Enter the path of Honorable, to learn the conduct of Honorable..."
Story-part13_2_5,"He is indeed teaching these children with all his heart, not wasting the Honorable spirit of the Confucius Temple."
Story-part13_2_6,"To be a scholar is to seek the path of Honorable, those who succeed and reach are in the state of unworthiness."
Story-part13_2_7,"To be a scholar is to seek the path of Honorable, those who succeed and..."
Story-part13_2_8,"Don't rush, this sentence is indeed difficult to read, follow Me slowly: those who succeed and reach are in..."
Story-part13_2_9,"Teacher Cai, behind you... Ah! Teacher Cai is injured!"
Story-part13_2_10,"Hmph... So it's the scum of the rivers and lakes who bears a grudge against Me Confucius Temple and is ready to take a chance, if you want to assassinate Cai, why do it in front of innocent children!"
Story-part13_2_11,"Young Master Cai, let Me lend you a hand."
Story-part13_3_1,Teacher Cai... Teacher Cai... don't die!
Story-part13_3_2,"We were delayed too long by the Man in black, and it was too late to save Young Master Cai..."
Story-part13_4_1,Cai is grateful for your great help...
Story-part13_4_2,"Young Master Cai, don't be polite, this is what Me should do."
Story-part13_4_3,"The Confucius Temple has been destroyed, if Young Master Cai has nowhere to go, why not come to our sect for a while."
Story-part13_4_4,"When the Confucius Temple was destroyed, Cai was secretly sent out by his father. Because he didn't understand the dangers of the world, he suffered a lot. Fortunately, when I was about to give up, I was found and taken in by the villagers here."
Story-part13_4_5,"This village was suffering from a drought, but they were willing to lend a hand to Cai, a stranger."
Story-part13_4_6,"Moved by their kindness, Cai decided to teach the children the classics of Confucianism as a way to repay their kindness."
Story-part13_4_7,"If your sect is willing to accept Cai, I would be more than happy, but I would like to ask your sect to lend some food to the village to help them through the drought."
Story-part13_op_1_1,Our sect has always put the people first (2000 food)
Story-part13_op_1_2,"Our sect is short of food, I'm sorry we can't help"
Story-part13_5_1,"Our sect has always put the people first, we will transport food from our sect to this place immediately, to ensure that the people here can survive this disaster."
Story-part13_5_2,"Cai thanks you all, {MyFaction} really has the spirit of Honorable!"
Story-part13_6_1,"Our sect is barely able to help ourselves, I hope Young Master Cai can understand."
Story-part13_6_2,"As long as the disaster in the village is not resolved, Cai cannot leave this place, let's talk about joining your sect later."
Story-part13_7_1,"Young Master Cai was teaching in a private school to avoid the world, but he was still attacked by his enemies and his whereabouts are unknown."
Story-part13_7_2,"It's a pity that I've wasted too much time, otherwise I could definitely recruit this Coin-like gentleman into my sect..."
Story-part14_1_1,"Sect Leader, Master Hua Yan from Shifa Temple is visiting our sect."
Story-part14_1_2,"I have long heard that {PlayerSurName} is a talented person, and it is indeed extraordinary to see you today."
Story-part14_1_3,I came here this time because I heard that a thief who stole the Scripture from our temple was spotted on your sect's territory. I would like to ask {PlayerSurName} to help me catch this thief.
Story-part14_1_4,"Master, please rest for a while, I will send a Disciple to accompany you later."
Story-part14_name,Vajra Exorcist
Story-part14_log,Master Hua Yan came to ask for your help in tracking down the thief who stole the Scripture.
Story-part14_2_1,The mansion ahead should be the last place where the thief appeared.
Story-part14_2_2,"Amitabha, I really don't know how to repay your sect for your assistance."
Story-part14_2_3,"Master Hua Yan, you're too polite. I heard that you spend all day studying Buddhism in the Scripture Tower and never leave the temple. Why did you come to our sect today?"
Story-part14_2_4,The reason why I never left the temple before was to atone for an old mistake.
Story-part14_2_5,"Years ago, I trusted the wrong person, which led to him sneaking into the Scripture Tower and stealing the Valuable Sutra. As a punishment, I was ordered by the abbot to guard the Scripture Tower for the rest of my life."
Story-part14_2_6,"I see, but as long as you retrieve the Scripture, I don't think the abbot will blame you too much."
Story-part14_2_7,"Alas, actually, compared to retrieving the Valuable Sutra, what I care more about is catching that thief..."
Story-part14_2_8,"Where did this bald monk come from, daring to invade Zhao Laoye's mansion!"
Story-part14_2_9,Zhao Laoye has ordered that anyone who enters without permission will be killed without mercy!
Story-part14_2_10,"Such a domineering killing intent, if you are a bloody villain, don't blame me for being a Vajra Exorcist!"
Story-part14_2_11,I didn't expect this place to be a rich man's mansion. Let's get rid of these fierce Guardians first!
Story-part14_3_1,"These villains are extremely vicious, I will risk my life to stop them, you guys go!"
Story-part14_3_2,"Master Hua Yan is fighting to the death to give us a chance, let's go!"
Story-part14_4_1,"This is outrageous, you not only broke into my Residential house, but also killed and injured my Guardians, I will report you to the authorities!"
Story-part14_4_2,"These Guardians are not only fierce, but also have a stench of Robber baron. I wonder if the government will come to Info, whether they will catch me and the master, or Zhao Laoye who harbors bandits?"
Story-part14_4_3,……
Story-part14_4_4,"Let's talk it out, there must be a big misunderstanding..."
Story-part14_4_5,"Zhao, have you recently had a noble Yan man as a guest in your house?"
Story-part14_4_6,"So you came for him, I'm really wronged! That Yan man somehow found out that I was dealing in stolen goods, and forced me to buy and sell several Buddhist scriptures, and then disappeared."
Story-part14_4_7,"The scriptures are here, I hope you can let me go."
Story-part14_4_8,"Amitabha, although I haven't solved the big knot in my heart, at least finding the scriptures can give the abbot an explanation. This Dharma Staff is a token of my gratitude."
Story-part14_5_1,"Sect Leader, Master Hua Yan is so anxious waiting for you that he went to chase the thief who stole the Scripture by himself."
Story-part14_5_2,"Master Hua Yan is also impatient, can't he wait a little longer..."
Story-part15_1_1,"Sect Leader, Master Hua Yan was nowhere to be found after Shifa Temple was destroyed, but he suddenly appeared in an inn today, and it seems that he is going to be a Vajra Exorcist again."
Story-part15_1_2,"Master Hua Yan has chosen to re-enter the martial world, he must have found the trace of that Yan's son again."
Story-part15_name,A moment of difference
Story-part15_log,"Master Hua Yan suddenly appeared, he must have found the trace of the person who is his heart knot again."
Story-part15_2_1,"You, this Wolf, are ambitious and deliberately set up a trap... to ambush me..."
Story-part15_2_2,"Isn't it because you, this old bald donkey, are haunting everywhere, chasing after my son?"
Story-part15_2_3,"Master Hua Yan, Shifa Temple is gone, and you are still persistently chasing after me, you must have got the wrong end of the stick, right?"
