﻿M5003-4_1_1_1,I didn't expect there to be a Tea Stall here... ,ข้าไม่คิดว่าจะมีร้านชาอยู่ที่นี่...
M5003-4_1_1_2,"There are many paths here, and many customers come and go. They all like to rest here.",ที่นี่มีหลายเส้นทาง และลูกค้าหลายคนมาๆ ไปๆ พวกเขาชอบมาพักผ่อนที่นี่
M5003-4_1_1_3,"Alas, but recently, those guys from the Bandit Chief Stronghold have been causing trouble, robbing pedestrians, and business is getting harder and harder... ",อนิจจา แต่เมื่อไม่นานมานี้ พวกโจรจากค่ายหัวหน้าโจรได้ก่อกวน ปล้นสะดมผู้คน การค้าก็ยิ่งยากลำบากขึ้นทุกที...
M5003-4_1_1_4,The Bandit Chief Stronghold's... ,ค่ายหัวหน้าโจร...
M5003-4_1_1_5,"Yes, I don't know where they came from. They've been acting like kings around here, robbing, killing, and looting. They've done a lot of bad things.",ใช่แล้ว ข้าไม่รู้ว่าพวกมันมาจากไหน พวกมันทำตัวเหมือนเจ้าถิ่นแถวนี้ ปล้น ฆ่า และเก็บกวาด พวกมันทำเรื่องชั่วร้ายมากมาย
M5003-4_1_2_1,"I've encountered them too, those guys are indeed very cunning.",ข้าเคยสัมผัสถึงความเจ้าเล่ห์ของพวกมันมาแล้ว พวกมันคืองูพิษที่ซ่อนตัวอยู่ในเงามืด
M5003-4_1_2_2,"You've encountered them and managed to escape unscathed, that's impressive!",เจ้าเคยรอดพ้นจากเงื้อมมือของพวกมันมาได้ นับว่าเจ้าช่างโชคดี หรือไม่ก็เจ้ามีฝีมือที่เหนือชั้นกว่าที่ข้าคิดไว้
M5003-4_1_3_1,"I haven't run into them yet, I guess I'm just lucky.",ข้ายังไม่เคยพบเจอกับพวกมันเลย คงเป็นเพราะฟ้าดินยังเมตตาข้าอยู่
M5003-4_1_3_2,"That's because you're lucky, if you really run into them, losing an arm or a leg would be considered lucky... ",นั่นเป็นเพราะเจ้าดวงดี ถ้าเจ้าได้เผชิญหน้ากับพวกมันจริง ๆ การสูญเสียแขนขาไปอาจจะยังถือว่าโชคดีด้วยซ้ำ...
M5003-4_2_1_1,"I've been lucky so far, those guys haven't come to cause trouble at the Tea Stall. If they ever do, I won't be able to do business anymore... ",ข้าโชคดีมาถึงตอนนี้ พวกนั้นยังไม่มาเกะกะที่ร้านชา หากพวกมันมาเมื่อไหร่ คงทำมาค้าขายต่อไม่ได้อีก...
M5003-4_2_1_2,"Innkeeper, did I hear you talking about the Bandit Chief Stronghold?",เถ้าแก่ ข้าได้ยินเจ้าพูดถึงค่ายหัวหน้าโจรหรือ?
M5003-4_2_1_3,"Yes, I don't know if the guest... ",ใช่ ข้าไม่ทราบว่าท่านผู้มาเยือนคือ....
M5003-4_2_1_4,"I am a disciple of the Confucius Temple, I came here specifically for this Bandit Chief Stronghold matter. Innkeeper, do you know where this Bandit Chief Stronghold is located?",ข้าเป็นศิษย์ของวัดขงจื๊อ  ข้ามาที่นี่เพื่อเรื่องค่ายหัวหน้าโจรโดยเฉพาะ เถ้าแก่ ท่านรู้หรือไม่ว่าค่ายหัวหน้าโจรตั้งอยู่ที่ไหน?
M5003-4_2_1_5,"This... bandit lair, they're afraid of being wiped out, so they must be hiding deep, perhaps in some deep mountain old forest. As for where exactly, how would I, a commoner, know?",รังโจรแห่งนี้ พวกมันกลัวถูกกวาดล้าง จึงต้องหลบซ่อนลึกเข้าไปในป่าเขาลำเนาไพร ส่วนจะอยู่ที่ไหนแน่ ข้าซึ่งเป็นเพียงสามัญชนคนหนึ่งจะไปรู้ได้อย่างไร?
M5003-4_2_1_6,That's true... It seems that my martial arts experience is still lacking... ,ถูกอย่างท่านว่า... ดูเหมือนว่าข้ายังขาดประสบการณ์ในยุทธภพอยู่มาก...
M5003-4_2_1_7,"I've been rushing here all the way from the Central Plains, I'm a bit thirsty. Innkeeper, what kind of tea do you have here?",ข้าเพิ่งเดินทางมาจากจงหยวนอย่างเร่งรีบ กระหายน้ำนัก เถ้าแก่ มีชาชนิดใดบ้างเล่า
M5003-4_2_1_8,"This place is remote, we don't have any good tea, only some Low-grade tea and Scrap tea, and some rice wine.",ที่นี่เป็นดินแดนห่างไกลผู้คน ไม่มีชาชั้นดีให้ดื่ม มีแต่ชาชั้นต่ำกับชาหยาบ ๆ และเหล้าข้าวหมักให้ดับกระหาย
M5003-4_2_1_9,"Then I'll have a pot of Low-grade tea, as long as it quenches my thirst.",เช่นนั้น ข้าขอชาหยาบสักหม้อก็พอแล้ว เพียงแค่พอดับกระหาย
M5003-4_2_1_10,"Alright, please wait a moment, the Low-grade tea will be ready soon.",เช่นนั้น ขอท่านรอสักครู่ ชาหยาบที่ข้าต้มไว้นั้นกำลังจะได้ที่
M5003-4_2_2_1,I didn't expect a disciple from the Confucius Temple to come here... ,ข้าไม่นึกเลยว่าจะมีศิษย์จากวัดขงจื๊อมาเยือนที่นี่...
M5003-4_2_2_2,"Master, what is this Confucius Temple?",อาจารย์ วัดขงจื๊อเป็นสถานที่เช่นไรกัน?
M5003-4_2_2_3,"The Confucius Temple is one of the three religions, representing ""Confucianism"". It can be considered one of the righteous sects in the martial arts world today. You will have dealings with them in the future.",วัดขงจื้อเป็นหนึ่งในสามสำนักใหญ่ เป็นต้นกำเนิดของลัทธิขงจื๊อ และเป็นหนึ่งในสำนักธรรมะที่เก่าแก่ที่สุดในยุทธภพ เจ้าจะต้องมีส่วนเกี่ยวข้องกับพวกเขาในอนาคตอันใกล้
M5003-4_2_3_1,"Hey, someone from the Confucius Temple is here, it seems that this Bandit Chief Stronghold won't last much longer!",นี่! มีศิษย์ของวัดขงจื๊อมาเยือน! ค่ายหัวหน้าโจรคงอยู่ได้ไม่นานหรอก!
M5003-4_2_3_2,"Brother, what is this Confucius Temple?",ศิษย์พี่ วัดขงจื๊อคือสถานที่ใดกัน?
M5003-4_2_3_3,"This Confucius Temple is one of the three major factions in the martial arts world today, representing the ""Confucian"" faction among the three teachings, teaching and educating people on behalf of the master. They seem like weak scholars, but they are all martial arts masters, truly a duality of scholarship and martial arts!","วัดขงจื๊อ นี้เป็นหนึ่งในสามสำนักใหญ่ในยุทธภพ เป็นต้นกำเนิดของ ""ลัทธิขงจื๊อ""  สอนและอบรมผู้คนแทนอาจารย์ พวกเขาดูเหมือนบัณฑิตที่อ่อนแอ แต่จริงๆ แล้วล้วนเป็นปรมาจารย์ยุทธ์ฝีมือสูง เป็นการผสมผสานระหว่างวิชายุทธและวรยุทธอย่างแท้จริง!"
M5003-4_2_3_4,"Their Dojokeeper Cai Yuanchang is not only one of the ""Eight Saints"", but also a heavy minister in the court. With this relationship, who among the scholars in the world doesn't want to join the Confucius Temple?","เจ้าสำนักวัดขงจื้อ ไช่หยวนฉาง ของพวกเขา ไม่เพียงแต่เป็นหนึ่งใน""แปดเซียน""เท่านั้น แต่ยังเป็นขุนนางใหญ่ในราชสำนักด้วย ด้วยความสัมพันธ์เช่นนี้ ใครเล่าในหมู่นักปราชญ์จะไม่อยากเข้าร่วมวัดขงจื๊อ?"
M5003-4_2_3_5,"I see, so you also... ",ข้าเข้าใจแล้ว ท่านเองก็...
M5003-4_2_3_6,"No, no, my ambition is not here, I just want to record the deeds of the heroes of the world, I don't want to seek officialdom.",ไม่เลย ข้าไม่ได้มุ่งหมายที่จะเป็นใหญ่เป็นโต ข้าเพียงต้องการบันทึกเรื่องราวของจอมยุทธผู้กล้าหาญ ข้าไม่ได้ต้องการเป็นขุนนางสักหน่อย
M5003-4_2_4_1,"This guy seems to be quite capable, he said he is from the ""Confucius Temple"", Innkeeper, do you know about it?",คนผู้นี้ดูเก่งกล้าทีเดียว เขาบอกว่ามาจากวัดขงจื๊อ เถ้าแก่ ท่านรู้จักที่นั่นหรือเปล่า?
M5003-4_2_4_2,"I'm not a martial artist, I don't know much about the various martial arts sects, but it seems that this Confucius Temple is quite powerful.",ข้าเป็นเพียงคนธรรมดา ไม่มีความรู้เรื่องยุทธภพมากนัก แต่ดูเหมือนว่าวัดขงจื๊อจะมีพลังอำนาจที่น่าสะพรึงกลัวมากทีเดียว
M5003-4_2_4_3,I see.,อย่างนี้นี่เอง...
M5003-4_3_1_1,"Amitabha, I am a disciple of the Shifa Temple, passing by here, I hope the Innkeeper can grant me a bowl of Low-grade tea.",อมิตาพุทธ อาตมาเป็นศิษย์ของอารามซื่อฟา เดินทางผ่านมาแถวนี้ ขอเถ้าแก่เมตตาให้ชาหยาบสักถ้วยเพื่อดับกระหาย
M5003-4_3_2_1,(This monk is from that time...),(หลวงจีนรูปนี้จากเมื่อตอนนั้น...)
M5003-4_4_1_1,"Oh, I didn't expect to meet a fellow Daoist from the Shifa Temple here.",โอ้ ข้าไม่นึกว่าจะได้พบกับสหายธรรมจากอารามซื่อฟาที่นี่
M5003-4_4_1_2,"Amitabha, may I ask who this benefactor is?",อมิตาพุทธ ขอถามได้ไหมว่าประสกผู้นี้คือใคร?
M5003-4_4_1_3,I am from the Confucius Temple.,ข้ามาจากวัดขงจื๊อ
M5003-4_4_1_4,"So it's a Daoist friend from the Confucius Temple, I have been rude.",งั้นก็เป็นสหายธรรมะจากวัดขงจื๊อ อาตมาได้กระทำการที่ไม่สมควรไป
M5003-4_4_1_5,"No harm done, I just ordered a pot of Low-grade tea, I can't drink much by myself anyway, would you like to share it with me?",ขอท่านวางใจ ข้าเพียงแค่สั่งชาหยาบมาหนึ่งหม้อ ข้าดื่มคนเดียวไม่หมดอยู่แล้ว ท่านจะร่วมดื่มกับข้ามั้ยล่ะ?
M5003-4_4_1_6,"Amitabha, then I won't be polite.",อมิตาพุทธ เช่นนั้นอาตมาขอรบกวน...
M5003-4_4_2_1,"First it was the Confucius Temple, now there's someone from the Shifa Temple... ",เมื่อกี้เพิ่งเป็นคนจากวัดขงจื๊อ คราวนี้ก็เป็นคนจากอารามซื่อฟา...
M5003-4_4_2_2,"Master, what is this Shifa Temple... ",อาจารย์ อารามซื่อฟาเป็นสถานที่เช่นไรกัน?
M5003-4_4_2_3,"It is one of the three religions, representing ""Buddhism"", and is also a representative of the righteous sects in the martial arts world today.",เป็นหนึ่งในสามสำนักใหญ่ เป็นผู้สืบทอดมรดกของพุทธศาสนา และเป็นหนึ่งในสำนักธรรมะที่ทรงอิทธิพลที่สุดในยุทธภพปัจจุบัน
M5003-4_4_2_4,How many representatives are there in the righteous sects of the martial arts world today... ,ในยุคสมัยนี้ มีผู้สืบทอดวิชาจากสำนักธรรมะกระจายอยู่ทั่วหล้ามากเพียงใดกัน...
M5003-4_4_2_5,"That is, the three families led by the three teachings, and the remaining one is the Taoist Sect... ",กล่าวคือ สามสำนักใหญ่ที่นำโดยนิกายทั้งสาม ยังเหลืออีกหนึ่งสำนัก นั่นคือ สำนักเต๋า……
M5003-4_4_3_1,"This person is indeed from the Shifa Temple, no wonder he speaks profound truths one after another... ",หลวงจีนผู้นี้เป็นศิษย์ของอารามซื่อฟาแท้ๆ ไม่น่าแปลกใจที่คำพูดของเขาเปี่ยมไปด้วยปัญญา
M5003-4_4_3_2,"Brother, you don't seem to like the Shifa Temple?",ศิษย์พี่ เหตุใดท่านจึงดูไม่สบอารมณ์กับอารามซื่อฟาเช่นนี้
M5003-4_4_3_3,"Well... they don't produce anything, but they keep talking about morality. It might be good at other times, but in this world, what's the use of just talking about morality?",ก็... พวกเขาไม่ได้สร้างสรรค์สิ่งใด แต่กลับพร่ำสอนเรื่องธรรมะอยู่ตลอดเวลา อาจจะดีในยุคสงบสุข แต่ในยุทธภพนี้ การพูดถึงคุณธรรมอย่างเดียวจะมีประโยชน์อะไร
M5003-4_4_3_4,It seems... indeed it is.,ดูเหมือน…… จะเป็นเช่นนั้นจริงๆ
M5003-4_4_4_1,"It turns out to be a master from the Shifa Temple, I have to ask him later if he can help me bless the Protected Talisman... ",ไม่คิดเลยว่าจะเป็นผู้ทรงธรรมจากอารามซื่อฟา ประเดี๋ยวต้องลองถามท่านดูเสียหน่อย ว่าพอจะช่วยทำพิธีเบิกเนตรยันต์คุ้มกายให้ข้าได้หรือไม่……
M5003-4_4_4_2,What is this Shifa Temple?,อารามซื่อฟา นี่คืออะไรกันแน่?
M5003-4_4_4_3,"Looking at your RollVagabond outfit, how come you don't even know about the Shifa Temple? That's the largest temple today, it is said that there are countless martial arts stored in it, and there is even a saying that all the martial arts in the world today come from the Shifa Temple!",มองเครื่องแต่งกายของเจ้าก็ดูเป็นชาวยุทธ์ เหตุใดเจ้าถึงไม่รู้จักอารามซื่อฟาล่ะ? นั่นคือวัดที่ใหญ่ที่สุดในปัจจุบันเลยนะ มีการกล่าวกันว่าที่นั่นซ่อนเร้นวิชาชั้นสูงนับไม่ถ้วน และยังมีเสียงลือเล่าขานว่า วิทยายุทธ์ทั้งปวงในยุคนี้ล้วนมีรากฐานมาจากอารามแห่งนั้น
M5003-4_4_4_4,What?! Is it really that powerful?,อะไรนะ!? มันทรงพลังขนาดนั้นเชียวเหรอ?
M5003-4_4_4_5,"That's what people say in the martial arts world, I don't know the specifics, I'm not a martial artist.",นั่นเป็นคำกล่าวที่เหล่าจอมยุทธ์มักเอ่ยถึงกัน แต่รายละเอียดปลีกย่อยนั้นข้ามิอาจทราบได้ ข้ามิใช่ผู้เชี่ยวชาญในวรยุทธ์
M5003-4_5_1_1,Are the two of you from the Shifa Temple and the Confucius Temple?,ท่านทั้งสองเป็นศิษย์อารามซื่อฟาและวัดขงจื๊องั้นรึ?
M5003-4_5_1_2,"Yes, I don't know who you are... ",ถูกต้อง ไม่ทราบว่าท่านคือ...
M5003-4_5_1_3,"I am a disciple of Zhong Yangzi from the Taoist Sect, I didn't expect to meet friends from the Shifa Temple and Confucius Temple during this trip, it's really fate.",ข้าเป็นศิษย์สายตรงของ ฉงหยางสื่อแห่งสำนักเต๋า ไม่นึกเลยว่าจะได้พบพานสหายจากอารามซื่อฟาและวัดขงจื๊อในยามนี้ เห็นทีจะเป็นวาสนาที่สวรรค์ลิขิตกระมัง
M5003-4_5_1_4,May I join you two?,ขอข้าร่วมโต๊ะกับท่านทั้งสองได้หรือไม่
M5003-4_5_1_5,"You are actually a disciple of Zhong Yangzi, your status is not low!",ท่านคือศิษย์ของ ฉงหยางสื่อ! สถานะของท่านมิได้ต่ำต้อยเลย!
M5003-4_5_1_6,"Please have a seat, Taoist priest.",เชิญท่านนั่งเถิด นักพรตเต๋า
M5003-4_5_1_7,"Thank you for your kindness, I have been accumulating Qi in my Dantian recently, and I can't rest for three days, so I will stand instead of sitting, hope you understand.",ขอขอบคุณในไมตรีจิต ข้าได้สะสมลมปราณในตันเถียนอย่างต่อเนื่องมาได้ระยะหนึ่งแล้ว ข้าจึงจำเป็นต้องยืนตลอดเวลา เป็นเวลาสามวัน ขอท่านโปรดเข้าใจด้วยที่ข้าไม่สามารถนั่งได้
M5003-4_5_2_1,"I didn't expect disciples from the three teachings to gather here, this is going to be interesting... ",ไม่นึกเลยว่าศิษย์ทั้งสามสำนักจะมารวมตัวกัน ณ ที่แห่งนี้ ชักจะน่าสนใจซะแล้วสิ
M5003-4_5_2_2,"Good disciple, try to get close and listen to what they are talking about.",ลูกศิษย์เอ๋ย จงเข้าไปสืบดูให้แน่ชัดว่าพวกเขากำลังหารือเรื่องใด
M5003-4_5_2_3,Is it really good to eavesdrop like this... ,การกระทำเช่นนี้เหมาะสมแล้วหรือ? ข้ารู้สึกไม่สบายใจนัก...
M5003-4_5_2_4,"Disciples from the three teachings gather here, there must be important matters in the martial arts world, it might be a good opportunity for us storytellers!",ศิษย์ทั้งสามสำนักมารวมตัวกัน ณ ที่แห่งนี้ ย่อมต้องมีเรื่องสำคัญในยุทธภพแน่แท้ เป็นโอกาสอันดีของผู้ขับขานเรื่องราวอย่างพวกเรา!!
M5003-4_5_3_1,"Now the people from the Taoist Sect are here too, I didn't expect this unremarkable Nameless Region to have a day when disciples from the three teachings gather... ",ตอนนี้คนจากสำนักเต๋าเข้ามาแล้วด้วย ไม่นึกเลยว่าดินแดนไร้นามแห่งนี้ จะมีวันได้พบกับการรวมตัวกันของศิษย์ทั้งสามสำนักเช่นนี้
M5003-4_5_3_2,"{PlayerSurName} brother, if you have a chance, try to eavesdrop on what they are talking about?",ศิษย์น้อง{PlayerSurName} จงแอบเข้าไปใกล้ แล้วฟังดูว่าพวกเขากำลังหารือเรื่องใด?
M5003-4_5_3_3,Is it really good to eavesdrop like this... ,การกระทำเช่นนี้เหมาะสมแล้วหรือ? ข้ารู้สึกไม่สบายใจนัก...
M5003-4_5_3_4,"This is a rare storytelling material, if we just let it go, I'm afraid I won't be able to sleep for a few days.",วัตถุดิบในการเล่าขานเรื่องราวเช่นนี้หาได้ยากยิ่ง หากปล่อยให้หลุดลอยไป คงต้องใช้เวลาหลายคืนกว่าจะหลับตาลงได้
M5003-4_6_1_1,"Innkeeper, is the tea ready?",เถ้าแก่! ชาเสร็จหรือยัง!
M5003-4_6_1_2,"It's ready, I'll bring it to you right away.",ชาพร้อมแล้ว ข้าจะรีบนำไปให้ท่านทันที
M5003-4_6_1_3,"Innkeeper, let me bring it to them.",เถ้าแก่ ให้ข้านำไปส่งพวกเขาเอง ขอท่านวางใจ
M5003-4_6_1_4,"You? Alright, it saves me the trouble.",ให้ท่านรึ ก็ดีเหมือนกัน ช่วยให้ข้าปลดเปลื้องความยุ่งยากไปได้มาก
M5003-4_6_1_5,"Gentlemen, the tea is here.",ท่านทั้งหลาย ชาพร้อมแล้ว ขอเรียนเชิญ
M5003-4_6_1_6,Thank you.,ท่านมีน้ำใจนัก ข้าขอคารวะ
M5003-4_6_1_7,"Let me pour it for you.\n(Take this opportunity to listen to their conversation.)","ข้าจะเทให้ท่านเอง...\n(ใช้โอกาสนี้สอดแนมการสนทนาของพวกเขา)"
M5003-4_6_1_8,"Amitabha, I didn't expect to be able to meet two friends over tea in such a remote place, it's a great fate.",อมิตาพุทธ อาตมาไม่คิดว่าจะได้พบสหายสองท่าน ดื่มชาในสถานที่ห่างไกลเช่นนี้ ช่างเป็นวาสนาอันยิ่งใหญ่
M5003-4_6_1_9,I didn't expect to meet friends from the Shifa Temple and Confucius Temple on this trip under the order of my master.,ข้ามิได้คาดหวังว่าการลงเขาตามคำสั่งของอาจารย์ในครั้งนี้ จะได้พบมิตรสหายจากอารามซื่อฟาและวัดขงจื๊อ
