M2155-17_4_16,"Is it your duty in the Crime Investigation Bureau to sit back and watch the downfall of the Zhao Kingdom, only catching petty thieves?",หรือว่าเห็นแผ่นดินจ้าวแหลกสลายไปต่อหน้าต่อตา ปล่อยให้โจรขโมยของกระจอกไปวันๆ นี่หรือคือหน้าที่ของสำนักเทพมือปราบ?
M2155-17_4_17,"Look at your Crime Investigation Bureau, which is as despicable as rats and snakes, do you still dare to call yourself righteous? Do you still dare to condemn us?",เจ้ามองดูสำนักเทพมือปราบ ที่เต็มไปด้วยเล่ห์เหลี่ยมจอมปลอมของเจ้าเถอะ ยังกล้าอ้างตนเป็นฝ่ายธรรมะอยู่อีกหรือ? ยังกล้าวิพากษ์วิจารณ์ข้าอยู่อีกหรือ?
M2155-17_4_18,You... uh... ,เจ้า... อึก...
M2155-17_4_19,"Look at you, you can't even speak. Hand over the manual obediently, and I'll give you the antidote to make you feel better.",ดูสภาพของเจ้าสิ แม้แต่พูดยังแทบไม่ได้แล้ว ยอมมอบตำราออกมาเถอะ ข้าจะให้มอบยาถอนพิษแก่เจ้าเพื่อให้เจ้าได้คลายทุกข์
M2155-17_4_20,……,......
M2155-17_4_21,"I advise you, don't force yourself anymore, it will only increase your pain.\nDying like this is meaningless. If I were you, I would find a way to preserve myself and find an opportunity to kill the opponent in the future.","ข้าขอเตือนเจ้า อย่าฝืนไปเลย มันก็แค่เพิ่มความทรมานให้กับตัวเจ้าเองเท่านั้น\nตายไปเช่นนี้ไม่มีความหมายอันใด หากข้าเป็นเจ้า ข้าจะหาทางเอาตัวรอด แล้วรอโอกาสล้างแค้นในภายหลัง"
M2155-17_4_22,……,......
M2155-17_4_23,"That's right, this is the antidote. As long as you are willing to obey in the future, I will arrange for someone to deliver the antidote every day.",อย่างนั้นก็ดี นี่คือยาถอนพิษ... หากเจ้าว่าง่าย ข้าจะให้คนส่งยาถอนพิษให้เจ้าทุกวัน
M2155-17_4_24,Tie Mianren... I will never forgive you!,เจ้าหน้ากากเหล็ก... ข้าไม่มีวันให้อภัยเจ้า!
M2155-17_5_1,"Sooner or later, I will bring you to justice and avenge today's hatred!",วันหนึ่งข้าจะลากเจ้าไปชดใช้ความผิด และสะสางความแค้นในวันนี้แน่นอน!
M2155-18_0_1,"I'm locked up here, not only being tortured, but also having to see your filthy face. Damn, it's really bad luck!",ข้าถูกขังอยู่ที่นี่ ถูกทรมานสารพัด ยังต้องมาเห็นหน้าไอ้สารเลวอย่างเจ้าอีก! บัดซบ! โชคร้ายยิ่งนัก!
M2155-18_0_2,"Kong, the head of the household, you look very spirited. Indeed, Hardy, my disciples can't do anything to you.",หัวหน้าขงผู้ยิ่งใหญ่ ดูท่าทางยังแข็งแรงดีอยู่จริงๆ อย่างที่คิดไว้ หนังหนาของเจ้า ทำเอาลูกศิษย์ของข้าจัดการเจ้าไม่ได้เลยสินะ
M2155-18_0_3,"I'm not afraid of anyone, let alone you bunch of bastards. Use whatever tricks you have, I'm still alive and kicking!",ข้าไม่เคยหวาดหวั่นผู้ใด นับประสาอะไรกับพวกเดนตายอย่างเจ้า จะใช้กลอุบายใดก็เอามา ข้ายังคงยืนหยัดอย่างองอาจ!
M2155-18_0_4,"(This Kong Yidao is indeed a tough nut to crack, but he's mediocre. The Blue Wind Camp doesn't have any worthwhile skills to learn, so there's no need to bother with him.)",(เห็นได้ชัดว่าขงอี้เตาผู้นี้แข็งแกร่ง แต่ความสามารถของเขานั้นก็ธรรมดา ค่ายวายุครามไม่มีอะไรที่คุ้มค่าแก่การเรียนรู้ ดังนั้นไม่ต้องสนใจเขาจะดีกว่า)
M2155-18_1_1,"(This Kong Yidao doesn't have any martial arts worth learning, there's no need to waste time here.)",(ขงอี้เตาผู้นี้ไม่มีวิทยายุทธใดๆที่คุ้มค่าแก่การเรียนรู้ ไม่จำเป็นต้องมาเสียเวลาที่นี่)
M2155-19_1_1,"I have nothing to say to a traitor like you, get lost.",ข้าไม่มีสิ่งใดจะพูดกับคนทรยศเช่นเจ้า ไสหัวไปให้พ้น!
M2155-19_1_2,"Han Elite Escort, you're from a dart bureau, why do you have to get involved in this mess?",เจ้าสำนักคุ้มภัยหาน ท่านเป็นคนของสำนักคุ้มภัย ไยจึงต้องมาพัวพันกับเรื่องวุ่นวายนี้ด้วย?
M2155-19_1_3,"Yan Yun Iron Army and I have a vendetta, shouldn't I seek revenge?",กองทัพเหล็กเยี่ยนหยุนและข้า มีความแค้นต่อกัน เหตุใดข้าจะไม่สามารถทวงแค้นได้เล่า?
M2155-19_1_4,"Moreover, Yan Yun Iron Army is an enemy of Zhao country. I was born a Zhao citizen, and I will die as a Zhao ghost. It's only right for me to help resist Yan.",ยิ่งกว่านั้น กองทัพเหล็กเยี่ยนหยุนก็เป็นศัตรูของแคว้นจ้าว ข้าเกิดมาเป็นคนของแคว้นจ้าว ตายไปก็จะเป็นผีของแคว้นจ้าว การที่ข้าจะช่วยต่อต้านพวกเยี่ยนนั้น ย่อมเป็นสิ่งที่ถูกต้องและชอบธรรม!
M2155-19_1_5,"Unlike some people, who act against the natural order and won't end well!",ต่างจากใครบางคนที่ทำผิดทำนองคลองธรรม สุดท้ายย่อมไม่มีจุดจบที่ดีแน่!
M2155-19_1_6,"(This Han Hongyu is stubborn, it seems it won't be easy to persuade him.)",(หานหงอวี้ผู้นี้ช่างดื้อรั้นเหลือเกิน ดูท่าคงไม่ง่ายที่จะโน้มน้าวจิตใจเขา)
M2155-19_2_1,"(However, I've already obtained Han Hongyu's family blade technique, there's no need to spend more effort on her.)",(แต่กระนั้น ข้าก็มีเคล็ดวิชาดาบของตระกูลหานหงอวี้อยู่แล้ว ไม่จำเป็นต้องเปลืองแรงกับนางอีกต่อไป)
M2155-19_3_1,"(I've already obtained Han Hongyu's family sword technique, there's no need to waste more time on her.)",(ข้าก็มีเคล็ดวิชาดาบของตระกูลหานหงอวี้อยู่แล้ว ไม่จำเป็นต้องเปลืองแรงกับนางอีกต่อไป)
M2155-19_option1_1,Force her to hand over all her life's learning.,บีบบังคับให้นางมอบวิชาที่ฝึกฝนมาตลอดชีวิต
M2155-19_option1_2,Leave for now.,ถอนตัวออกไปก่อน!
M2155-19_4_1,"Now you are a prisoner under my command. If you are willing to cooperate and hand over the sword technique of your Tiger Escort, I will make your life more comfortable.",บัดนี้เจ้าเป็นเชลยในมือของข้า หากเจ้าเต็มใจที่จะให้ความร่วมมือและมอบเคล็ดวิชาดาบของสำนักคุ้มภัยพยัคฆามา ข้าจะรับประกันความสุขสบายให้เจ้า
M2155-19_4_2,Cooperate with you? Have you looked at yourself in the mirror? Do you think you're worthy?,ร่วมมือกับเจ้า? เจ้าเคยส่องกระจกดูตัวเองบ้างหรือไม่? เจ้าคิดว่าเจ้าคู่ควรหรือ?
M2155-19_4_3,"Your life is in my hands, do you think I'm worthy now?",ชีวิตเจ้าอยู่ในมือข้า เจ้ายังคิดว่าข้าไม่คู่ควรอีกหรือ?
M2155-19_4_4,"If you want to kill me, just do it. Stop talking nonsense! You will never understand the spirit of us Zhao people!",อยากฆ่าข้าก็เชิญ! อย่ามัวแต่พล่าม! พวกเจ้าไม่มีวันเข้าใจหรอกว่าจิตวิญญาณของคนแคว้นจ้าวแข็งแกร่งเพียงใด!
M2155-19_option2_1,What if I could help you take revenge with Vengeful Strike?,หากข้าสามารถช่วยเจ้าชำระแค้นได้ล่ะ เจ้าจะว่าอย่างไร?
M2155-19_option2_2,"Feed her the Sovereign's Elixir. <color=#097a76>(1 Sovereign's Elixir, 1 shichen)</color>","บังคับให้นางกลืนโอสถบัญชาจักรพรรดิ <color=#097a76>(โอสถบัญชาจักรพรรดิ 1 เม็ด, ออกฤทธิ์ 1 ชั่วยาม)</color>"
M2155-19_option2_3,Find another way.,หาทางอื่น
M2155-19_5_1,You can help me take revenge with Vengeful Strike?,เจ้าจะช่วยข้าชำระแค้นได้งั้นหรือ?
M2155-19_5_2,{yell} Hahahaha——!,{yell} ฮ่าฮ่าฮ่าฮ่า——!
M2155-19_5_3,It's been a long time since I heard such a funny joke!,ข้าไม่ได้ยินเรื่องตลกเช่นนี้นานมาแล้ว!
M2155-19_5_4,"Alright, if you want to take revenge for me with Vengeful Strike, then go and annihilate the Yan people first, then commit suicide in front of my father's spirit tablet, and I will teach you my family's sword technique!",ก็ได้ หากเจ้าต้องการจะชำระแค้นให้ข้าจริง เช่นนั้นจงไปสังหารผู้คนตระกูลเยี่ยนให้สิ้นซากเสียก่อน จากนั้นก็จงไปปลิดชีพตนเองต่อหน้าป้ายวิญญาณของบิดาข้า แล้วข้าจะถ่ายทอดวิชาดาบของตระกูลให้แก่เจ้า!
M2155-19_5_5,It seems you are not going to be persuaded easily.,ดูเหมือนว่าข้าคงไม่อาจชักจูงเจ้าได้โดยง่าย
M2155-19_6_1,Let's see how long you can hold on.,ขอดูหน่อยเถอะ ว่าความดื้อรั้นของเจ้าจะอยู่ได้นานแค่ไหน!
M2155-19_6_2,"You forced Han Hongyu to take the Sovereign's Elixir, and after one shichen, the effects of the medicine began to take effect... ",เจ้าบังคับให้หานหงอวี้ กลืนโอสถบัญชาจักรพรรดิ และหลังจากผ่านไปหนึ่งชั่วยาม ฤทธิ์ยาเริ่มแสดงผล...
M2155-19_6_3,What the hell did you give me——,เจ้าคนทรยศ ให้ข้ากลืนโอสถอะไรเข้าไปกัน——
M2155-19_6_4,"Nothing much, just the Sovereign's Elixir.",ก็แค่โอสถบัญชาจักรพรรดิ เท่านั้นเอง
M2155-19_6_5,"It seems the effects of the medicine have started. Han Elite Escort, do you feel like there's a fire burning inside your body?",ดูท่าว่าฤทธิ์ยาจะเริ่มออกแล้วนี่ เจ้าสำนักคุ้มภัยหาน เจ้ารู้สึกเหมือนมีไฟกำลังเผาไหม้อยู่ภายในกายงั้นสิ?
M2155-19_6_6,"Don't worry, the real pain is yet to come. In three days, you will feel as if your heart is being drilled, and after seventy-seven days, you will die in agony with blood flowing from all your orifices.",ไม่ต้องห่วงหรอก ความเจ็บปวดที่แท้จริงกำลังจะมาถึง ในอีกสามวันเจ้าจะรู้สึกราวกับหัวใจของเจ้าถูกเจาะ และหลังจากเจ็ดสิบเจ็ดวัน เจ้าจะตายอย่างทรมานโดยมีเลือดไหลออกจากทวารทั้งเจ็ด
M2155-19_6_7,"If you don't want to continue suffering, just hand over your sword technique, and I will give you today's antidote.",หากเจ้าไม่อยากทนทุกข์ต่อไปอีก ก็แค่มอบวิชาดาบของเจ้ามา แล้วข้าจะให้ยาถอนพิษของวันนี้แก่เจ้า
M2155-19_6_8,"Tie Mianren, you rat!",เจ้าหน้ากากเหล็ก เจ้าคนต่ำช้า!
M2155-19_6_9,"You can curse all you want, but soon you won't be able to.",เจ้าจะสาปแช่งเท่าที่เจ้าต้องการก็ได้ แต่ในไม่ช้าเจ้าคงทำไม่ได้แล้ว
M2155-19_6_10,"After that, you won't even have the will to take revenge.",หลังจากนั้น แม้แต่ความคิดที่จะแก้แค้น เจ้าก็คงไม่มี
M2155-19_6_11,Do you think the children of the Han family will surrender to you so easily!,เจ้าคิดว่าลูกหลานตระกูลหานจะยอมจำนนต่อเจ้าง่ายๆ อย่างนั้นหรือ!
M2155-19_6_12,"I don't think it will be easy, but I want to see how long it will take for you to give in. I have plenty of time to watch you suffer.",ข้าว่ามันคงไม่ง่ายนัก แต่ข้าอยากจะดูว่าเจ้าจะทนได้นานแค่ไหน ข้ามีเวลามากพอที่จะดูเจ้าทนทุกข์ทรมาน
M2155-19_6_13,You--!,แก——！
M2155-19_6_14,Uh... ,อึ๊ก.....
M2155-19_6_15,"Han Elite Escort, think about it. If you live, you still have a chance to take revenge and strengthen your escort agency. If you die, you will lose everything.",เจ้าสำนักคุ้มภัยหาน จงคิดให้ดี หากเจ้ายังอยู่ เจ้ายังมีโอกาสที่จะแก้แค้นและฟื้นฟูสำนักคุ้มภัยของเจ้าให้กลับมายิ่งใหญ่ แต่ถ้าเจ้าตาย ทุกอย่างก็จะสูญเปล่า
M2155-19_6_16,Damn it... ,ไอ้สารเลว....
M2155-19_6_17,Give me the antidote! I'll give you the sword technique!,ส่งยาถอนพิษมา! ข้าจะให้วิชาดาบแก่เจ้า!
M2155-19_6_18,"That's more like it. Here's the antidote, take it.",ต้องอย่างนี้สิ นี่คือยาถอนพิษ เชิญรับไป
M2155-19_6_19,Hmph!,หึ!
M2155-19_6_20,"Han Elite Escort, I hope you will obey my orders in the future. Then someone will bring you the antidote every day, otherwise... ",เจ้าสำนักคุ้มภัยหาน ข้าหวังว่าเจ้าจะทำตามบัญชาของข้าในภายภาคหน้า จากนั้นจะมีคนนำยาถอนพิษมาให้เจ้าทุกวัน มิฉะนั้น...
M2155-19_6_21,"Tie Mianren, this is not over, I will make you pay one day!",เจ้าหน้ากากเหล็ก เรื่องนี้ยังไม่จบ ข้าจะทำให้เจ้าต้องชดใช้ให้ได้!
M2155-19_7_1,"Tie Mianren, I will not rest until I have my revenge!",เจ้าหน้ากากเหล็ก ข้าจะไม่หยุดหยั่งจนกว่าข้าจะล้างแค้นได้สำเร็จ!
M2155-20_0_1,"Tie Mianren, you've chosen a good place. It's surrounded by woods and water, perfect for burying a traitor like you!",เจ้าหน้ากากเหล็ก เจ้าเลือกที่ฝังศพได้ดีนี่! มีป่ามีน้ำล้อมรอบ เหมาะกับการฝังคนทรยศอย่างเจ้าจริงๆ!
M2155-20_0_2,It seems you still don't understand your position.,ดูเหมือนว่าเจ้าจะยังไม่เข้าใจสถานะของตนเอง
M2155-20_0_3,"I don't care about my life, if I die at the hands of a traitor like you, it will only make me a hero.",ชีวิตข้าไม่สำคัญ หากข้าต้องตายด้วยน้ำมือคนทรยศเช่นเจ้า มันจะทำให้ข้ากลายเป็นผู้กล้าก็เท่านั้น
M2155-20_0_4,"You're quite stubborn. You're doing a dangerous job that could cost you your head, why are you so loyal to Zhao?",เจ้ามันดื้อรั้นนัก! เจ้ากำลังทำงานอันตรายที่อาจทำให้หัวของเจ้าหลุดจากบ่า เหตุใดเจ้าถึงได้ภักดีต่อแคว้นจ้าวถึงเพียงนี้?
M2155-20_0_5,"Even if it's a dangerous job, I still know that I'm a Zhao. Unlike you, you've even forgotten which country you belong to!",แม้ว่างานนี้จะอันตราย ข้าก็รู้ว่าข้าคือคนของแคว้นจ้าว ไม่เหมือนเจ้าที่ลืมแม้กระทั่งแผ่นดินเกิดของตน!
M2155-20_0_6,(It seems pointless to talk more with this guy.),(คงไร้ประโยชน์ที่จะสนทนากับคนผู้นี้ต่อ)
M2155-20_option1_1,Force him to hand over his lifelong knowledge.,บีบให้เขามอบวิชาทั้งหมดออกมา!
M2155-20_option1_2,Leave for now.,ถอนตัวออกไปก่อน!
M2155-20_1_1,"I don't need to waste words with you, Ming Bufan. Hand over the secret technique of your Tomb Raider Sect, and I will spare your life.",ข้าไม่จำเป็นต้องสิ้นเปลืองคำพูดกับเจ้า หมิงปู๋ฟาน! ส่งมอบวิชาลับของสำนักปล้นสุสานให้ข้า และข้าจะไว้ชีวิตเจ้า
M2155-20_1_2,"Ha, so the leader of the Nine Factions Sect is also interested in this Golden Acupoint technique. I thought you were above such things!",ฮ่ะๆ ที่แท้ประมุขนิกายเก้าฝ่ายก็สนใจวิชาแยกทองกำหนดจุดเหมือนกันนี่เอง ข้าก็นึกว่าการค้าของเจ้ามันสูงส่งกว่านี้เสียอีก!
M2155-20_1_3,"Let me tell you the truth, this Dragon Seeker Manual is a legacy left by my ancestors, only passed down within my family. If you want it, you might as well acknowledge me as your ancestor, then it would be perfectly justified for me to pass it on to you!",ข้าบอกความจริงกับเจ้าก็ได้ คัมภีร์แหวกฟ้าคว้ามังกรเล่มนี้เป็นของที่บรรพบุรุษตระกูลข้าทิ้งไว้ให้ เป็นวิชาที่สืบทอดกันมาในสายเลือดของข้าเท่านั้น ถ้าเจ้าอยากได้ก็มานับญาติเป็นลูกหลานของข้าสิ เช่นนั้นหากข้าถ่ายทอดให้เจ้าก็ถือว่าถูกต้องตามทำนองคลองธรรม!
M2155-20_1_4,"It seems you really don't understand your situation, it would only take a word from me to kill you.",ดูเหมือนเจ้าจะไม่เข้าใจสถานะของตน ข้าแค่เอ่ยปากคำเดียว เจ้าก็ตายได้
M2155-20_1_5,"Ha, then say it, does the leader of the Nine Factions Sect not even have the courage to kill a tomb thief?",ฮ่าๆ เช่นนั้นก็เอ่ยมาสิ หรือว่าประมุขนิกายเก้าฝ่ายไม่มีแม้แต่ความกล้าที่จะฆ่าโจรปล้นสุสานคนหนึ่ง?
M2155-20_1_6,"I won't kill you, because you're still useful to me.",ที่ข้าละเว้นชีวิตเจ้า เพราะเจ้ายังมีประโยชน์ต่อข้าเท่านั้น
M2155-20_1_7,"I've been more than fair, if you refuse to hand over the Manual, I'll have to resort to other means.",ข้าให้โอกาสเจ้าอย่างมากกว่าที่ควรแล้ว หากเจ้ายังคงปฏิเสธที่จะส่งมอบคัมภีร์ ข้าคงต้องใช้วิธีอื่น
M2155-20_1_8,"Hmph, I'm not even afraid of a big dumpling, why would I be afraid of you? Bring it on!",ฮึ ข้าไม่กลัวแม้แต่ซาลาเปาใหญ่ แล้วข้าจะกลัวเจ้าได้อย่างไร? ป้อนมาเลย!
M2155-20_option2_1,"Feed him the Sovereign's Elixir.<color=#097a76> (Sovereign's Elixir 1 piece, 1 shichen)</color>","บังคับให้เขากลืนโอสถบัญชาจักรพรรดิ <color=#097a76>(โอสถบัญชาจักรพรรดิ 1 เม็ด, ออกฤทธิ์ 1 ชั่วยาม)</color>"
M2155-20_option2_2,Find another way.,หาทางอื่น
M2155-20_2_1,Let's see how long you can hold on.,ขอดูหน่อยเถอะ ว่าความดื้อรั้นของเจ้าจะอยู่ได้นานแค่ไหน!
M2155-20_2_2,"You forced Ming Bufan to take the Sovereign's Elixir, and after one shichen, the effects of the medicine began to take effect... ",เจ้าบังคับให้หมิงปู้ฟาน กลืนโอสถบัญชาจักรพรรดิ และหลังจากผ่านไปหนึ่งชั่วยาม ฤทธิ์ยาเริ่มแสดงผล...
M2155-20_2_3,"What's going on, it feels like my internal organs are burning... ",อะไรกัน... ราวกับอวัยวะภายในกำลังลุกเป็นไฟ...
M2155-20_2_4,What was that medicine you just gave me?,นี่เจ้านำโอสถอะไรมาให้ข้ากลืนกัน?
