NpcMumble_儒圣馆同门弱对白,"The young master of the museum is outstanding, everyone admires him.|The four virtuous people of Qin, Chess, Book, and Painting are highly skilled in martial arts.|The museum owner is very knowledgeable.|Senior Ya Qin is unparalleled in beauty, but her temper...|There are always people making trouble outside the museum, it's annoying.|I'll go back to the Disciple's room to read later.|The Saint's Stele seems to be the epitaph left by the sages.|I heard that the wine master wants to find a scholar to help teach those kids.|You can attend the morning class at Chen Shi every day.|The museum owner vacated the Haoran Zhengqi Pavilion for that surname Ling.|I heard that four talented people have recently joined, but I have never seen them.|That surname Ling is really fierce, not letting people get close.|It's time to worship the statue of Confucius.|Senior Shu Kuang and Hua Chi are looking for unappraised calligraphy and paintings everywhere.|Senior Shu Kuang and Hua Chi are always inseparable.|Senior Can Qi often catches people to play chess with him.|The disciples in the museum should pay special attention to their character cultivation.|If you often do bad things, you will be caught by the teacher and grounded.",นายน้อยของพิพิธภัณฑ์มีความโดดเด่น ทุกคนชื่นชมเขา|ปราชญ์คุณธรรมทั้งสี่คนแห่งพิณ หมากรุก หนังสือ และจิตรกรรมมีทักษะสูงในศิลปะการต่อสู้|เจ้าของพิพิธภัณฑ์มีความรู้มาก|ผู้อาวุโสหยาฉินมีความงามที่ไม่มีใครเทียบได้ แต่อารมณ์ของเธอ...|มีคนสร้างปัญหาอยู่นอกพิพิธภัณฑ์อยู่เสมอ มันน่ารำคาญ|ข้าจะกลับไปที่ห้องของสาวกเพื่ออ่านทีหลัง|ศิลาเซียนดูเหมือนจะเป็นคำจารึกที่ปราชญ์ทิ้งไว้|ข้าได้ยินมาว่าปรมาจารย์สุราต้องการหานักวิชาการเพื่อช่วยสอนเด็ก ๆ เหล่านั้น|เจ้าสามารถเข้าเรียนภาคเช้าที่ยาม Chen Shi ได้ทุกวัน|เจ้าของพิพิธภัณฑ์ออกจากศาลาฮ่าวหราน เจิ้งฉีเพื่อนามสกุลหลิง|ข้าได้ยินมาว่ามีบุคคลที่มีพรสวรรค์ทั้งสี่คน เข้าร่วมเมื่อเร็วๆ นี้ แต่ข้าไม่เคยเห็นพวกเขาเลย|นามสกุลนั้นหลิงดุร้ายมากไม่ยอมให้ใครเข้าใกล้|ถึงเวลาบูชารูปปั้นขงจื๊อ|ผู้อาวุโสซูกวงและฮวาชือกำลังมองหางานเขียนและภาพวาดที่ไม่ได้รับการประเมินทุกที่|ผู้อาวุโสซูกวง และฮวาชือ แยกกันไม่ออก|ผู้อาวุโสคานฉี มักจะจับคนเล่นหมากรุกกับเขา|สาวกในพิพิธภัณฑ์ควรให้ความสนใจเป็นพิเศษกับการฝึกฝนตัวละครของพวกเขา|หากเจ้าทำสิ่งเลวร้ายบ่อยครั้ง จะถูกอาจารย์จับและฝังดิน
NpcMumble_M20300-31围观路人弱对白,"This woman is so pitiful...|Why is this lady in conflict with the people of Maiden House?|There's not a single good person in Maiden House!|Why isn't anyone stepping in to stop this?|If this continues, someone will get killed!|Such a pitiful person...|What on earth happened?|This kid is really ruthless!|Such a bully!",หญิงคนนี้น่าสงสารมาก...|ทำไมหญิงคนนี้ถึงขัดแย้งกับคนจากตำหนักพิสุทธิ์?|ตำหนักพิสุทธิ์ไม่มีใครเป็นคนดีเลยสักคนเดียว!|ทำไมไม่มีใครก้าวเข้ามาหยุดเรื่องนี้?|ถ้ายังเป็นแบบนี้อยู่ เดี๋ยวมีคนโดนฆ่าแน่ๆ!|ช่างน่าสงสาร...|เกิดอะไรขึ้นเนี่ย?|เด็กคนนี้ช่างโหดเหี้ยมจริงๆ!|คนพาลช่างน่ารังเกียจ!
NpcMumble_M20300-31老妇人弱对白,"My life is so hard...|Wuuuuuu...|Where are you, my husband...|Please, let my husband go..."
NpcMumble_M20300-31小厮弱对白,"I told you, your husband is not here.|Get out of here before you get beaten up!|I've said it many times, he's not here!|If you don't leave, I'll have to get rough!"
NpcMumble_M20300-31老爷爷弱对白,"Is there anyone who can save me...|Help...|Why can't I get out of here...|Why am I so unlucky...|I'm starving...|Sigh, am I going to die without even touching it...|That kid over there has been watching for a long time, why doesn't he come to save me..."
NpcMumble_西南逃难群众弱对白,"Sigh, the southwest is not peaceful either...|It was not easy to cross the mountains to get here...|The people of the Jiuli tribe don't reason at all...|All the young girls have gone to Melody House...|In times of chaos, where can one find shelter...|If I had known, I wouldn't have come...|I don't know how much longer I can hold on...|Out of the tiger's den and into the wolf's lair...|Those who were taken by the Jiuli tribe never came back...|I heard there's a spring that can keep people young forever.|If only I could soak in that magical spring..."
NpcMumble_西南逃难群众镇西关被灭弱对白,"I heard someone made it through the West Pass...|If the West Pass is gone, what if the Jiuli enter the Central Plains...|The world is in chaos...",ข้าได้ยินมาว่ามีคนผ่านด่านชายแดนตะวันตกได้...|ถ้าด่านชายแดนตะวันตกหายไป แล้วถ้าเผ่าจิ่วลี่เข้าสู่แผ่นดินจงหยวน...|โลกกำลังสับสนวุ่นวาย...
NpcMumble_妙音坊弟子弱对白,"There's not a single good man in the world!|All the sisters here have been harmed by men.|The Jiuli tribe is no good either!|I once saw the abbot bathing at midnight.|Everyone likes little sister Wei'er.|Sister Qincheng is truly an overwhelming beauty.|The new song is so hard to learn...|Why are there men coming and going in the abbey?|I hope one day I can reach Sister Abbot's level of performance.|Sister Abbot is highly skilled in music, but rarely shows it.|Sister Qingcheng likes to bathe at noon.|One morning, I heard the sound of water splashing.|It's been a long time since I've seen Sister Fangzhu smile."
NpcMumble_妙音坊弟子九黎部落灭门弱对白,"The damned Jiuli tribe is finally gone!|Finally, we don't have to live in fear.|The Jiuli tribe should have been extinct long ago!"
NpcMumble_九黎部落弟子弱对白,"The tribal chief is the most powerful!|The tribal chief is always right!|All the people of the Central Plains should die!|Sooner or later, we'll show the people of the Central Plains how powerful we are!|The tribal chief has placed his new poisonous dragon in the Poison Dragon Cave.|I can't let the tribal chief know that I think the saintess is cute!|The tribal chief has been studying sacrifices recently.|The God of Jiuli is the most powerful!"
NpcMumble_九黎部落弟子妙音坊灭门弱对白,Those old women from Melody House are finally dead!|I've been annoyed by them for a long time!|Those old women from Melody House died too easily!|We should have captured the women from Melody House and fed them to the gu!
NpcMumble_中州店小二弱对白,"What would you like to order, sir?|Please come in, sir~|Please feel free to tell me if you need anything, sir~|Business is tough these days...|Thanks to that hero for dealing with the constant harassment from the Yan Iron Army...|I don't know how much longer this business can last.|I don't even know the name of that hero.|Although that hero is blind, his moves are always accurate."
NpcMumble_海蛟帮帮主弱对白,"Business has been tough recently.|Those guys are always punctual.|You better behave, don't try any tricks.|Don't move around.|You'll be able to run away from here in less than a day."
NpcMumble_海蛟帮帮众弱对白,"I heard that we've been targeted by the Crime Investigation Bureau recently.|We have the advantage of terrain, we're not afraid of any number of constables!|I never thought there would be so many victims before.|The people from Bandit Camp have no technical skills at all."
NpcMumble_镇西关将领弱对白,"Defend our land and borders!|We must guard the southwest passage, we cannot fail!|Beware of the people from the Jiuli tribe causing trouble!|Stay alert, everyone!"
NpcMumble_中州渡口游客弱对白,"I'm tired, let's take a break.|I heard there's a blind hero here, I wonder if I can meet him.|Luckily, there's a tavern here.|I'm thirsty and tired, it's a good time to rest.|I hope this place won't be harassed by the Yan dogs.|After drinking, I'll continue on my journey.|I don't know where I can find peace..."
NpcMumble_老魔头变废物弱对白,"Alas, why don't I have a good disciple.|Why not pry that good nephew over...|I didn't expect to end up in such a situation.|I have never regretted in my life!"
NpcMumble_燕歌行变废物弱对白,"A lifetime of cultivation, ultimately destroyed in a moment...|Fortunately, I have a discerning eye and have accepted a good disciple.|With such a good disciple, my senior brother must be envious!|How to get a mansion with thousands of rooms...|I hope the new Nine Factions Sect can Never forget the initial intention.|Back then, my senior brother and I were also famous in the martial arts world...|Now we are just two ordinary old men..."
NpcMumble_工作室打杂1弱对白,Want to slack off meow...|The environment has collapsed meow...|The computer has crashed meow...|There's no time meow...|Memory leak meow...|Want to run away with a bucket meow...|So many Bugs meow...|The battle process is stuck meow...|Compilation failed meow...|I forgot to clock in for work meow...|My mouse is broken but the administration won't replace it meow...|There's a long line for the bathroom meow...
NpcMumble_工作室打杂2弱对白,"The eyes I drew are already blurred.|I hate drawing female characters the most.|My Dragon Ball figurine is about to arrive.|Actually, I am Boss Yuan!|"
NpcMumble_工作室打杂3弱对白,"Do you need to load the game again?|Thank you for encouraging the studio.|Walking in a squatting position is bad.|The peerless martial arts have been hidden.|Make more good games.|Please eat more of the half bottle of vinegar treat, we might not meet again for years."
NpcMumble_工作室打杂4弱对白,I forgot to order food...|Clock in... clock in...
NpcMumble_工作室打杂5弱对白,%%@#!!!(swearing)
NpcMumble_工作室打杂6弱对白,"I want to eat roast duck...|There's a new scene again, I can't finish it...|Crystal... crystal... tell me, who is the most beautiful woman in the world?|I can do magic...|I can fly..."
NpcMumble_工作室打杂7弱对白,"It's time to replenish my coffee energy.|The doctor says my veins are full of caffeine.|I'm not bald, absolutely not!|The plot is getting more and more complicated...|I lost a handful of hair yesterday...|I'm so tired, let's have another cup of coffee.|I can't even find a coffee stand here.|Finally, I can touch the fish..."
NpcMumble_工作室打杂8弱对白,333333 My teammate is blinding me again.
NpcMumble_工作室打杂9弱对白,Another day of paid pooping.|It's a waste not to drink on Friday.|I want to eat lamb scorpion and hot pot.
NpcMumble_工作室打杂10弱对白,"Blacksmithing until I'm bald...|Thanks to 2077, it cured my 3D dizziness.|There are mosquitoes in the middle of winter..."
NpcMumble_逆风笑弱对白,"This is hilarious.|Time is money, my friend!|The sound of wind, rain, and reading, silent to death.|I will never go to Wild Wolf Valley again!|Is there any kind person to help me find my baby?"
NpcMumble_书匣子弱对白,"How much is this monkey? This monkey is not for sale!|Ladies and gentlemen, listen to me...|This country's wind and rain, years of mountains and rivers...|Shaking the fan in front of people, waking up the wood and slapping the table~|I'm a practitioner, back in the day at Haiguang Temple..."
NpcMumble_书匣子的猴弱对白,"Squeak, squeak, squeak!"
NpcMumble_长春子华清泉弱对白,"Baring your chest in broad daylight, what a disgrace!|This... I seem to have come to the wrong place...|...I think I'd better go back."
NpcMumble_长春子天工坊弱对白,"What are these tools for...|Unfortunately, I'm untrained in the art of crafting...|The things here are really exquisite."
NpcMumble_长春子药膳坊弱对白,This place is somewhat like the alchemy room in the sect.|The things here are quite complete...
NpcMumble_长春子后山弱对白,This place is quite peaceful.|So this is how these materials are collected.|Reminds me of the time when I was looking for monkey wine with my junior brothers...
NpcMumble_长春子悟道碑林弱对白,This place is quite peaceful.|These martial arts are profound.|This is a good place for cultivation.
NpcMumble_长春子万宝楼弱对白,The things here need to be well protected.|It's somewhat like Star Chaser Pavilion.|Why not train a formation here...
NpcMumble_苗木黎华清泉弱对白,"Brother, you really know how to enjoy yourself!|Well, well, well, the scenery is nice.|So you like this kind of play, brother?"
NpcMumble_苗木黎天工坊弱对白,Just the strange tricks of the Central Plains people.|The crafting skills of the Central Plains people are just so-so.|This kind of thing is the most troublesome.
NpcMumble_苗木黎药膳坊弱对白,This place is good for refining Gu.|Let's secretly place a poisonous insect.|The food of the Central Plains people is really troublesome.
NpcMumble_苗木黎后山弱对白,The bugs here are not as good as those in Jiuli.|The scenery here is not bad.
NpcMumble_苗木黎悟道碑林弱对白,It would be appropriate to put a statue of the God of Jiuli here!|Why do Central Plains people love to carve words on stones?|This place is really boring.
NpcMumble_苗木黎万宝楼弱对白,Just some boring stuff from the Central Plains people.|Are these things worth your treasure?|The treasures of Jiuli are better!|I thought there would be something rare.
NpcMumble_洪小七华清泉弱对白,"Big brother, you are so good to me!|I also want to take a good bath...|I'd better not go into the water."
NpcMumble_洪小七天工坊弱对白,"Um... too troublesome, I give up.|Knocking and beating is not suitable for me.|I'd better go sunbathing."
NpcMumble_洪小七药膳坊弱对白,"Wow, it smells so good~|This is heaven!|I want to eat my fill here!|Chew chew chew...|Wow, this is delicious!"
NpcMumble_洪小七后山弱对白,The sky is the tent and the earth is the bed~|The fruits on the tree seem nice.|Let's catch a fish to eat~
NpcMumble_洪小七悟道碑林弱对白,Um... I can't understand what's carved on it.|I get sleepy when I look at these things.|I should go outside for a walk.
NpcMumble_洪小七万宝楼弱对白,"Big brother, where did you get these good things!|It's so good, I also want to have so many good things.|If I quietly take one, no one should notice, right?"
NpcMumble_苗彩蝶华清泉弱对白,"Wow, what a beautiful pool!|Butterflies also want to soak in hot springs~"
NpcMumble_苗彩蝶华清泉下水弱对白,"It's so comfortable~|No wonder the sisters of Melody House like to soak in hot springs.|Little brother, do you want to soak together?"
NpcMumble_苗彩蝶天工坊弱对白,It's so complicated.|Butterfly can't understand...|It looks so powerful!
NpcMumble_苗彩蝶药膳坊弱对白,"This is a place for refining Gu, right!|Wow, it smells so good~|The medicine in the Central Plains is completely different from Jiuli~"
NpcMumble_苗彩蝶后山弱对白,"There are so many bugs here~|This place is so interesting~|Butterfly likes it here~|Little butterfly, don't run~|Butterfly wants to be friends with them~"
NpcMumble_苗彩蝶悟道碑林弱对白,Um... Butterfly doesn't recognize the words on it...|Butterfly can't understand.|It looks very powerful...
NpcMumble_苗彩蝶万宝楼弱对白,"These are all things that little brother likes, right?|This thing looks so good~|Little brother's things are so interesting~|The things in the Central Plains are so interesting."
NpcMumble_释嗔华清泉弱对白,"Brother, why did you call me here?|Ah, seeing the five aggregates are all empty...|Buddha, please forgive me..."
NpcMumble_释嗔天工坊弱对白,"I'm untrained in these things!|Brother, you research it yourself.|I'd better go for a drink!"
NpcMumble_释嗔药膳坊弱对白,It's a pity there's no wine here...|Good food! But there's no good wine!|If only there was some wine!
NpcMumble_释嗔后山弱对白,I wonder if the monkeys here can brew wine.|It's rare to have half a moment of leisure...|I might as well stretch my fists and feet here.
NpcMumble_释嗔悟道碑林弱对白,"So many words, it gives me a headache!|The abbot always asks me to read these steles, it's annoying!|Let's drink!"
NpcMumble_释嗔万宝楼弱对白,"Tsk tsk, the things are not bad.|I didn't expect you to have these good things!"
NpcMumble_凌鸿轩华清泉弱对白,What are you trying to do by bringing me here!|Is this your bad taste!|It's so boring!
NpcMumble_凌鸿轩天工坊弱对白,What did you call me here for?|Wasting time...|……
NpcMumble_凌鸿轩药膳坊弱对白,You would actually waste time on this.
NpcMumble_凌鸿轩后山弱对白,There are so many herbs here...|Maybe...|I don't know which one is useful...
NpcMumble_凌鸿轩后山知道龙虱弱对白,"Tsk, not a single useful one!|Waste of time.|Hey, when are you going to find medicine for my sister!"
NpcMumble_凌鸿轩后山救了妹妹弱对白,What are you doing here again?|Waste of time.|All useless.
NpcMumble_凌鸿轩悟道碑林弱对白,The Martial Arts on this...|Interesting.|I have to become stronger...
NpcMumble_凌鸿轩万宝楼弱对白,These are the things you like?|How vulgar.|Boring to the extreme.
NpcMumble_凌梦蝶治病前华清泉弱对白,"Hmm, I'm starting to feel sleepy...|ZZZzzz……|Let me sleep for a while..."
NpcMumble_凌梦蝶治病前华清泉下水弱对白,"Hmm, I'm starting to feel sleepy...|ZZZzzz……|Let me sleep for a while..."
NpcMumble_凌梦蝶治病前天工坊弱对白,"Hmm, I'm starting to feel sleepy...|ZZZzzz……|Let me sleep for a while..."
NpcMumble_凌梦蝶治病前药膳坊弱对白,"Hmm, I'm starting to feel sleepy...|ZZZzzz……|Let me sleep for a while..."
NpcMumble_凌梦蝶治病前后山弱对白,"Hmm, I'm starting to feel sleepy...|ZZZzzz……|Let me sleep for a while..."
NpcMumble_凌梦蝶治病前悟道碑林弱对白,"Hmm, I'm starting to feel sleepy...|ZZZzzz……|Let me sleep for a while..."
NpcMumble_凌梦蝶治病前万宝楼弱对白,"Hmm, I'm starting to feel sleepy...|ZZZzzz……|Let me sleep for a while..."
NpcMumble_凌梦蝶华清泉弱对白,"The book says that there are many benefits to soaking in hot springs.|I'll go soak for a while too~|Hot water is gushing out from the ground, just like what the book says!"
NpcMumble_凌梦蝶华清泉下水弱对白,Huh... It's really comfortable~|Is this what the book refers to as unblocking the Meridians?|I feel like I'm about to fall asleep...|It seems like someone is peeping at me...
NpcMumble_凌梦蝶天工坊弱对白,Could there be techniques not recorded in the book?|So this is what the workshop in the book looks like in reality.|It's even more interesting than what's written in the book.
NpcMumble_凌梦蝶药膳坊弱对白,"Let's try the recipe recorded in the book~|Hmm, cooking is quite difficult...|Making medicine is not easy either."
NpcMumble_凌梦蝶后山弱对白,"I've seen all these things in the book.|Seeing it in person is different from the book.|Thank you for taking me out.|I'm not well, my brother hardly ever takes me out."
NpcMumble_凌梦蝶悟道碑林弱对白,I've read about these Martial Arts before...|How to Advance these martial arts...|These martial arts each have their strengths...|If only I could take the best of each...
NpcMumble_凌梦蝶万宝楼弱对白,Seeing is believing.|I've only seen these things in books before.|It's beautiful...
NpcMumble_叶银瓶华清泉弱对白,"Huh, a rare moment of rest...|Let's soak in the hot spring and rest for a while.|If you dare to peep at me, you're dead!"
NpcMumble_叶银瓶华清泉下水弱对白,"Ah, it's so comfortable to soak in the hot spring~|I wish my father could dig a hot spring in the camp.|I feel all the fatigue has disappeared.|How dare you peep at me!"
NpcMumble_叶银瓶天工坊弱对白,It's so stuffy here...|So boring...|I think I'd better go outside for some fresh air.
NpcMumble_叶银瓶药膳坊弱对白,It's so stuffy here...|So boring...|I think I'd better go outside for some fresh air.
NpcMumble_叶银瓶后山弱对白,This place is more fun!|My brother would probably like it here too.|Want to play together for a while?
NpcMumble_叶银瓶悟道碑林弱对白,I remember the days when my father forced me to read military books...|Do I have to read these words...|It's so boring to guard here...
NpcMumble_叶银瓶万宝楼弱对白,I didn't expect you to have so many good things!|Where did you get this thing?|This thing is interesting!
NpcMumble_邋遢张华清泉弱对白,"You little rascal, you know how to enjoy!|I'm also benefiting from your luck.|What a great place!"
NpcMumble_邋遢张天工坊弱对白,"Unfortunately, I'm not good at this.|It's more adventurous outside!|This place is suffocating me!"
NpcMumble_邋遢张药膳坊弱对白,"Let me show you what I can do!|I was good at making medicine when I was young.|Good food, but no good wine!|Food and wine go through the intestines and into the heart~"
NpcMumble_邋遢张后山弱对白,"This is also a quiet place.|Let's ask the monkeys here for some wine~|With flowers and wine, the Tao is complete~"
NpcMumble_邋遢张悟道碑林弱对白,"This place gathers the spiritual energy of heaven and earth, it's a good place.|Let's stretch our limbs.|The Martial Arts on this stele are interesting."
NpcMumble_邋遢张万宝楼弱对白,"Unfortunately, I'm not good at this.|It's more adventurous outside!|This place is suffocating me!"
NpcMumble_蔡攸之华清泉弱对白,This... is indecent!|What a mess!|It's against moral principles!
NpcMumble_蔡攸之天工坊弱对白,"Unfortunately, I'm untrained.|I'm not good at this, so I won't make a fool of myself.|I prefer more elegant things."
NpcMumble_蔡攸之药膳坊弱对白,"My father knows a bit about making medicine.|Unfortunately, I'm untrained.|I'm not good at this, so I won't make a fool of myself."
NpcMumble_蔡攸之后山弱对白,This place is refreshing.|Playing the zither and singing here is quite elegant.
NpcMumble_蔡攸之悟道碑林弱对白,This place is somewhat similar to the Sage's Stele.|I seem to have known the Martial Arts on this stele...|This martial art...|Interesting...
NpcMumble_蔡攸之万宝楼弱对白,So you like these things.|You've really opened my eyes.
NpcMumble_曼陀罗华清泉弱对白,There are a few things here that remind me of Snowflower Valley...|My hometown doesn't have places like this.|This place is more relaxing.
NpcMumble_曼陀罗华清泉下水弱对白,Don't get too lost in thought.|What a great place.|No wonder women from the Central Plains like hot springs.|So comfortable...|It would be nice to have some Fruit to accompany.
NpcMumble_曼陀罗天工坊弱对白,This is the technology of the Central Plains...|The technology of the Central Plains is indeed advanced.|If these technologies could be brought back to my hometown...
NpcMumble_曼陀罗药膳坊弱对白,"The food in the Central Plains is truly unique.|Occasionally, I miss the taste of my hometown's food."
NpcMumble_曼陀罗后山弱对白,There are a few things here that remind me of Snowflower Valley...|My hometown doesn't have places like this.|This place is more relaxing.
NpcMumble_曼陀罗悟道碑林弱对白,The Martial Arts of the Central Plains are truly profound and intricate.|This Martial Arts is quite interesting.
NpcMumble_曼陀罗万宝楼弱对白,The things you found are quite interesting.|These are your treasures...
NpcMumble_步绝尘华清泉弱对白,"It's good to rest here.|We Nest of Swallow only rob wealth, not beauty.|How leisurely."
NpcMumble_步绝尘天工坊弱对白,We never do this troublesome thing.|Just take whatever you want.
