﻿DefaultPlayerName_Family,Vinegar
CharacterInfo_顾清扬,"The deputy head of the Holy Fire Sect, an admirer of Fang Xiaoian. He has been following Fang Xiaoian since he defended Chuxiang City. After receiving Fang Xiaoian's guidance, he has achieved great martial arts and has a high reputation within the Holy Fire Sect."
CharacterInfo_陆剑南,"The young master of the Beast Mountain Villa, Tang Tai Jun's biological son. However, he has no interest in taking over the villa, but prefers to travel and play, not doing his proper duties. After his pet went missing, he ran away from the villa to find it."
CharacterInfo_唐太君,"The owner of the Beast Mountain Villa, one of the legendary ""Eight Saints"". After the battle of Chuxiang City, he kept his promise to guard the southwest, his fame deterred the various factions in the southwest from daring to step into the Central Plains. But with the fall of Daliang and the capture of the Zhao Emperor, Tang Tai Jun felt his age and wanted to retire, letting the younger generation take over the villa."
CharacterInfo_唐婉儿,"Tang Tai Jun's niece from the Beast Mountain Villa, Lu Jian Nan's cousin. She is gentle and lovely, with a natural affinity for wild animals. She has been attached to her cousin since she was a child, but her cousin avoids her. After Lu Jian Nan ran away from home, she stayed in the villa to help Tang Tai Jun manage the affairs."
CharacterInfo_方小白,"An ordinary waiter, always listening to the guests talking about the rivers and lakes, longing for the rivers and lakes, hoping that one day he can also become a hero in the rivers and lakes."
CharacterInfo_杨幺儿,"Seemingly an ordinary soldier, he is actually a descendant of the Yang family. After the Yang family was persecuted, he lived a life of hiding for more than a decade, and only recently returned to a peaceful life. In order to restore the glory of the Yang family, he resolutely joined the army, hoping to become a great general who shakes the world like his father one day."
CharacterInfo_半瓶神仙醋,"The most mysterious knight in the martial arts world, no one knows where he comes from, but there are legends about him everywhere in the martial arts world."
CharacterInfo_无名小村猎户,"A hunter from Nameless village with superb hunting skills. He used to be a subordinate of General Yang who defended Chuxiang City. After the Yang army was disbanded, he fled to Nameless village to hide, and since then he has been living incognito, making a living by hunting."
CharacterInfo_无名小村铁匠,"The blacksmith of Nameless village, strong as a bull, with top-notch blacksmithing skills. He is addicted to alcohol and therefore owes Hua Siniang a lot of wine money. He used to be the top disciple of Langya Sword Pavilion. When he was young, he was known as ""Jade-faced Ganjiang"", but now he can't see it at all."
CharacterInfo_无名小村郎中,"When he was young, he devoted himself to studying medicine, hoping to save the world after becoming a great doctor. However, due to his lack of talent, he only knew the basics after wasting half of his life, and could only become a country doctor, treating some minor illnesses to make ends meet."
CharacterInfo_无名小村老板娘,"The proprietress of Nameless hotel, with excellent cooking skills, a fiery and flexible character. She runs Nameless hotel alone. According to Bao Dating, the people who pursued her could line up to the entrance of Nameless village, but no one could win her heart."
CharacterInfo_无名小村包打听,"A young man in Nameless village who is idle all day, usually inquiring about gossip everywhere, making a living by exchanging the gossip he heard for some small money."
CharacterInfo_华青青,"A very rare female thief in Nest of Swallow, and also a new disciple of Nest of Swallow. Bu Juechen has high hopes for her, and she herself is also diligent. Recently, she finally found a way to break through the bottleneck and is expected to improve her martial arts."
CharacterInfo_一枝花,"The shopkeeper of Zhangyue Casino, with superb gambling skills. He manages all the affairs of the entire Zhangyue Casino, and his bold style of doing things is no less than that of a general male hero."
CharacterInfo_鱼薇儿,"An orphan adopted by the master of Melody House, Fu Yaoqin, who loves her as her own and takes care of her meticulously. Yu Weier grows up carefree in Melody House, never knowing the evil of human nature."
CharacterInfo_燕歌行,"The master who was worshipped in Nameless village, originally thought to be just an unserious old man, his real identity is the younger brother of Lao Motou Chu Kuangsheng, the real founder of Nine Factions Sect. Due to being ambushed by enemies, he lost all his martial arts and his meridians were destroyed. Now he has healed his old injuries and recovered his strength, ready to fulfill his lifelong wish."
CharacterInfo_霖安群芳馆馆主,"The master of Maiden House in Lin'an City, although she claims to be old and faded, she still has unparalleled charm. After running a brothel for many years, she still hopes to find her true love."
MoralFondness_长春子,"Evil slayer, sincere and truthful."
MoralFondness_洪小七,"Indomitable, not stickler for trifles."
MoralFondness_苗彩蝶,"Ingenious, innocent at heart."
MoralFondness_释嗔,"Keep promises, Righteous offering."
MoralFondness_凌鸿轩,"Go through fire and water for Soup, keep promises worth a thousand gold."
MoralFondness_凌梦蝶,"Knowledgeable and strong, benevolent and loving."
MoralFondness_叶银瓶,"Brave to do what is right, keep one's word."
MoralFondness_重阳子,"Bearing the world in mind, Virtuous."
MoralFondness_邋遢张,"Keep promises, not shirk one's duty."
MoralFondness_蔡元常,"Self-discipline and respect for others, knowledgeable about the past and the present."
MoralFondness_蔡攸之,"Modest gentleman, sincere and honest."
MoralFondness_曼陀罗,"Insincere, yet trustworthy."
MoralFondness_步绝尘,"Not stickler for trifles, keep promises."
MoralFondness_慧元,"Compassionate, wise but appears foolish."
MoralFondness_癞头癫,"Keep promises, help the weak and the poor."
MoralFondness_完颜昭宁,"Brave as the best of armies, unmatched in wit."
MoralFondness_庖春秋,"Go through fire and water for Soup, keep one's word."
MoralFondness_叶云,"Robust, high-minded."
MoralFondness_完颜亮,"Cunning and treacherous, harboring evil intentions."
MoralFondness_萧元霸,"Unstoppable, Righteous offering."
MoralFondness_穆再兴,"Unstoppable courage, Virtuous."
MoralFondness_残棋,"Taciturn and untrustworthy, clever and resourceful."
MoralFondness_剑痴,"Far-sighted, keep promises worth a thousand gold."
MoralFondness_欧冶恒,"Keep promises, share weal and woe."
MoralFondness_韩红玉,"Honoring promises, assisting the Righteous."
MoralFondness_独孤剑一,"Robust, knowledgeable and strong."
MoralFondness_孔一刀,"A brave man, Righteous and generous."
MoralFondness_顾倾城,"Courteous, honoring promises."
MoralFondness_说书人,"Brave to do what is right, keep promises."
MoralFondness_沈无欺,"Sincere, Discerning eyes."
MoralFondness_绛紫烟,"Disrespect for etiquette, keep one's word."
MoralFondness_牛二,"Selfish, ready to help others at the expense of oneself."
MoralFondness_李三,"Not stickler for trifles, ready to help others at the expense of oneself."
MoralFondness_江南怪,"Keep one's word and act accordingly, help the weak and suppress the strong."
MoralFondness_李乐雅,"Keep promises, share weal and woe."
MoralFondness_曲忘忧,"Benevolent and generous, keep promises."
MoralFondness_吕子虚,"Arrogant and impolite, selfish."
MoralFondness_福箐郡主,"Courteous, keep one's word and act accordingly."
MoralFondness_付瑶琴,"Brave and decisive, Clever."
MoralFondness_裘之墨,"Fearless, self-discipline and respect for others."
MoralFondness_书狂,"Disrespect for etiquette, fearless."
MoralFondness_画痴,"Return to simplicity, value righteousness over profit."
MoralFondness_哑琴,"Insensitive, Indomitable."
MoralFondness_洛天雄,"Die for a just cause, keep promises."
MoralFondness_洛千雪,Charitable and trustworthy.
MoralFondness_方小白,"Indomitable, ready to sacrifice."
MoralFondness_杨幺儿,"Endure hardship, inseparable companionship."
MoralFondness_华青青,"Unconcerned with trifles, reckless."
MoralFondness_一枝花,"Fearless, words weighty as nine tripods."
MoralFondness_鱼薇儿,"Innocent at heart, Courteous."
MoralFondness_无名小村猎户,"Fearless in the face of danger, loyal and supportive."
MoralFondness_无名小村包打听,"Sharp tongue, keep promises."
MoralFondness_无名小村铁匠,"Brave danger for a just cause, value righteousness over profit."
MoralFondness_无名小村郎中,"Save the dying and heal the injured, approachable."
MoralFondness_无名小村老板娘,"Gentle inside, tough outside, sincere."
MoralFondness_霖安群芳馆馆主,"Fearless, a promise worth a thousand gold."
