Story-part34_op_1_2,"Miss Ding, you are bold and domineering, let me help you!"
Story-part34_3_1,"You audacious pirate, still dare to brag here, surrender now!"
Story-part34_3_2,"If you have the guts, come up the stairs and let me teach you a lesson!"
Story-part34_4_1,"I underestimated the enemy, let's retreat from the tavern quickly..."
Story-part34_5_1,"Hmph, so you've been running on fumes, just barely holding on with sheer willpower."
Story-part34_5_2,"I'll hand you over to Duke Kang first, don't worry, Ding Fengbo will see you soon!"
Story-part34_6_1,"Miss Ding, you are bold and domineering, let's break out of the tavern together, I'll cover you."
Story-part34_6_2,"You're from {MyFaction}... traitor, you can't fool me with such tricks!"
Story-part34_6_3,"Miss Ding, the past grudges between our two families were just for our respective masters. In today's situation, if you don't trust me, you will definitely be captured."
Story-part34_6_4,"Fine, I'll trust you this time... Lead the way!"
Story-part34_6_5,Am I seeing things... Why is the hero {MyFaction} rushing out with that female bandit? Could it be an imposter?
Story-part34_6_6,"Stop! Brothers, stop them!"
Story-part34_7_1,"Don't worry about me, just go!"
Story-part34_7_2,"To have met a friend like you who would risk their life for me before I die, I consider myself fortunate..."
Story-part34_7_3,"We can't keep fighting, let's retreat..."
Story-part34_8_1,That was a great fight!
Story-part34_8_2,"Hurry up, these constables' martial arts skills are limited. If we alert the Crime Investigation Bureau or Duke Kang's people, we won't be able to escape."
Story-part34_8_3,"Jiujiang Fortress has been destroyed, and I've lost my brother... Where else can I go..."
Story-part34_8_4,You can come back to {MyFaction} with me.
Story-part34_8_5,{MyFaction}? Would you dare to risk offending Duke Kang for me?
Story-part34_8_6,"What Duke Kang fears is the power of Jiujiang Fortress, not two bandits like you. We don't have much time, let's go to my sect for now."
Story-part34_8_7,"Fine, I'll trust you one more time!"
Story-part34_8_8,I don't like owing people. This exclusive manual is a token of my gratitude for your help.
Story-part34_9_1,"Master, Ding Haitang held on for a long time, but she couldn't resist any longer and was captured by the officials."
Story-part34_9_2,Our sect has other important matters to attend to. Let's leave the capture of the Ding siblings to the officials and Duke Kang.
Story-part35_1_1,"Miss Ding, what's the matter? Why are you in such a hurry?"
Story-part35_1_2,"Master {PlayerSurName}, I heard my brother's unique bamboo whistle today. The sound was high three times and low once, long twice and short once, which is his signal for seeking a way to save me."
Story-part35_1_3,"But what worries me is that I don't have a bamboo whistle to signal that I'm safe. If he misunderstands and thinks I've been kidnapped by you and breaks into the sect at night, what should we do?"
Story-part35_1_4,"Don't worry, I'll have our elite disciples patrol day and night. As soon as he appears, we'll know immediately."
Story-part35_name,Ding Fengbo's determination
Story-part35_log,Ding Fengbo mistakenly believes that your sect has kidnapped Ding Haitang and is looking for an opportunity to sneak into the sect.
Story-part35_2_1,I didn't expect such a heavy rain tonight...
Story-part35_2_2,"Heavy rain not only makes the soil muddy and leaves footprints, but also makes the walls slippery, affecting the performance of Qinggong."
Story-part35_2_3,"If I were Ding Fengbo, I would definitely not choose this kind of weather to sneak into our sect."
Story-part35_2_4,"Master, something terrible has happened..."
Story-part35_2_5,What's the rush? What happened?
Story-part35_2_6,Several of our patrolling disciples were knocked out by someone. One of them has been revived after emergency treatment and said he saw a shadow heading towards Miss Ding Haitang's residence.
Story-part35_2_7,"Although Ding Fengbo would never hurt Miss Haitang, he might attack other disciples who are watching her residence. You guys go and warn them!"
Story-part35_2_8,"Yes, sir!"
Story-part35_2_9,"This Ding Fengbo is really bold and talented. Even in such severe weather, he dares to sneak into our sect and hurt people..."
Story-part35_2_10,"Hmph, not only am I bold and talented, but I also know how to catch you off guard. You rule-following fools, how could you possibly be a match for me."
Story-part35_2_11,Creating chaos on purpose to distract the gatekeeping disciples outside the master's room... What a good plan.
Story-part35_2_12,"But there's one thing I don't understand, master. Why did you create the illusion of going to Miss Haitang's residence, but instead sneak into my room?"
Story-part35_2_13,"Hahaha! At that time, I knew very well that if I didn't get rid of you, even if I saved Haitang first, I would still be caught in an endless pursuit. It's better to capture the leader first, let you {{MyFaction}} be in chaos, and then escape!"
Story-part35_2_14,"Miss Haitang was right, you are indeed meticulous despite your rough exterior. Unfortunately, you got one thing wrong. Our sect not only did not kidnap Miss Haitang, but also painstakingly rescued her from the government."
Story-part35_2_15,"Don't try to fool me, talking is useless, let's fight!"
Story-part35_3_1,"I didn't expect this Ding Fengbo to come with determination, every move is aimed at mutual destruction, and I am restrained, under this situation, I am obviously at a disadvantage..."
Story-part35_3_2,"Sect leader? Someone, there's an assassination attempt on the sect leader!"
Story-part35_3_3,"I didn't expect to fail at the last moment, huh, revenge is not too late for ten years, you wait for me!"
Story-part35_3_4,"Unfortunately, Ding Fengbo thought that I was prepared and would not act rashly afterwards..."
Story-part35_4_1,"Ding Fengbo, although your ambition is commendable, you are not a match for the sect leader after all."
Story-part35_4_2,"Stay here quietly, wait for Miss Haitang to come, and the truth will naturally be revealed."
Story-part35_4_3,"Aren't you afraid that I will fight you to the death, impulsive and reckless?"
Story-part35_4_4,"Afraid, of course, but what I'm afraid of is not my own life, but that you and your sister will be inseparable because of a misunderstanding."
Story-part35_4_5,"Humph, don't try to confuse me with such clumsy lies."
Story-part35_4_6,Brother! Are you okay?
Story-part35_4_7,Haitang? Could it be... everything this kid just said is true?
Story-part35_4_8,"After listening to Ding Haitang's explanation\nDing Fengbo first sighed\nThen he opened his chest, handed the treasure sword to you\nClearly willing to apologize with death"
Story-part35_4_9,"Sect leader Ding, you don't have to do this, after all, you didn't hurt {{PlayerSurName}} me."
Story-part35_4_10,"There is still a hunt for the two of you outside, in my opinion, you might as well join our sect. Even Duke Kang has to give face to the sect leader."
Story-part35_4_11,"Thank you, {{PlayerSurName}} sect leader, for your generosity. I am willing to join your sect and spare no effort!"
Story-part35_4_12,"This is the famous internal skill that I rely on to make a name for myself in the martial arts world. Since I have joined the sect, I dare not hide it, I hope the sect leader will accept it."
Story-part35_5_1,"The sect leader has been waiting for Ding Fengbo for two months, but there has been no movement. Could it be because our sect's defense is tight and he can't find a chance to strike?"
Story-part35_5_2,"Forget it, let's not worry about him, I still have a lot of things to do."
Story-part36_1_1,"Sect leader, a man claiming to be the clerk of King Chai is visiting."
Story-part36_1_2,"Could it be that King Chai has something else for our sect to do? Let him wait, the sect leader will see him later."
Story-part36_name,The cat changes the prince
Story-part36_log,"The clerk of King Chai suddenly visited, seemingly with important matters to entrust."
Story-part36_2_1,The sect leader is busy with affairs and has lost the courtesy of greeting. I wonder what the clerk is here for?
Story-part36_2_2,"King Chai had previously heard that Duke Qi, who was guarding Daliang, was colluding with foreigners and conspiring with the Yan people, so he sent me to search for evidence."
Story-part36_2_3,"After many days of hard work, I finally succeeded in my mission and found ironclad evidence that could ruin Duke Qi's reputation. However, I was assassinated by the Black Clothes Society on my way back and narrowly escaped death."
Story-part36_2_4,"I hope that {{PlayerSurName}} the sect leader can lend a helping hand, and King Chai will surely be grateful!"
Story-part36_2_5,"Oh? How do you hope I, the sect leader, can assist you?"
Story-part36_2_6,"I have a plan. Please, {PlayerSurName} leader, send someone to ride the horse carriage I brought and run away first. I will follow later with the ironclad evidence against Duke Qi."
Story-part36_2_7,"The assassins from the Xuan Yi Society only recognize the style of the horse carriage. They will never expect that the ones waiting for them in the carriage are the experts from your sect. In this way, I can escape in the chaos."
Story-part36_2_8,"What a clever plan! Since the evidence is crucial to King Chai, I, as the leader, will personally take the risk."
Story-part36_2_9,"You disguise yourself as a clerk and ride the horse carriage from Duke Chai's Tower, pretending to run away.\nThe first ten miles are unusually calm, making you doubt the truth of the clerk's words.\nBut when you reach twenty miles, you suddenly hear a scream from the coachman."
Story-part36_2_10,"Hand over the things you got in Daliang City, and I will spare your life. Otherwise, I will make sure you can't live or die!"
Story-part36_2_11,What if the things are not with me?
Story-part36_2_12,"Don't worry, if you die by the hand of the leader of the Xuan Yi Society, you won't feel a thing!"
Story-part36_3_1,"Wait, you're not the clerk, you're the leader of {MyFaction}'s {PlayerSurName}!"
Story-part36_3_2,You're indeed the leader of the Xuan Yi Society. I'm no match for you. Take advantage of her surprise and run away...
Story-part36_4_1,"Wait, you're not the clerk, you're the leader of {MyFaction}'s {PlayerSurName}!"
Story-part36_4_2,I didn't expect that Yi Zhihua from the prestigious Zhangyue Casino is actually an assassin from the Xuan Yi Society under Duke Qi.
Story-part36_4_3,I have no grudges with you in the past or present. We are just serving our masters. You can go.
Story-part36_4_4,Go? Where do you think I can go...
Story-part36_4_5,"Duke Qi is outwardly gentle but inwardly harsh. If I don't complete the mission and retrieve the evidence, I will surely die when I return. I'd rather you kill me quickly. At least I can give Duke Qi an explanation..."
Story-part36_4_6,It would be a pity if someone as talented as Sister Hua were to die. How about staying in our sect?
Story-part36_4_7,Stay in your sect? You must be joking!
Story-part36_4_8,"Although I can't betray King Chai and help you retrieve the evidence, I can certainly protect and shelter you. Think about it."
Story-part36_4_9,……
Story-part36_4_10,What you said is indeed a way out...
Story-part36_4_11,"But I, Sister Hua, always trust fate, not people. Let's do this, I'll roll two dice. Two to six is small, seven to twelve is big. If you can guess right, I'll agree to stay in your sect. Otherwise, I'm afraid I can't comply."
Story-part36_4_12,"Come on, take a guess and see what my fate is."
Story-part36_4_13,"(Just now, I was fully focused on auditory sight. It should be the one and five sides of the dice that landed. Is it big or small? Let me think...)"
Story-part36_op_1_1,Small
Story-part36_op_1_2,Big
Story-part36_5_1,"I'm tired of calculating, I guess it's small!"
Story-part36_5_2,Six and two make eight... It seems that I am destined not to stay in your sect. Goodbye...
Story-part36_6_1,"(The sum of the opposite sides of the dice is seven. Since I heard that the one and five sides landed, the numbers rolled must be six and two, which add up to eight. It's big!)"
Story-part36_6_2,I guess it's big!
Story-part36_6_3,"Six and two make eight... If this is the will of heaven, then I ask {PlayerSurName} leader to take good care of me."
Story-part36_6_4,This Killer's Secret Manual is useless to me. I'll give it to your sect as a gift.
Story-part36_7_1,"Leader, the clerk from King Chai has been waiting for you for a long time. He had no choice but to ride the horse carriage and leave. He was assassinated by the Xuan Yi Society not far from our sect."
Story-part36_7_2,Ah... How could I forget about this? This will surely offend King Chai.
Story-part37_1_1,"Headmaster, Prince Chai has suddenly arrived with a young swordsman!"
Story-part37_1_2,"This is really not a good time... You go and entertain them first, and I will come as soon as I finish my work."
Story-part37_name,Young Swordsman
Story-part37_log,"Prince Chai has suddenly arrived with a young swordsman, I wonder what his intentions are."
Story-part37_2_1,{PlayerSurName} I pay my respects to Prince Chai.
Story-part37_2_2,I came here this time to introduce a young swordsman to Headmaster {PlayerSurName}.
Story-part37_2_3,"I am Liao Yuelong, please give me your guidance!"
Story-part37_2_4,This brother Liao is a good man from the rivers and lakes who recently joined me. What do you think of his talent and roots?
Story-part37_2_5,"Brother Liao has a restrained spirit and an elegant posture, he must be a good seedling for practicing swordsmanship."
Story-part37_2_6,Headmaster {PlayerSurName} really has a good eye!
Story-part37_2_7,"{MyFaction} has been working for me recently and has been very diligent. Naturally, I can't just sit back and enjoy the benefits, so I want to let this talented Brother Liao join your sect to help Headmaster {PlayerSurName}."
Story-part37_2_8,"(Is Prince Chai's behavior to provide talent for our sect, or to plant a nail in our sect, should I agree?)"
Story-part37_op_1_1,Refuse
Story-part37_op_1_2,Agree
Story-part37_3_1,"I appreciate your kindness, {PlayerSurName}, but our sect has too many rules, I'm afraid Brother Liao may not be able to adapt, please take back your order."
Story-part37_3_2,Hmph...
Story-part37_3_3,"Yuelong, you are so confident, but Headmaster {PlayerSurName} doesn't even look at you."
Story-part37_3_4,"Forget it, I won't force anyone, I'll take my leave."
Story-part37_4_1,"Since Your Highness is willing to let Brother Liao join our sect, {PlayerSurName} I dare not refuse."
Story-part37_4_2,"Yuelong, did you hear that? Hurry up and pay your respects to the headmaster!"
Story-part37_4_3,I dare to ask Headmaster {PlayerSurName} to promise me one thing first!
Story-part37_4_4,"No problem, take your time."
Story-part37_4_5,"When I was young, my family was suddenly robbed, and the real culprit has not been found... As long as Headmaster {PlayerSurName} promises to help find the real culprit in the future, I will be at your disposal without any complaints!"
Story-part37_4_6,"Such a matter of loyalty and filial piety, I will definitely take it upon myself."
Story-part37_4_7,Liao Yuelong pays respects to the headmaster!
Story-part37_4_8,"Good! Bring the wine, I want to celebrate for you."
Story-part37_5_1,"Headmaster, Prince Chai has been waiting for you in the guest hall all the time, and finally left with a pale face."
Story-part37_5_2,Ah... How could I forget about this? This will surely offend King Chai.
Story-part38_1_1,"Headmaster, although Tiger Escort has been destroyed, the elite escort Han Hongyu, who was ordered by Prince Chai to be arrested, has not been brought to justice."
Story-part38_1_2,"A disciple sent a message saying that Han Hongyu is now poor and down, and is actually doing a day's bodyguard work outside the casino in that small town."
Story-part38_1_3,What is a day's bodyguard?
Story-part38_1_4,"It is to put up a sign outside the casino saying ""One day's bodyguard, safe to home"", specifically serving those who win money in the casino and show off, sending them home safely."
Story-part38_1_5,"Since she is willing to do this lowly job that ordinary escort lieutenants despise, there must be some unspeakable difficulties. Send someone to check it out."
Story-part38_name,One Day Bodyguard
Story-part38_log,Han Hongyu is wanted by Prince Chai and has no choice but to do the lowly job of a one-day bodyguard.
Story-part38_2_1,One day bodyguard... safe to home...
Story-part38_2_2,"This should be the place where Han Hongyu takes on the job of a one-day bodyguard, strange, why is there no one here?"
Story-part38_2_3,"Is this gentleman here to win big money and ask Miss Hong for a ""safe return home""?"
Story-part38_2_4,"(Miss Hong? Yes, since she's wanted by King Chai, she must have changed her name in her daily life)"
Story-part38_2_5,"Excuse me, young man, why isn't Miss Hong here? I'm in a hurry to go home, afraid of being robbed by villains."
Story-part38_2_6,"You're a step too late. Miss Hong was just invited away. The Master who invited her looks strong, but he asked a weak woman to escort him. It's really strange."
Story-part38_2_7,(Something is wrong. Could someone have recognized her identity and is planning to trap her and present her to King Chai? Should I follow and get involved...)
Story-part38_op_1_1,"Our faction is already working for King Chai, no need to do more."
Story-part38_op_1_2,Why is King Chai so against a woman? Let's go and see.
Story-part38_3_1,"Our faction is already working for King Chai, go back, no need to do more."
Story-part38_4_1,"King Chai has repeatedly targeted a woman, which is too cruel. Let's go and see."
Story-part38_4_2,"Thinking of this, you suddenly feel a little sympathy.\nAfter asking the Gambler about Han Hongyu's location,\nyou immediately speed up with Qinggong.\nUnexpectedly, you encounter a bizarre ambush halfway."
Story-part38_4_3,"Miss Hong, no, Han Elite Escort, since you've fallen into our hands, it's better to surrender."
Story-part38_4_4,"If you fight and get hurt, the reward from Chai Wangye will be less!"
Story-part38_4_5,I was wondering why a person like you in the martial arts world would need a bodyguard escort. It turns out it was just a trap set for me.
Story-part38_4_6,"Although I know I will lose this battle, I will still resist with all my might. Please be prepared..."
Story-part38_4_7,"Cut... a vain woman who wants to save face, brothers, get her!"
Story-part38_4_8,"(Han Elite Escort is in such a desperate situation, but she is still so determined and strong. It's not easy. Should I save this heroine...)"
Story-part38_op_2_1,"Don't risk offending King Chai, forget it."
Story-part38_op_2_2,"Forget King Chai, I must save this person."
Story-part38_5_1,"Don't risk offending King Chai, forget it."
Story-part38_6_1,"Forget King Chai, I must save this person!"
Story-part38_6_2,"Han Elite Escort, don't panic, reinforcements are here!"
Story-part38_6_3,！……
Story-part38_6_4,"Where did this bird come from? Brothers, get him!"
Story-part38_7_1,Damn... I was too busy playing the hero and underestimated these people's strength...
Story-part38_7_2,"If I continue to fight, not to mention saving Han Elite Escort, I can't even save myself. I should retreat first..."
Story-part38_8_1,"Although you are from {MyFaction}, I am very grateful for your help this time."
Story-part38_8_2,"Han Elite Escort, don't be polite. The previous conflict between you and me was just for our own masters."
Story-part38_8_3,"Han Elite Escort... haha, Tiger Escort is gone. What's the difference between me now and a homeless dog?"
Story-part38_8_4,"If it weren't for the fact that I haven't paid off the severance pay for those old clerks in the escort agency, I might have killed myself long ago. Where would I do this lowly job of being a bodyguard for a day!"
Story-part38_8_5,This One Blade is the only valuable thing I have. I'll give it to you as a thank you for saving my life. I have to continue raising money for the clerks' severance pay. Goodbye.
Story-part38_8_6,"Wait, how much is the remaining severance pay?"
Story-part38_8_7,About 10000 coins.
Story-part38_op_3_1,I was just asking casually.
Story-part38_op_3_2,The sect will cover this money for you! (10000 Coin)
Story-part38_9_1,"No worries, I was just asking..."
Story-part38_9_2,"Han Biao... Miss Han Hongyu, the martial world is vast, please take care!"
Story-part38_10_1,"Don't worry, Han Elite Escort, our sect will cover the cost."
Story-part38_10_2,How could I possibly accept this...
Story-part38_10_3,"Well then, consider this money as a loan to me. Until I pay it back, I will temporarily join your sect and follow your orders!"
Story-part38_11_1,"Leader, after Han Hongyu took a one-day Bodyguard job, she suddenly disappeared. I wonder if she was caught by Chai Wang."
Story-part38_11_2,"This matter has nothing to do with our sect, just let it be."
Story-part39_1_1,"Leader, I have a friend in the Western Regions who is in trouble recently, could you send someone to help?"
Story-part39_1_2,"She used to live in seclusion in a valley, not caring about worldly affairs. But recently, for some reason, a large number of bandits have invaded the valley, constantly spying and harassing."
Story-part39_1_3,"No problem, I, as the sect leader, will personally take care of it."
Story-part39_name,Red Skull
Story-part39_log,"Han Hongyu's friend lives in a secluded valley, but is harassed by bandits."
Story-part39_2_1,I didn't expect such a beautiful valley to be here...
Story-part39_2_2,"Living in such a remote place and still being harassed by men, Han Elite Escort's friend must be a beauty."
Story-part39_2_3,"Am I seeing things? There's a stunning foreign beauty ahead, surrounded by a group of Soldiers."
Story-part39_2_4,Do you think I'm beautiful~
Story-part39_2_5,Beautiful... too beautiful... so beautiful it makes my heart itch...
Story-part39_2_6,"Since you think I'm beautiful, why don't you all stay and keep me company~"
Story-part39_2_7,"Such a beauty... I, I would love to!"
Story-part39_2_8,"Then I'll do as you wish, bury you all between this Blue Mountain and green water, so you won't have died in vain~"
Story-part39_2_9,"A bunch of useless men, attracted by such a small trick, wake up, all of you!"
Story-part39_2_10,"Oh, is the General trying to be like Liuxia Hui, remaining calm and composed~"
Story-part39_2_11,"Shut up! I only care about fame and fortune, how could I be charmed by a fox spirit like you?"
Story-part39_2_12,"But... it's a waste for a beauty like you to hide in the mountains. If I present you to Lord Chai Wang, when he ascends the throne in the future, how could he forget my contribution?"
Story-part39_2_13,"Stop daydreaming, you stinky men, bring it on!"
Story-part39_2_14,"Not all men are bad! Miss, I'm here to help you!"
Story-part39_3_1,"After all, they are organized imperial Soldiers, we are outnumbered, we should retreat back to the sect..."
Story-part39_4_1,Did you help me because you have ulterior motives?
Story-part39_4_2,"Miss, you're a bit sensitive... I'm here to help you at the request of Han Elite Escort."
Story-part39_4_3,Hongyu? I've been worried that she couldn't recover after the fall of Tiger Escort... Tell me where she is now!
Story-part39_4_4,"She's doing well in our {MyFaction}, her mental state is very good."
Story-part39_4_5,"I see you can't stay here for long, how about joining our sect?"
Story-part39_4_6,"Hongyu's judgement can't be wrong, I, Man Tuoluo, pay my respects to the sect leader!"
Story-part39_5_1,"Leader, my friend suddenly disappeared in that valley, I wonder if she's hiding again..."
Story-part39_5_2,"It must be so, don't worry too much."
Story-part40_1_1,"Leader, the head of Swallow Nest, Bu Juechen, is here to see you."
Story-part40_1_2,"Wrong, not the head, the former head."
Story-part40_1_3,"Swallow Nest has already been destroyed, the so-called leader is a thing of the past, not worth a sneer."
Story-part40_1_4,"Leader Bu, I've always been worried about you... Qingqing doesn't want to lose another elder who has been kind to me!"
Story-part40_1_5,"Hey, you little duckling, long time no see, you've even learned to hurt people, haha!"
Story-part40_1_6,I don't know how much effort the leader {PlayerSurName} has put into taking care of you.
Story-part40_1_7,"Humph, I've been behaving myself~"
Story-part40_1_8,"I wonder what Brother Bu plans to do next? If there's anything our sect can help with, just say the word."
Story-part40_1_9,The only plan I have next is to bother your sect.
Story-part40_1_10,"But don't flatter yourself, Leader {PlayerSurName}, I'm only doing this to spend more time with Qingqing."
Story-part40_1_11,"What are you talking about, Brother Bu? We'd love for you to stay longer."
Story-part40_1_12,"Anyway, I won't stay for free. Swallow Nest is gone, this Celestial Lady Scattering Flowers manual has lost its meaning, I'll give it to your sect."
Story-part40_1_13,"Thank you for the manual, Brother Bu! Our sect will make good use of it!"
Story-part41_1_1,"Leader, Constable Luo from the Crime Investigation Bureau is here to see you."
Story-part41_1_2,I heard that {MyFaction} has become a famous martial arts sect under the leadership of {PlayerSurName}.
Story-part41_1_3,"Compared to that, I, Luo, have ruined the Crime Investigation Bureau because of my lack of ambition and stubbornness. I'm really ashamed..."
Story-part41_1_4,"Brother, don't say that... This is definitely not your fault!"
Story-part41_1_5,"Qianxue, you haven't disappointed me in these years at {MyFaction}."
Story-part41_1_6,"It seems that Leader {PlayerSurName} is doing a better job than me, your own brother, in training you."
Story-part41_1_7,Brother... You really should thank {PlayerGivenName} for this...
