﻿DLC1Colon,：,：
DLC1PageForeign_结盟,"Alliance:\nWhen Relations reach a certain value, you can apply to form an alliance with the other sect.\nAfter a successful alliance, when I am attacked, the ally has a chance to attack the enemy of my sect.\nAfter a successful alliance, the income from trade will also be higher.","พันธมิตร:\nเมื่อความสัมพันธ์กับสำนักอื่นดีถึงระดับหนึ่ง สามารถขอสร้างพันธมิตรได้\nเมื่อสร้างพันธมิตรสำเร็จ หากสำนักของเราถูกโจมตี พันธมิตรอาจจะมาช่วยโจมตีศัตรูของเรา\nเมื่อสร้างพันธมิตรสำเร็จ รายได้จากการค้าจะเพิ่มขึ้น"
DLC1MenuTutorial,Tutorial level,บทช่วยสอน
DLC1TutorialFactionRenameTip,Give your sect a resounding name,ตั้งชื่อสำนักของท่านให้เลิศเลอน่าจดจำ สะท้านยุทธภพ
DLC1TutorialOpen,"Do you want to open the tutorial level?\n<#ff5555>If you are playing this mode for the first time, it is strongly recommended that you go through the tutorial level.</color>","ท่านต้องการเล่น ""บทช่วยสอน"" หรือไม่?\n<#ff5555>หากเล่นโหมดนี้เป็นครั้งแรก ขอแนะนำให้ผ่าน ""บทช่วยสอน"" ก่อน</color>"
DLC1ActionAppeaseLock,"%c%All regions are very stable, no need for benevolence",%c% ทุกพื้นที่ที่มีความมั่นคงดี ไม่จำเป็นต้องใช้การช่วยเหลือผู้คน
DLC1ActionSupportLock,%c%No stationed Disciples need resupply,%c% ไม่มีศิษย์ประจำการที่ต้องการรับการจัดส่งเสบียง
DLC1ActionCureLock,%c%No Disciples need healing,%c% ไม่มีศิษย์ที่ต้องการการรักษา
DLC1ActionJourneyLock,%c%No events can be executed,%c% ไม่มีเหตุการณ์ใดที่สามารถดำเนินการได้
DLC1ActionTraderLock,"%c%No Merchant has visited, please Unlock more Merchants in the plan.",%c% ไม่มีพ่อค้ามาเยือน กรุณาปลดล็อกพ่อค้าเพิ่มเติมในแผนการ
DLC1CapitalBeAttackedNoDefend,"Your current sect's headquarters is under Attack, are you sure you don't want to send anyone to defend?",ตอนนี้สำนักหลักของท่านถูกโจมตี ท่านแน่ใจว่าไม่ส่งคนไปป้องกันหรือ?
DLC1CompCharacterLock_moodDown,Mood is too low to act!,ค่าอารมณ์ต่ำเกินไปที่จะลงมือ!
DLC1CompCharacterLock_actioned,You have already taken action this month!,ในเดือนนี้ได้ดำเนินการแล้ว!
DLC1CompCharacterLock_cureNoNeed,No need for healing!,ไม่ต้องการการรักษา!
DLC1CompCharacterLock_researched,You have already meditated this month!,ท่านได้ทำสมาธิไปแล้วในเดือนนี้!
DLC1PageManage_升职,"Promote outer Disciples to inner Disciples to increase the Level limit of Disciples.\nNote: The sect leader and inner Disciples cannot be promoted.","ให้ศิษย์นอกเลื่อนขั้นเป็นศิษย์ใน เพื่อเพิ่มขีดจำกัดระดับของลูกศิษย์\nหมายเหตุ: เจ้าสำนักและศิษย์ในไม่สามารถเลื่อนขั้นได้"
DLC1PageManage_退门,"Force a Disciple to leave the sect, the Disciple who leaves the sect cannot be recruited again.\nNote: The sect leader and Disciples who have already taken action this round cannot be forced to leave.","บังคับให้ลูกศิษย์ออกจากสำนัก ศิษย์ที่ออกจากสำนัก จะไม่สามารถถูกรับสมัครกลับมาอีกได้\nหมายเหตุ: เจ้าสำนักและศิษย์ที่ได้ดำเนินการในรอบนี้ จะไม่สามารถทำการออกจากสำนักได้"
DLC1ActionCreateKungfuTitle,Comprehension,รวมวิชา
DLC1ActionCreateKungfuContent,"By consuming contemplation points, Characters with Learn aptitude can comprehend martial arts and understand new powerful martial arts.\nThe higher the Intelligence of the Character, the higher the probability of comprehending ""dual effect"" martial arts.","ใช้แต้มเรียนรู้ เพื่อให้ตัวละครที่มีคุณสมบัติได้รวมวิชาวรยุทธ์ใหม่ๆ ที่แข็งแกร่งขึ้น\nยิ่งตัวละครมีค่าสติปัญญามากเท่าไร ความน่าจะเป็นที่ตัวละครจะสามารถรวมวิชาได้ ""สองผลลัพธ์"" ก็จะยิ่งสูงขึ้นเท่านั้น"
UIPageJourneyNeedNpc,%lc%The protagonist needs to be in the team,%lc% ต้องมีตัวละครหลักในทีม
DLC1AiAttackHq,%l%{0} is preparing to attack {1}'s headquarters.,%l% {0} เตรียมโจมตีสำนักหลักของ {1}
DLC1Difficult-0,Easy,ง่าย
DLC1Difficult-1,Normal,ปกติ
DLC1Difficult-2,Hard,ยาก
DLC1Difficult-3,Nightmare,ฝันร้าย
DLC1TipFactionCreateDiff1Title,Easy,ง่าย
DLC1TipFactionCreateDiff2Title,Normal,ปกติ
DLC1TipFactionCreateDiff3Title,Hard,ยาก
DLC1TipFactionCreateDiff4Title,Nightmare,ฝันร้าย
DLC1TipFactionCreateDiff1Content,"Initially receive 800 sect points, a relatively easy gameplay difficulty, AI's damage is reduced by <color=#0cf045>50%</color>, AI's resource acquisition is reduced by <color=#0cf045>50%</color>.","เริ่มต้นด้วยแต้มสำนัก 800 แต้ม ระดับความยากในการเล่น ""ง่าย"", AI ทำความเสียหายลดลง <color=#0cf045>50%</color> และการเก็บทรัพยากรของ AI ลดลง <color=#0cf045>50%</color>"
DLC1TipFactionCreateDiff2Content,"Initially receive 500 sect points, a recommended gameplay difficulty, AI will cause Normal damage and Normal resource acquisition.",เริ่มต้นด้วยแต้มสำนัก 500 แต้ม แนะนำให้เล่นระดับความยากนี้ AI จะทำความเสียหายและเก็บทรัพยากรในระดับทั่วไป
DLC1TipFactionCreateDiff3Content,"Initially receive 400 sect points, a relatively Hard gameplay difficulty, AI's Increases Damage by <color=#d70ced>50%</color>, AI's resource acquisition increases by <color=#d70ced>50%</color>.","เริ่มต้นด้วยแต้มสำนัก 400 แต้ม ระดับความยาก ""ยาก"", AI ทำความเสียหายเพิ่มขึ้น <color=#d70ced>50%</color> และการเก็บทรัพยากรของ AI เพิ่มขึ้น <color=#d70ced>50%</color>"
DLC1TipFactionCreateDiff4Content,"Initially receive 300 sect points, a very Hard gameplay difficulty, AI's Increases Damage by <color=#c02b10>100%</color>, AI's resource acquisition increases by <color=#c02b10>100%</color>.","เริ่มต้นด้วยแต้มสำนัก 300 แต้ม ระดับความยาก ""ฝันร้าย"", AI ทำความเสียหายเพิ่มขึ้น <color=#c02b10>100%</color> และการเก็บทรัพยากรของ AI เพิ่มขึ้น <color=#c02b10>100%</color>"
DLC1ActionsTip1Hq,%lc%Our sect has launched an attack on {0}'s headquarters.,%lc% สำนักเราได้ทำการโจมตีสำนักหลักของ {0}
DLC1ActionsTip18,%lc% already has the same innate feature,%lc% มีทักษะพิเศษเริ่มต้นแบบเดียวกันแล้ว
DLC1PageForeign_交好lock,This sect will no longer engage in any diplomatic actions with you.,สำนักนี้จะไม่ทำการทูตกับท่านอีกต่อไป
DLC1PageForeign_贸易lock,This sect will no longer engage in any diplomatic actions with you.,สำนักนี้จะไม่ทำการทูตกับท่านอีกต่อไป
DLC1PageForeign_和解lock,This sect will no longer engage in any diplomatic actions with you.,สำนักนี้จะไม่ทำการทูตกับท่านอีกต่อไป
DLC1PageForeign_结盟lock,This sect will no longer engage in any diplomatic actions with you.,สำนักนี้จะไม่ทำการทูตกับท่านอีกต่อไป
DLC1PvcStage2Info,"This land needs to be stabilized through <color=#c44b0e>Benefiting the People</color>.\nThe effect of Benefiting the People will take effect at the beginning of next month, and the icon background will turn <color=#32CD32>green</color>.","พื้นที่นี้ต้องการการเพิ่มความมั่นคงผ่าน <color=#c44b0e>ช่วยเหลือผู้คน</color>\nผลจากการช่วยเหลือผู้คนจะมีผลในช่วงเริ่มต้นของเดือนหน้า โดยสีพื้นหลังของไอคอนจะเปลี่ยนเป็น <color=#32CD32>สีเขียว</color>"
DLC1PvcStage1Info,"This land needs to <color=#c44b0e>Supply</color> to Recovery the HP and MP of the stationed Disciples.\nThe effect of Supply will take effect at the beginning of next month, and the icon background will turn <color=#32CD32>green</color>.","พื้นที่นี้ต้องการการสนับสนุนผ่าน <color=#c44b0e>เสบียง</color> เพื่อฟื้นฟู HP และ MP ของศิษย์ที่ประจำการอยู่\nผลของการเติมเสบียงจะมีผลในช่วงเริ่มต้นของเดือนหน้า โดยสีพื้นหลังของไอคอนจะเปลี่ยนเป็น <color=#32CD32>สีเขียว</color>"
DLC1DefendBonus,"%lc% Defense successful, resources captured:",%lc% ป้องกันสำเร็จ ได้รับทรัพยากร:
DLC1SettingAutoSaveTime,Auto Save Interval,บันทึกอัตโนมัติ
DLC1CustomKungfuNamePlaceholder,New martial arts,วรยุทธ์ใหม่
DLC1CreateKungfuTips,Please select the Character for Comprehension of Martial Arts,กรุณาเลือกตัวละครที่จะรวมวรยุทธ์
DLC1CreateKungfuTips1,Comprehension,รวมวิชา
DLC1CreateKungfuTips2,Select basic martial arts,เลือกวรยุทธ์พื้นฐาน
DLC1CreateKungfuTips3,Start comprehension,เริ่มต้นรวมวรยุทธ์
DLC1CreateKungfuTips4,Obtain new martial arts,ได้รับวรยุทธ์ใหม่
DLC1CreateKungfuTips5,Name the martial arts,ตั้งชื่อให้กับวรยุทธ์
DLC1CreateKungfuTips6,Comprehend,เรียนรู้
DLC1CreateKungfuTips7,Abandon,ละทิ้ง
DLC1MenuScenarioMode,Story mode,โหมดเนื้อเรื่อง
DLC1CreateBtnTips1,Already acted,ได้ทำการแล้ว
DLC1CreateBtnTips2,%lc%Conditions not met,%lc% ไม่เป็นไปตามเงื่อนไข
DLC1CreateBtnTips3,Please name the martial arts,กรุณาตั้งชื่อวรยุทธ์
UISlgPlayerCreateTip1,Create Character,สร้างตัวละคร
UISlgPlayerCreateTip2,Point consumption: {0} points,ใช้แต้ม: {0} แต้ม
UISlgPlayerCreateTip3,Mastery of martial arts,เชี่ยวชาญวรยุทธ์
UISlgPlayerCreateTip4,Start Game,เริ่มต้นเกม
UISlgPlayerCreateTip5,Unallocated points: {0} points,แต้มที่ไม่ได้จัดสรร: {0} แต้ม
UISlgPlayerCreateTip6,%c%Insufficient remaining points,%c% แต้มที่เหลือไม่เพียงพอ
UISlgFactionCreate1,Initial martial arts: {0} points,วรยุทธ์เริ่มต้น: {0} แต้ม
UISlgFactionCreate2,Initial Disciples: {0} points,ศิษย์เริ่มต้น: {0} แต้ม
UISlgFactionCreate3,Initial resources: {0} points,ทรัพยากรเริ่มต้น: {0} แต้ม
UISlgFactionCreate4,Development direction: {0} points,ทิศทางการพัฒนา: {0} แต้ม
UISlgFactionCreate5,Create sect,สร้างสำนัก
UISlgFactionCreate6,Select development direction,เลือกทิศทางการพัฒนา
UISlgFactionCreate7,Preview,ดูตัวอย่าง
DLC1ActionNewRecruitTitle,Post Station,สถานีพัก
DLC1ActionNewRecruitContent,"In the post station, you can choose some characters to join your sect, or let your sect's disciples enter the post station. By eliminating some sects or triggering some companion events, you can enrich the disciples in the post station.",ในสถานีพักสามารถเลือกตัวละครบางตัวเข้าสำนักได้ หรือให้ศิษย์ของสำนักเข้าสู่สถานีพักได้ การกวาดล้างบางสำนัก หรือทำให้เกิดเหตุการณ์กับพันธมิตร สามารถเพิ่มจำนวนศิษย์ในสถานีพักได้
DLC1UIPageManageRelax,Rest,พักผ่อน
DLCPageManage_休息,"Move the disciples in the sect into the post station's storage, and they can be activated at any time. Note: Disciples who have acted this month cannot rest.",ย้ายศิษย์ภายในสำนักไปยังคลังของสถานีพัก และสามารถเรียกใช้งานได้ตลอดเวลา หมายเหตุ: ศิษย์ที่ดำเนินการในเดือนนี้แล้วจะไม่สามารถพักผ่อนได้
DLC1ManageRelaxTip,Do you want to move {0} into the post station?,ต้องการย้าย {0} ไปยังสถานีพักหรือไม่?
DLC1MenuStartGame,Contest Mode,โหมดชิงอำนาจ
UIPageComprehendForgetFactionKungfuTip,"Do you want to delete {0}?\nPlease note that this operation is irreversible!","ต้องการลบ {0} หรือไม่?\nหมายเหตุ: การดำเนินการนี้ไม่สามารถย้อนกลับได้!"
SlgNpcToStoreTitle,Character joined,ตัวละครเข้าร่วม
SlgNpcToStore,%ls%{0} has now entered the post station. You can operate Joining Sect in the post station.,%ls% {0} ได้เข้าสู่สถานีพักแล้ว สามารถดำเนินการในสถานีพักเพื่อเข้าร่วมสำนักได้
DLC1NewRecruitUIDownTips,"In the post station, you can choose some characters to join your sect, or let your sect's disciples enter the post station. By eliminating some sects or triggering some companion events, you can enrich the disciples in the post station.",ในสถานีพักสามารถเลือกตัวละครบางตัวเข้าสำนักได้ หรือให้ศิษย์ของสำนักเข้าสู่สถานีพักได้ การกวาดล้างบางสำนัก หรือทำให้เกิดเหตุการณ์กับพันธมิตร สามารถเพิ่มจำนวนศิษย์ในสถานีพักได้
Dlc1SettingTitle_RunInBackground,Game run in background,เกมจะดำเนินการในพื้นหลัง
Dlc1SettingTitle_AutoBattleWhenStart,Automatically start combat after battle starts,เมื่อเริ่มการต่อสู้ จะเปิดการต่อสู้อัตโนมัติโดยค่าเริ่มต้น
Dlc1SettingTitle_EpOnlyVisible,MP continuously displayed at the start of the battle,เมื่อเริ่มการต่อสู้ MP จะแสดงอย่างต่อเนื่อง
Dlc1SettingTitle_HpBarResident,HP continuously displayed after battle starts,เมื่อเริ่มการต่อสู้ HP จะแสดงอย่างต่อเนื่อง
Dlc1SettingTitle_JoyStickVibration,Controller Vibration,การสั่นของจอยเกม
Dlc1SettingTitle_ClickBattle,Skip the story quickly,ข้ามเนื้อเรื่องอย่างรวดเร็ว
DLC1UIPageCreateKungfuDownTips,"The higher the intelligence of the character, the higher the probability of comprehending a ""double effect"" martial arts.","ยิ่งตัวละครมีค่าสติปัญญามากเท่าไร ความน่าจะเป็นที่ตัวละครจะสามารถรวมวิชาได้ ""สองผลลัพธ์"" ก็จะยิ่งสูงขึ้นเท่านั้น"
UIPageComprehendReadKungfuGrayTips,%lc%This martial arts has been comprehended,%lc%เรียนรู้วรยุทธ์นี้แล้ว
UIPageComprehendUnlockKungfuGrayTips,%lc%Not met the comprehension conditions,%lc% ยังไม่ถึงเงื่อนไขในการเรียนรู้
Dlc1SettingTitle_ShowDlc3Painting,"Activate the ""Canvas of Heroes"" portrait pack","เปิดใช้งานภาพตัวละครใหม่จากชุดเสริม ""โฉมใหม่วาดฝัน"""
