﻿NpcMumble_长春子弱对白,"The Tao gives birth to One, One gives birth to Two, Two gives birth to Three, Three gives birth to all things.|The Tao that can be spoken is not the eternal Tao.|We, the disciples of the Taoist Sect, should save the world.|Junior brother, be serious!|Don't slack off in learning.|Hold it steady.",เต๋าให้กำเนิดหนึ่ง หนึ่งให้กำเนิดสอง สองให้กำเนิดสาม สามให้กำเนิดทุกสิ่ง|เต๋าที่พูดถึงนั้นไม่ใช่เต๋านิรันดร์|พวกเราซึ่งเป็นสาวกของลัทธิเต๋าควรกอบกู้โลก|น้องชาย ้ข้าจริงจังนะ!|อย่าหย่อนยานกับการฝึกฝนของเจ้า|ตั้งมั่นไว้
NpcMumble_长春子霖安城弱对白,"Uncle Master, where did he go again...|Uncle Master, don't cause any more trouble...|Uncle Master, Uncle Master! Where are you?|Where can I get Monkey wine in Lin'an City...|At this critical moment, where did Uncle Master go...",อาจารย์อาไปไหนอีกแล้ว...|อาจารย์อา อย่าก่อปัญหาอีกเลย...|อาจารย์อา อาจารย์อา! ท่านอยู่ไหน?|ข้าจะหาสุราวานรได้ที่ไหนในเมืองหลินอัน...|ยามหน้าสิ่วหน้าขวานเช่นนี้ อาจารย์อาไปอยู่ที่ไหน..
NpcMumble_长春子霖安城找回邋遢张弱对白,"Uncle Master, please don't run away again.|Uncle Master, think about us too...|I want to go back to the mountain...|We can't let Uncle Master run away again.",อาจารย์อาท่านอย่าหนีไปไหนอีกนะ|อาจารย์อาคำนึงถึงพวกเราด้วย...|ข้าอยากกลับเขาแล้ว...|พวกเราจะไม่ปล่อยให้อาจารย์อาหนีไปไหนอีกแล้ว
NpcMumble_长春子完颜亮弱对白,"Taoist Sect doesn't welcome you, please run away.|Our sword formation is a secret, how can we let you see it?|We don't welcome people from Yan country, please leave.",สำนักเต๋าไม่ต้อนรับเจ้า รีบออกไปเสียเถิด|กระบวนท่ากระบี่ของเราเป็นความลับ เราจะให้เจ้าดูได้อย่างไร|เราไม่ต้อนรับผู้คนจากรัฐหยาน กรุณาออกไปซะ
NpcMumble_苗木黎弱对白,"Damn Central Plains people...|Sooner or later, we will counterattack the Central Plains!|Let those women know the power of our Jiuli!|Wait until my poison skill is complete...|The God of Jiuli needs the blood of a virgin for sacrifice...|Damn that Fu Yaoqin...|Those women are always against me...",เวรเอ้ย พวกที่ราบภาคกลาง...|ไม่ช้าก็เร็ว เราจะตอบโต้ที่ราบภาคกลาง!|ให้นังพวกนั้นรู้ว่าพวกเราจิ่วหลี่แข็งแกร่งแค่ไหน!|รอจนกว่าทักษะพิษของข้าจะเสร็จสมบูรณ์...|เทพเจ้าจิ่วหลี่ต้องการเลือดของสาวพรหมจารีเป็นเครื่องสังเวย...|ให้ตายเถอะ ฟู่ เหยาชิน...|นังพวกนั้นมักจะต่อต้านข้า...
NpcMumble_苗木黎妙音坊灭门弱对白,"Those who oppose me have only one way to die!|Finally, those women...|Hahaha, now you know how powerful I am!|Fu, you dare to look down on me!|Finally, no one is my enemy!|The poison skill of Jiuli is invincible in the world!|Hahaha...ha...",คนที่กล้าต่อต้านข้าต้องตายสถานเดียว!|สุดท้ายแล้วนังพวกนั้น...|ฮ่าฮ่าฮ่า ตอนนี้เจ้าก็รู้แล้วว่าข้าแข็งแกร่งแค่ไหน!|ฟู่ เจ้ากล้าดูถูกข้า!|สุดท้ายก็ไม่มีใครสู้ข้าได้!|ทักษะพิษของ จิ่วหลี่ นั้นไร้เทียมทาน!|ฮ่าฮ่าฮ่า...ฮ่า...
NpcMumble_苗木黎镇西关灭门弱对白,"West Pass is seriously injured, my chance has come!|No one can stop me from returning to the Central Plains!|",ด่านชายแดนตะวันตกเสียหายอย่างหนัก โอกาสของข้ามาแล้ว|ไม่มีใครสามารถหยุดข้าไม่ให้กลับไปยังที่ราบภาคกลางได้!|
NpcMumble_洪小七弱对白,"I'm hungry...|I really want to have a big meal.|The cooking skills of Boss Hua are really good.|Whoever can feed me, I'll recognize him as the boss!",ข้าหิว...|ข้าอยากกินอาหารมื้อใหญ่|ทักษะการทำอาหารของพี่ใหญ่ฮวานั้นดีจริง ๆ|ใครก็ตามที่เลี้ยงเราได้จะเป็นพี่ใหญ่ของเรา!
NpcMumble_洪小七楚襄城弱对白,……|I didn't expect to come back here...|Dad...,……|ข้าไม่คิดว่าจะได้กลับมาที่นี่อีก...|ท่านพ่อ...
NpcMumble_任中横弱对白,
NpcMumble_苗彩蝶弱对白,"Butterfly wants to see the scenery of the Central Plains!|Brother always gives Caidie difficult problems.|When can Butterfly go out to play.|Brother says that all the women in Melody House are bad.|Brother has been studying ""blood sacrifice"" recently...|Playing the flute is so difficult...|La la la, the new Gu worm has grown~","เจ้าผีเสื้อต้องการเห็นทิวทัศน์ของดินแดนจงหยวน!|ท่านพี่มักสร้างเรื่องยุ่งยากให้ไฉตี้อยู่เสมอ|เมื่อไหร่เจ้าผีเสื้อจะได้ออกไปโบยบินนะ|ท่านพี่บอกว่าสตรีทุกนางในตำหนักบทเพลงล้วนมิใช่คนดี|ช่วงนี้ท่านพี่กำลังศึกษาเรื่อง ""การบูชายันต์เลือด""...|การเป่าขลุ่ยนี่ยากเหมือนกันนะ... |ลา ลา ลา เจ้าหนอนกู่ตัวใหม่โตขึ้นแล้ว~"
NpcMumble_苗彩蝶霖安城弱对白,"So many little guys I've never seen before~|The Central Plains is so interesting!|Xiao Hua, let's dance together~|Don't be angry, Thin Bamboo stick, Butterfly will give you delicious leaves~|La la la la la~",มีเด็กน้อยมากมายที่ข้าไม่เคยพบเห็นมาก่อน~|ที่ราบภาคกลางน่าสนใจมาก!|เสี่ยวฮวา มาเต้นด้วยกันเถอะ~|อย่าโกรธไปเลย เจ้าผีเสื้อ ไม้ไผ่บาง ๆ จะให้ใบไม้อร่อย~|ลา ลา ลา ลา ~
NpcMumble_苗彩蝶被赶走弱对白,"Brother is right, the people in the Central Plains are all bad!|Caidie will never go to the Central Plains again!",ท่านพี่กล่าวได้ถูกต้อง ผู้คนในจงหยวนล้วนไม่มีดี! |ไฉตี้จะไม่ไปที่จงหยวนอีกแล้ว!
NpcMumble_苗彩蝶一起看虫子弱对白,"Brother always says that the people in the Central Plains are bad, but Caidie has only met good people!|Thin Bamboo stick, Xiao Hua, are you all okay?|The Central Plains is so interesting, Caidie wants to go again!",ท่านพี่กล่าวเสมอว่าผู้คนในจงหยวนนั้นหาคนดีไม่ได้ แต่ไฉตี้ได้พบแต่คนดีๆทั้งนั้น|ไม้ไผ่อันบาง ๆ เสี่ยวฮวา เจ้าสบายดีไหม?|จงหยวนน่าสนใจจริงๆ ไฉตี้อยากไปที่นั่นอีกครั้ง!
NpcMumble_苗彩蝶被拒绝弱对白,"Caidie is the saint of Jiuli, and she must protect the tribe in this life.|Caidie will not run away from the tribe again.|Caidie will spend the rest of her life in the tribe.",ไฉตี้เป็นธิดาเทพแห่งเผ่าจิ่วหลี่ และนางต้องอุทิศชีวิตเพื่อปกป้องเผ่า|ไฉตี้จะไม่ไปจากเผ่าอีกแล้ว |ไฉตี้จะอยู่ที่เผ่าตลอดไป
NpcMumble_苗彩蝶九黎部落灭门弱对白,"Although Brother is scary, he is still nice to Caidie.|Brother...|There is nothing to miss here anymore.|Caidie doesn't want to come back here anymore.",แม้ว่าท่านพี่ของข้าจะน่ากลัว แต่เขาก็ใจดีกับไฉตี้มาก|ท่านพี่...|ที่นี่ไม่ทีอะไรให้คิดถึงอีกแล้ว|ไฉตี้ไม่อยากกลับมาที่นี่อีกแล้ว
NpcMumble_苗彩蝶血蛊治愈弱对白,"The young man is so powerful!|Caidie's illness is really cured~|Brother's poison dragon is dead, Brother won't be angry, right...",ชายผู้นี้แข็งแกร่งจริงๆ!|อาการป่วยของไฉตี้หายขาดแล้วจริง ๆ~|มังกรพิษของท่านพี่จากไปเสียแล้ว ท่านพี่จะไม่โกรธใช่ไหม...
NpcMumble_释嗔弱对白,"I really want to go back to the temple...|Amitabha, it's all good.|Damn Lü Wenhuan!|I didn't do anything!|If I have a chance to return to Chuxiang City...",ข้าอยากกลับวัดจริงๆ...|อมิตาพุทธ มันเป็นเรื่องดี|ให้ตายเถอะ หลู่ เหวินฮวน!|ข้าไม่ได้ทำอะไรเลย!|ถ้าข้ามีโอกาสกลับเมืองชูเซียง...
NpcMumble_释嗔伪装弱对白,"Oh, the open wound is acting up again...|Why isn't this wound healing...|These lackeys are really ruthless!|I hope I won't be seen hiding here.",โอ้ย บาดแผลกำเริบอีกแล้ว...|ทำไมบาดแผลไม่ดีขึ้นเลยล่ะ...|ไอ้สารเลวเหล่านี้โหดเหี้ยมมาก!|ข้าหวังว่าข้าจะไม่ถูกพบที่นี่หรอกนะ
NpcMumble_释嗔入狱弱对白,"That stinky kid!|If I could run away from this!|Damn it, you bunch of lackeys!|Have a fair fight with me!",ไอ้เด็กหน้าเหม็นนั่น!|หากข้าสามารถหนีจากสิ่งนี้ได้!|ให้ตายเถอะ ไอพวกขี้ข้า!|สู้กับข้าอย่างยุติธรรม!
NpcMumble_凌鸿轩弱对白,"Dream Butterfly, I will definitely cure you!|I'm here, no one will disturb you.|I will never let those insects get close to you!|Brother will protect you for a lifetime!|What are you looking at, stay away from me!",ผีเสื้อกลางคืน ข้าจะรักษาเจ้า!|ข้าอยู่ที่นี่แล้วจะไม่มีใครทำอะไรเจ้าได้|ข้าจะไม่ยอมให้แมลงพวกนั้นเข้าใกล้เจ้าเด็ดขาด!|พี่จะปกป้องเจ้าไปตลอดชีวิต!|มองอะไรอยู่นะ อยู่ให้ห่างจากข้า!
NpcMumble_凌鸿轩邙山穴弱对白,……,……
NpcMumble_凌鸿轩治好病弱对白,"Thanks to that kid...|That kid wouldn't have any improper thoughts about Dream Butterfly, would he?|No, I can't let him do anything to Dream Butterfly...|Even that kid, don't think about touching a finger of Dream Butterfly!|Why is that kid so concerned about Dream Butterfly, could it be...|Finally, I don't have to look at Mr. Cai's face anymore.|Where should I go next...",ต้องขอบคุณเด็กคนนั้น...|เด็กคนนั้นคงไม่มีความคิดแย่ ๆ กับผีเสื้อฝันใช่ไหม|ไม่ ข้าปล่อยให้เขาทำอะไรกับผีเสื้อฝันไม่ได้...|แม้แต่เด็กคนนั้นก็อย่าคิดว่าจะแตะผีเสื้อฝันได้แม้แต่ปลายนิ้ว!|ทำไมเด็กคนนั้นถึงกังวลเรื่องผีเสื้อฝันขนาดนั้นล่ะ...|สุดท้าย ข้าก็ไม่วามารถมองหน้าคุณไช่ได้อีก|ข้าควรไปทางไหนต่อดี...
NpcMumble_凌梦蝶弱对白,"Zzzzz……|zzzzz……|Z……zzzz……|Damn, I think I fell asleep again...|The books here are very interesting.|Rather than looking for an antidote for me, I hope my brother can live his life well.|I'm starting to feel sleepy again...|Let's take a short nap...|Zzzzz……|zzzzz……|Z……zzzz……|It's too hard for my brother...|How can I make my brother a little more relaxed...|I wish my brother could spend more time with me...|Dream Butterfly doesn't want to be a burden to my brother...",Zzzzz……|zzzzz……|Z……zzzz……|ให้ตายเถอะ ข้าคิดว่าข้าเผลอหลับไปอีกแล้ว...|หนังสือที่นี่น่าสนใจมาก |แทนที่จะหาทางรักษาข้า ข้าอยากให้พี่ของข้ามีชีวิตที่ดี|เริ่มง่วงอีกแล้ว...|งีบหลับสักหน่อย...|Zzzzz……|zzzzz……|Z……zzzz……|มันยากเกินไปสำหรับพี่ของข้า...|ข้าจะทำให้พี่ของข้าสบายใจขึ้นยังไงดี...|ข้าหวังว่าพี่ของข้าจะใช้เวลาร่วมกันมากขึ้น...|ผีเสื้อฝันไม่อยากเป็นภาระให้พี่ของข้า...
NpcMumble_凌梦蝶治好病弱对白,"I didn't expect this disease to have a cure one day.|I should appreciate the great scenery in the future.|Now that I'm cured, my brother should pursue his own goals, right?|There are many books here that I haven't finished reading...|To ask me to run away without reading these books, I'm a bit reluctant...|I didn't expect that besides my brother, there are others who would treat me so well...",ข้าไม่เคยคิดเลยว่าวันหนึ่งโรคนี้จะหายขาด |ข้าควรจะชื่นชมทิวทัศน์ที่สวยงามในอนาคต|อาการป่วยหายแล้วน้องชายน่าจะทำตามเป้าหมายได้ใช่ไหม? |ที่นี่ยังมีหนังสืออีกหลายเล่มที่ยังอ่านไม่จบ... |ที่จะขอให้หนีไปโดยไม่อ่านหนังสือพวกนี้ ข้าก็ลังเลนิดหน่อย...|ไม่คิดว่าจะมีใครใจดีกับฉันขนาดนี้ นอกจากพี่ชายของฉัน.
NpcMumble_叶银瓶弱对白,The outside world is more interesting.|The military camp is so boring.|Did brother make dad angry?|Dad is really old-fashioned.|Being a chivalrous hero is the real fun!,โลกภายนอกน่าสนใจยิ่งนัก|ในค่ายทหารมันน่าเบื่อมาก |ท่านพี่ไม่ได้ทำให้พ่อโกรธใช่ไหม?|พ่อหัวโบราณจริง ๆ|การเป็นฮีโร่ผู้กล้าหาญนั้นสนุกจริง ๆ!
NpcMumble_叶银瓶浮屠寺弱对白,"You despicable scoundrels of the Nine Factions Sect!|Let me show you the power of the Ye Family Spear!|My father will not let you go!|If you dare, face me head on!",เจ้าวายร้ายที่น่ารังเกียจแห่งนิกายเก้าฝ่าย!|ให้ข้าแสดงให้เจ้าเห็นถึงพลังของหอกตระกูลเย่!|พ่อของข้าไม่ปล่อยเจ้าไว้แน่!|ถ้ากล้าก็เผชิญหน้ากับข้าซะ!
NpcMumble_叶鹏举弱对白,"Intimate knowledge of the enemy ensures victory in every battle.|A general should possess wisdom, trustworthiness, benevolence, courage, and discipline.|Don't waste your youth in vain, it's heartbreaking.|If one is willing to dedicate oneself to the country, what can't be done?|Your Majesty, I will welcome you back to the court!|If only raising children were as simple as leading an army...",รู้เขารู้เรารบร้อยครั้งชนะร้อยครั้ง|แม่ทัพควรมีสติปัญญา ความน่าเชื่อถือ ความเมตตา ความกล้าหาญ และมีระเบียบวินัย|อย่าปล่อยให้ความเยาว์วัยของคุณสูญเปล่าโดยเปล่าประโยชน์ มันน่าเศร้า|ถ้าจะอุทิศตนเพื่อชาติ ทำไมจะทำไม่ได้?|ฝ่าบาท ข้าพเจ้ายินดีต้อนรับพระองค์กลับสู่ราชสำนัก!|หากการเลี้ยงเด็กนั้นง่ายดายเหมือนกับการออกรบ...
NpcMumble_重阳子弱对白,"Mysterious upon mysterious, the gateway to all wonders.|The Tao is like an empty vessel, yet in use it is never filled. Oh, unfathomable source of ten thousand things.|The reason the universe is eternal is that it does not live for itself, hence it can achieve longevity.|Did my junior brother cause trouble again?",ลึกลับซับซ้อน หนทางสู่ทุกสิ่งมหัศจรรย์|เต๋าเปรียบเสมือนภาชนะที่ว่างเปล่าที่เติมไม่เคยเต็ม โอ้ แหล่งกำเนิดสิ่งที่ไม่อาจเข้าใจใดนับหมื่น|เหตุผลที่จักรวาลเป็นนิรันดร์ก็คือมันไม่ได้อยู่เพื่อตัวมันเอง ดังนั้นจึงสามารถมีอายุยืนยาวได้|น้องชายของข้าก่อปัญหาอีกแล้วเหรอ?
NpcMumble_重阳子阶段二后弱对白,What on earth does the Nine Factions Sect want to do...,นิกายเก้าฝ่ายต้องการจะทำอะไรในยุทธภพนี้กันแน่...
NpcMumble_重阳子老魔头逃出后弱对白,"With that demon escaping, I'm afraid there will be bloodshed again...|If only back then...|Alas, it's all karma...",หากปีศาจหนีไปได้ เกรงว่านองเลือดเกิดขึ้นอีก...|ถ้าย้อนกลับไปตอนนั้น...|อนิจจามันเป็นกรรมทั้งหมด...
NpcMumble_方啸天弱对白,
NpcMumble_柴王爷弱对白,"Sit on the mountain and watch the tigers fight.|This chaos is exactly what I've been waiting for.|Keep fighting, the more chaotic, the better.|When the snipe and the clam grapple...|In the world, things will unite if they are long divided, and divide if they are long united.",นั่งบนภูเขาชมการต่อสู้ของเสือ|ความวุ่นวายนี้ตรงกับสิ่งที่ฉันรอคอย|ต่อสู้กันเข้าไป ยิ่งวุ่นวายยิ่งดี|นกอีก๋อยกับหอยต่อสู้กัน... |สิ่งต่าง ๆ ในยุทธภพ จะรวมกันหากแบ่งแยกกันเป็นเวลานาน และจะแบ่งแยกหากรวมกันเป็นเวลานาน
NpcMumble_邋遢张弱对白,"It's so boring on the mountain, it's better to go down.|In drunkenness, the world is vast, and the days and months are long in the pot.|My senior brother is good in every way, but he's too serious.|Where can I get some Monkey wine?|I'm itching for a drink.","อยู่แต่บนเขามันน่าเบื่อ จะดีกว่าถ้าลงไปเที่ยวข้างล่าง|ในความเมามาย, ยุทธภพช่างกว้างใหญ่ วันคืนช่างยาวนานในไหสุรา|ศิษย์พี่มีพรสวรรค์แต่เขาจริงจังเกินไป|ข้าจะหาสุราวานรได้ที่ไหน?|ข้ากำลังอยากดื่ม"
NpcMumble_邋遢张霖安城弱对白,"Boring, boring.|Chang Chunzi is even more boring than his master!|That brat is somewhat interesting.",น่าเบื่อ น่าเบื่อ|ฉางชุนจือน่าเบื่อกว่าอาจารย์ของเขาอีก!|ไอ้สารเลวนั่นก็น่าสนใจไม่น้อย
NpcMumble_邋遢张浮屠寺弱对白,"I'd like to see what else you guys can do!|The Nine Factions Sect can only make small moves.|Show me all your tricks!|I'm living a adventurous and happy life~|Luckily, this wine wasn't discovered.",ข้าอยากรู้ว่าพวกเจ้าจะทำอะไรได้อีก!||นิกายเก้าฝ่ายทำได้เพียงเคลื่อนไหวเล็กน้อยเท่านั้น|แสดงลูกเล่นของแกออกมา!|ข้าใช้ชีวิตอย่างอิสระและมีความสุขได้~|ช่างโชคดี ที่สุรานี้ยังไม่ถูกพบเจอ
NpcMumble_邋遢张浮屠寺癞头癫弱对白,"Little leper, it's been a long time since we've seen each other.|Unexpectedly, we meet again here.|Where have you been to enjoy good food recently?|Did that fat monk allow you to leave the temple?|Once we run away from here, we must have a good drink!|Where did you hide this roast chicken to bring it in?",เจ้าขี้เรื้อนตัวน้อย นานมากแล้วสินะที่เราไม่ได้พบกัน|ไม่คาดคิดว่าเราจะได้พบกันอีก|ล่าสุดเจ้าไปกินอาหารอร่อยที่ไหนมา?|พระอ้วนยอมให้เจ้าออกจากวัดเหรอ?|ถ้าเราหนีออกจากที่นี่ไปได้ เราต้องไปก๊งสุราดี ๆ กันซักหน่อย!|เจ้าแอบเอาไก่ย่างนี่เข้ามาได้อย่างไร?
