sto-CW-3-1_1_6,"I want to reward you, heavily reward you!"
sto-CW-3-1_1_7,"Someone, carefully select from my secret treasury as a reward for {PlayerSurName} Sect Leader!"
sto-CW-3-1_1_8,It's our duty to share your Highness's worries.
sto-CW-3-1_2_1,I was actually beaten to it...
sto-CW-4_1_1,"Sect Leader, Prince Chai is visiting!"
sto-CW-4_1_2,{PlayerSurName} I pay my respects to Prince Chai.
sto-CW-4_1_3,"{PlayerSurName} Sect Leader is my right-hand man, no need to waste time on these formalities in the future."
sto-CW-4_1_4,"I heard that {MyFaction} has been developing rapidly recently, and there is a faint sign of dominating the martial arts world!"
sto-CW-4_1_5,"I was deeply favored by the former emperor and dare not put the national interest first. Now there is an important matter that often makes me very anxious. After thinking about it, I'm afraid only {PlayerSurName} Sect Leader can relieve my worries."
sto-CW-4_1_6,What is the matter that worries your Highness?
sto-CW-4_1_7,"The southwest corner has always been part of my China. But in the past hundred years, this place has been controlled by the Jiuli barbarians and women."
sto-CW-4_1_8,"I hope you can gather the power of {MyFaction} to conquer the southwest, control Melody House and Jiuli Tribe within <color=#a94e37>one year</color>, and promote the national prestige of my Zhao country!"
sto-CW-4_2_1,"Your Highness can rest assured, these two areas have been controlled by our sect."
sto-CW-4_2_2,"{PlayerSurName} Sect Leader, you are so well-prepared, it really makes me overjoyed!"
sto-CW-4_2_3,"This is the reward I prepared in advance, I hope {MyFaction} can unify the entire martial arts world under your leadership!"
sto-CW-4_2_4,"Thank you for your kindness, your highness!"
sto-CW-4_log,Continue to develop the sect.
sto-CW-4_3_1,"Prince Chai seems to want to use our sect to help him expand his influence, should I agree..."
sto-CW-4_op_1_1,Just take advantage of Prince Chai's prestige to march into the southwest!
sto-CW-4_op_1_2,"I can't keep being used by King Chai, I refuse!"
sto-CW-4_4_1,"{MyFaction} is willing to march to the southwest immediately, to relieve your Highness as soon as possible!"
sto-CW-4_4_2,"The head of {PlayerSurName} is really spirited, let this king toast to your departure!"
sto-CW-4_log1,"Conquer ""Jiuli Tribe"" and ""Melody House"" within one year (occupy ""Jiuli"" and ""Bulao Spring"")."
sto-CW-4_5_1,"{MyFaction} has been busy with sect affairs recently and can't spare the time to go, I hope your Highness will forgive me."
sto-CW-4_5_2,"This king will not force this matter, I hope the head of {PlayerSurName} has enough confidence to make the right choice for {MyFaction}."
sto-CW-4_log2,Continue to develop the sect.
sto-CW-4-1_1_1,"I thought the martial arts in the southwest were strong, but I didn't expect them to be so weak."
sto-CW-4-1_1_2,King Chai has ordered me to come and congratulate the head of {PlayerSurName} for his achievements in the southwestern martial arts world!
sto-CW-4-1_1_3,"This is a gift that His Highness asked me to bring to you this time, please accept it with a smile~"
sto-CW-4-1_2_1,"Sect Leader, Chai Wangye sent someone to deliver a verbal message, condemning our sect for breaking promises lightly."
sto-CW-4-1_2_2,"Indeed, I, the Sect Leader, forgot. I must pay more attention in the future."
sto-CW-4-1_log,Continue to develop the sect.
sto-CW-5_1_1,"The martial arts of the Central Plains have been in chaos for a long time, it's time for us from the East to show our skills!"
sto-CW-5_1_2,"I, Yagyū Musashi, the successor of the Eastern martial arts family and the lord of the Great Ant City, am here!"
sto-CW-5_1_3,"Master, something terrible has happened! The Great Ant City has suddenly become aggressive, occupying the surroundings of Lin'an, and it seems they are about to expand towards the Central Plains!"
sto-CW-5_1_4,"The situation is so critical, does King Chai have any orders to send?"
sto-CW-5_1_5,"King Chai ordered our sect not to act rashly, and to attack the Great Ant City when the time is right."
sto-CW-5_1_6,"Hmph, these ambitious foreigners from Great Ant City are so contemptuous of the Central Plains Martial Arts, they are simply seeking their own death."
sto-CW-5_1_7,Send out the order to closely monitor the movements of Great Ant City and report to me at the first moment.
sto-CW-5_1_8,"Yes, sir!"
sto-CW-5_log,Prepare for the invasion of Great Ant City
sto-CW-6_1_1,"Master, there is a man dressed as a Japanese ronin standing outside the door with a murderous aura, specifically challenging you."
sto-CW-6_1_2,"I heard that there is a madman from Great Ant City who keeps challenging various sects, trying to crush the morale of the Central Plains martial arts. Is this the guy?"
sto-CW-6_1_3,"Since he dares to come to our sect, he should be prepared to shake the tree like a dragonfly!"
sto-CW-6_name,Great Ant City Ronin
sto-CW-6_log,Dispatch Disciple to duel with the challenging Great Ant City Ronin
sto-CW-6_2_1,Where is the challenger?
sto-CW-6_2_2,{MyFaction} Are you sending such a thing to die?
sto-CW-6_2_3,"You are the one who came to the door, yet you dare to be so arrogant and ignorant, talking big."
sto-CW-6_2_4,"Remember, I am Hattori Hyoe, the deputy city lord of Great Ant City, here to send you on your way."
sto-CW-6_2_5,"Central Plains Martial Arts is nothing more than a juggling act to please the crowd, let us Japanese warriors break your proud backbone!"
sto-CW-6_3_1,"Hmph, your Great Ant City Martial Arts is no different from children's play. Since you offend my sect, leave your life here."
sto-CW-6_3_2,Impossible... You must have used sorcery!
sto-CW-6_3_3,"Anyone better than you is sorcery, you are really a frog at the bottom of the well. No more words, die."
sto-CW-6_3_4,"I can't fall here, I will come back to teach you another day... Wind Escape!"
sto-CW-6_3_5,"Cough cough cough... This kid threw a strange pellet that constantly releases smoke and took the opportunity to escape, it's really shameless."
sto-CW-6_3_6,"But I gave him a good beating, which is a good name for the Central Plains Martial Arts."
sto-CW-6_4_1,"This kid's knife technique is very strange, it's really tricky at first sight..."
sto-CW-6_4_2,"Those Vagabonds who were defeated by me blew {MyFaction} to the sky, today it seems, it's simply ridiculous."
sto-CW-6_4_3,"You embroidered pillow is not worthy to die under my knife, get out!"
sto-CW-6_5_1,"Head, that Japanese ronin saw that our sect has been closed all the time, so he spread rumors that our sect is timid. If this reaches King Chai's ears, I'm afraid it will make his Highness unhappy with us."
sto-CW-6_5_2,"Things have come to this, there is no room for recovery, let's leave it at that."
sto-CW-7_1_1,"{PlayerSurName}, King Chai has specially sent me to deliver a message."
sto-CW-7_1_2,"Great Ant City, as a foreign race, belittles the Central Plains Martial Arts and interferes with the internal affairs of China. He specially sent {MyFaction} to destroy it with all his strength, recover the lost land of Lin'an, and show the might of our country!"
sto-CW-7_1_3,"The Duke has ordered, our sect will naturally comply!"
sto-CW-7_log,Eliminate the forces of Great Ant City
sto-CW-8_1_1,"Master, that Great Ant City has too many grievances, and before our sect could take action, it was already wiped out by other sects."
sto-CW-8_1_2,"It's important to know oneself, otherwise it will end up like Great Ant City. Don't worry about it, just continue to develop our sect."
sto-CW-8_2_1,"The glory and ambition of the Liusheng family were destroyed along with the Great Ant City\nFrom Yagyū Musashi down\nAlmost all the rebels were caught in one fell swoop and locked up in the main city's death row\nOnly the princess of the Great Ant City is missing, suspected to be wandering the rivers and lakes..."
sto-CW-8_2_2,"Sixty years in a dream, a cycle of decay and prosperity in a cup of wine..."
sto-CW-8_2_3,"It's important to know oneself, or else you'll end up like Great Ant City!"
sto-CW-8_2_4,"The once arrogant Great Ant City fell at the hands of {MyFaction}, bringing our sect's ideal of Dominating the Martial World one step closer!"
sto-CW-8_log,"Continue to develop the sect, expand the territory"
sto-CW-9_1_1,"The Central Plains have always been divided, and now they are even more consumed by internal strife, leaving only a tenth of their national strength. Truly, heaven blesses the Great Yan Kingdom!"
sto-CW-9_1_2,"Yan Yun Iron Army, heed my command, we march south today!"
sto-CW-9_1_3,"Master, the Yan Yun Iron Army that has been entrenched in the Yan Yun Region has taken advantage of the internal strife in Zhao country and has completely revealed its fangs, mobilizing a large army to instantly capture Daliang City. Chu Xiang and Lin An are now without a barrier, they are in great danger."
sto-CW-9_1_4,"The Yan Yun Iron Army has been operating in the Yan Yun camp for many years, and now they are heading south with full force, they must have made thorough preparations..."
sto-CW-9_1_5,"King Chai has another message, his Highness thinks that the situation in Zhao is extremely urgent, and orders our sect to try our best to firmly control Daliang, Lin'an, and Chuxiang, and defend for at least <color=#a94e37>three months</color> to prevent accidents."
sto-CW-9_1_6,"Let's do as King Chai said, the Yan army is powerful, and there will inevitably be people who surrender wherever they go. Besides our sect, he has no one else to trust."
sto-CW-9_log,"Help King Chai, control Daliang, Lin'an, and Chuxiang, and defend for three months"
sto-CW-10_1_1,"Leader, the commander of the Yan Yun Iron Army, Wanyan Wuzhu, has sent a secret letter..."
sto-CW-10_1_2,"Very well, it seems that our defense of the three main cities has seriously hindered the Yan army's invasion plan. Let me see what this guy has to say!"
sto-CW-10_1_3,"You open the secret letter and read it carefully\nThe letter is half threat, half temptation\nBut there is a hint of negotiation hidden between the lines\nAfter reading the whole letter, you can't help but laugh out loud\nWanyan Wuzhu's intentions are clear..."
sto-CW-10_1_4,Where is the messenger?
sto-CW-10_1_5,The Yan soldier disguised as a Zhao person has been captured by our disciples.
sto-CW-10_1_6,"Let him go, and tell him to pass on a message. If Wanyan Wuzhu is willing to come to our sect and apologize in person, I, being generous, will let him off the hook."
sto-CW-10_1_7,"Yes, I'll go and do it right away."
sto-CW-10_1_8,"Exactly as you imagined\nWanyan Wuzhu was furious when he received your oral message\nHe ordered all Yan troops to prioritize attacking your forces\nThe trap you set is already half successful\nThe safety of the world seems to be in your hands..."
sto-CW-10_log,"Advance into Yan Yun Region, completely eliminate Yan Yun Iron Army"
sto-CW-10_2_1,"Damn it, the three main cities have fallen one after another, both our sect and Zhao have lost their last resistance skill..."
sto-CW-10_2_2,"The ancient saying ""unable to turn the tide"" probably refers to this situation..."
sto-CW-11_1_1,"This was Wanyan Wuzhu's best chance to destroy Zhao\nBut you, a rising star, thwarted it\nThe grand camp that stood in Yan Yun for decades\nHas returned to Zhao's embrace today..."
sto-CW-11_1_2,"In my next life, I will never lose again..."
sto-CW-11_1_3,So tired... Have all the leaders of the major sects left?
sto-CW-11_1_4,"Reporting to the leader, they have all left."
sto-CW-11_1_5,"These leaders take turns flattering, it's so annoying. ""Hero of the nation"", ""model of the martial arts world"", they're just afraid of our sect attacking them, that's why they keep talking non-stop..."
sto-CW-11_1_6,It seems that the head of {PlayerSurName} has a lot of happy troubles.
sto-CW-11_1_7,King Chai! How come you're here?
sto-CW-11_1_8,What? Can't this king come to congratulate my trusted general who has made a great contribution to destroying the Yan Empire and restoring Zhao?
sto-CW-11_1_9,"Your Highness is joking, of course I didn't mean that."
sto-CW-11_1_10,"{PlayerName}, you did a great job, if this king ever ascends to the throne, I will never forget your contribution."
sto-CW-11_1_11,"But I'm afraid by then, this king might be worried, what if you become my enemy, what should I do."
sto-CW-11_1_12,"If you disband your sect and retire from the martial arts world, maybe this king won't have to worry so much haha!"
sto-CW-11_1_13,Your Highness...
sto-CW-11_1_14,"I was just joking, head of {PlayerSurName}, don't be so serious."
sto-CW-11_log,"Continue to develop the sect, Dominating the Martial World"
sto-CW-12_1_1,"The entire martial world, now half of it is in the hands of our sect..."
sto-CW-12_1_2,I remember when I first started in that Nameless village...
sto-CW-12_1_3,"At that time, there were neither resources nor talents, and we had to suffer from the exploitation and insult of the Blue Wind Camp..."
sto-CW-12_1_4,"After dozens of battles, practicing martial arts with careful steps, we have achieved today's fame, which is really sighing..."
sto-CW-12_1_5,Leader! Leader!
sto-CW-12_1_6,"Chattering, just interrupted my memories, sigh..."
sto-CW-12_1_7,"Speak, what's the rush?"
sto-CW-12_1_8,Prince Chai has sent an envoy to requisition a large amount of supplies from our sect.
sto-CW-12_1_9,"Prince Chai, The Richest in the World, why would he want to requisition from our sect, it's really strange!"
sto-CW-12_1_10,"The disciple doesn't know, but from the envoy's side words, it seems that the prince doesn't really care about these supplies..."
sto-CW-12_1_11,"Since he doesn't care, and he's in such a hurry, could it be... a test for our sect? Should we provide the supplies or not?"
sto-CW-12_op_1_1,"Hand over the supplies, our sect doesn't lack them anyway (Hand over 2000 of all resources)"
sto-CW-12_op_1_2,"Refuse to provide, we can't always cater to Prince Chai"
sto-CW-12_2_1,Have all the prepared supplies been given out?
sto-CW-12_2_2,"Reporting to the leader, they have all been successfully handed over to Prince Chai's envoy."
sto-CW-12_3_1,"There's no reason for our sect to continue providing supplies to Prince Chai, let them solve it themselves."
sto-CW-12_3_2,"Reporting to the leader, Prince Chai's envoy seems very dissatisfied with our sect's behavior..."
sto-CW-12_4_1,"Leader, Prince Chai has sent an envoy again to requisition a large amount of supplies from our sect."
sto-CW-12_4_2,"This Prince Chai is really endless, should we provide the supplies this time..."
sto-CW-12_5_1,Have all the prepared supplies been given out?
sto-CW-12_5_2,"Reporting to the leader, they have all been successfully handed over to Prince Chai's envoy."
sto-CW-12_6_1,"There's no reason for our sect to continue providing supplies to Prince Chai, let them solve it themselves."
sto-CW-12_6_2,"Reporting to the leader, Prince Chai's envoy seems very dissatisfied with our sect's behavior..."
sto-CW-12_7_1,"Strange, Prince Chai sends people to our sect to requisition supplies every month, why has it suddenly stopped this month?"
sto-CW-12_7_2,"Leader, something bad has happened... Some unknown sect suddenly spread rumors in the martial world, slandering our sect, saying that we have been colluding with foreign countries and acting as accomplices!"
sto-CW-12_7_3,"Nonsense! If our sect was colluding with foreign countries, then who destroyed the Great Ant City and Yan Yun Iron Army?"
sto-CW-12_7_4,"Now in the martial world, rumors have become truth, they think our sect's previous achievements were just a play with the Yan army, just for the huge conspiracy of inviting the wolf into the house in the future..."
sto-CW-12_7_5,"Now all the major sects are distancing themselves from our sect, and some original allies have suddenly broken the alliance."
sto-CW-12_7_6,"What a bunch of short-sighted fools... Well, it's okay, it's convenient for me, the leader, to defeat them one by one and take the opportunity to dominate the martial world!"
sto-CW-12_8_1,"Strange, Prince Chai sends people to our sect to requisition supplies every month, why has it suddenly stopped this month?"
sto-CW-12_8_2,"Leader, something bad has happened... Some unknown sect suddenly spread rumors in the martial world, slandering our sect, saying that we have been colluding with foreign countries and acting as accomplices..."
sto-CW-12_8_3,"Nonsense! If our sect was colluding with foreign countries, then who destroyed the Great Ant City and Yan Yun Iron Army?"
sto-CW-12_8_4,"Alas, now in the martial world, rumors have become truth, they think our sect's previous achievements were just a play with the Yan army, just for the huge conspiracy of inviting the wolf into the house in the future..."
sto-CW-12_8_5,"Now all the major sects are distancing themselves from our sect, and some original allies have suddenly broken the alliance."
sto-CW-12_8_6,"What a bunch of short-sighted fools... Well, it's okay, it's convenient for me, the leader, to defeat them one by one and take the opportunity to dominate the martial world!"
sto-CW-13-1_1_1,"The king is a descendant of the former imperial family, and was granted the title of King Chai by the former emperor, and made a vow to support the Zhao country!"
sto-CW-13-1_1_2,"I wanted to live a peaceful life, but I didn't expect that {PlayerName} would collude with the Yan army for his own selfish desires, invite the wolf into the house and cause chaos in the martial world! Although I have old grudges with this demon, I have to act for the heavens!"
sto-CW-13-1_1_3,"This king hereby issues this Coin to announce to the world that there are many loyal and brave men among the various martial arts sects. I hope you will remain true to your heart, prioritize the complete elimination of {MyFaction}, clip its wings, and then join forces to eliminate the demon, slay the monster!"
sto-CW-13-1_1_4,"Leader, Duke Chai's Tower is suddenly issuing Coins everywhere, slandering you as a demon, and even saying they want to Act for the heavens!"
sto-CW-13-1_1_5,"At this point, don't you know the nature of King Chai? He both loves and envies talent, on one hand, he hopes all talents can be used by him, on the other hand, he is anxious about being betrayed by these talents, so he strikes first."
sto-CW-13-1_1_6,"It's a pity that we couldn't see through this person's true face earlier... No, actually, I had a premonition in my heart, but I was deceiving myself and chose to believe him..."
sto-CW-13-1_1_7,Leader...
sto-CW-13-1_1_8,"Enough of the sorrow, go and call all the Disciples over. If King Chai can be ruthless, I, as the leader, can certainly return the favor!"
sto-CW-13-1_log,Break Duke Chai's Tower
sto-CW-13-2_1_1,"The king is a descendant of the former imperial family, and was granted the title of King Chai by the former emperor, and made a vow to support the Zhao country!"
sto-CW-13-2_1_2,"I wanted to live a peaceful life, but I didn't expect that {PlayerName} would collude with the Yan army for his own selfish desires, invite the wolf into the house and cause chaos in the martial world! Although I have old grudges with this demon, I have to act for the heavens!"
sto-CW-13-2_1_3,"This king hereby issues this Coin to announce to the world that there are many loyal and brave men among the various martial arts sects. I hope you will remain true to your heart, prioritize the complete elimination of {MyFaction}, clip its wings, and then join forces to eliminate the demon, slay the monster!"
sto-CW-13-2_1_4,"Leader, Duke Chai's Tower is suddenly issuing Coins everywhere, slandering you as a demon, and even saying they want to Act for the heavens!"
sto-CW-13-2_1_5,"At this point, don't you know the nature of King Chai? He both loves and envies talent, on one hand, he hopes all talents can be used by him, on the other hand, he is anxious about being betrayed by these talents, so he strikes first."
sto-CW-13-2_1_6,"It's a pity that we couldn't see through this person's true face earlier... No, actually, I had a premonition in my heart, but I was deceiving myself and chose to believe him..."
sto-CW-13-2_1_7,Leader...
sto-CW-13-2_1_8,"Enough of the sorrow, go and call all the Disciples over. If King Chai can be ruthless, I, as the leader, can certainly return the favor!"
sto-CW-13-2_log,Break Duke Chai's Tower
sto-CW-14_1_1,"King Chai's Machinery has calculated everything, and has won all the world's hearts\nHe thought he had the mandate of heaven and the righteousness\nBut he didn't expect that there are people in this world who can go against the sky and break the meeting with force..."
sto-CW-14_1_2,"{PlayerName}, you are the only person I admire in my life, and also the only person I feel guilty about..."
sto-CW-14_1_3,Guilty? I really can't think of these two words coming out of your mouth.
sto-CW-14_1_4,"The reason why I am your enemy is because I was bewitched by the villains around me. Now I think about it, it's too late to regret..."
sto-CW-14_1_5,"I am willing to give you another chance, a chance for us to get along well, no... a chance to share the world with you! {PlayerSurName} Leader, please consider it carefully, besides me, who else in this world can end the chaos and restore the great Zhao!"
sto-CW-14_1_6,"Thank you, Your Highness, for giving {PlayerSurName} this opportunity, but unfortunately, {PlayerSurName} I am not willing to give Your Highness any chance."
sto-CW-14_1_7,"You evil person, even a thousand deaths are not enough for your crimes, come and fight!"
sto-CW-14_1_8,"Damn... Let you be arrogant for a while, the king will make you have no place to bury in the future!"
sto-CW-14_1_9,"You didn't expect that there was a secret under King Chai's throne\nWith the combination of thick smoke, tunnels, and machinery\nKing Chai and his followers disappeared in an instant..."
sto-CW-14_1_10,"King Chai is just unwilling to accept his fate, a cornered beast will still fight, he can't make any waves."
sto-CW-14_1_11,"Cut off those martial arts sects that are helping the tiger, clean up this world first, and then have a good time with that stray dog, King Chai."
sto-CW-14_log,"Eliminate the remaining martial arts sects, completely Dominating the Martial World."
sto-CW-15_1_1,Years of hard conquest have finally come to an end today.
sto-CW-15_1_2,"Now that the martial world is unified and there are no more private fights, it seems that my little dream when I crossed over has been realized."
sto-CW-15_2_1,"{PlayerGivenName}, don't get too excited yet, a big disaster might be coming at any moment..."
sto-CW-15_2_2,"Qingqing, why are you so nervous? Tell me, what's wrong?"
sto-CW-15_2_3,"That King Chai is still at large, always a huge hidden danger. I was worried that he might harm you one day, so I secretly sent people to investigate."
sto-CW-15_2_4,"My people just sent back a piece of intelligence, saying that although King Chai was defeated by our sect, he is still dissatisfied and is recruiting soldiers and buying horses to bribe the Desperate. He is going to assassinate you in about <color=#a94e37>three months</color>!"
sto-CW-15_2_5,"Hey, I knew it. It's just a desperate loser. Let him come, the head of the sect is always welcome to visit!"
sto-CW-15_3_1,"{PlayerGivenName}, there's an urgent matter, you must listen carefully!"
sto-CW-15_3_2,"What's wrong, Qianxue? You're so serious, it's making you look ugly."
sto-CW-15_3_3,"You're so annoying, you don't know when to joke!"
sto-CW-15_3_4,"I've always been worried about that Chai Wang who threatened you. Just now, a spy reported that this bastard is recruiting soldiers and buying horses to bribe the desperate. He is planning to assassinate you in about <color=#a94e37>three months</color>!"
sto-CW-15_3_5,"Hey, I knew it. It's just a desperate loser. Let him come, the head of the sect is always welcome to visit!"
sto-CW-16_1_1,"Leader, according to your instructions, the disciples have set up a No Escape trap inside and outside the sect. Now we have indeed found traces of King Chai and others' ambush."
sto-CW-16_1_2,"King Chai, King Chai, you think you're the hunter and I'm the prey. Today, let me, the head of the sect, teach you what real revenge is!"
sto-CW-16_name,King Chai's Revenge
sto-CW-16_log,"King Chai's assassination of you is imminent, and you, a brave and talented person, are prepared to strike first!"
sto-CW-16_2_1,{PlayerName}... I hate you to the bone!
sto-CW-16_2_2,It's you... who made me fall from the sky to the eighteen layers of hell!
sto-CW-16_2_3,It's you... who made me lose everything and be laughed at by the world!
sto-CW-16_2_4,"Fortunately, heaven has eyes... and gave me a chance to take revenge on you!"
sto-CW-16_2_5,"I swear, I will make you die without a burial place!"
sto-CW-16_2_6,(Yawning) Who do you want to be left unburied?
sto-CW-16_2_7,"{PlayerName} Just in time! Come to hell with me, hahaha!"
sto-CW-16_3_1,Damn it...
sto-CW-16_3_2,"What, still clinging to this world, clinging to life and not willing to die?"
sto-CW-16_3_3,Hahaha...
sto-CW-16_3_4,Hahahaha!
sto-CW-16_3_5,Hahahaha!
sto-CW-16_3_6,"Why does King Chai laugh like a madman, as if he's lost his mind? No... his MP is rising rapidly, as if he's become a different person!"
sto-CW-16_3_7,"After being defeated by you last time, I silently swore that even if I lost everything, I would take revenge on you!"
sto-CW-16_3_8,"On the shore of the Bohai Sea, I met a strange man. He was moved by my deep obsession and taught me a unique demonic skill that burns my essence and blood for revenge."
sto-CW-16_3_9,"After paying an inhuman price, this king has finally mastered this technique. Once this technique is activated, it will continuously consume vitality, until the soul is burned to ashes. But it's worth it to deal with you!"
sto-CW-16_3_10,"I thought you were just an unscrupulous ambitious person, but it turns out you're a complete madman."
