School-2150-3_1_3_3,"By then, everyone will know the true faces of these people from the three sects, and the three sects will fall into chaos without being attacked.",เมื่อถึงเวลานั้น คนทั้งยุทธภพย่อมเห็นธาตุแท้ของพวกมัน สามสำนักใหญ่จะตกอยู่ในความวุ่นวายโดยไม่ต้องลงมือด้วยซ้ำ
School-2150-3_1_3_4,"Just some rumors, will they really be thrown into confusion?",แค่ข่าวลือเล็กน้อย พวกมันจะถึงขั้นแตกแยกกันเองเลยหรือ?
School-2150-3_1_3_5,"If it were elsewhere, maybe not, but if it's in Chuxiang City, it definitely will! There is a Dirty Street in Chuxiang City, where the news is the most well-informed in the world besides the Rumor Platform, and they have connections with both the underworld and the officialdom, as long as we cooperate with them... ",ถ้าเป็นที่อื่นก็คงไม่ แต่หากเป็นที่ เมืองฉู่เซียง มันต้องได้ผลแน่นอน! ในเมืองมี ตรอกเล้าหมู ที่ขึ้นชื่อเรื่องข่าวสาร แม้แต่ สถานีข่าวเวหา ก็ยังยอมรับว่าพวกมันรวดเร็วที่สุด แถมยังมีอิทธิพลทั้งฝ่ายธรรมะและอธรรม ถ้าหากเราร่วมมือกับพวกมัน...
School-2150-3_1_4_1,Dirty Street? But Jiang Nanguai is already dead... ,ตรอกเล้าหมู? แต่ เจียงหนานไกว่ ตายไปแล้วไม่ใช่หรือ?
School-2150-3_1_4_2,What? When did this happen?!,อะไรนะ?! ตายตั้งแต่เมื่อไหร่!?
School-2150-3_1_4_3,I was careless before... I didn't expect him to be so important... ,ข้าไม่ทันระวังตัว... ข้าเองก็ไม่คิดว่าเขาจะมีความสำคัญเช่นนี้...
School-2150-3_1_4_4,How many people know about this?,มีใครรู้เรื่องนี้บ้าง?
School-2150-3_1_4_5,There should... not be many.,น่าจะ... ไม่มากหรอก
School-2150-3_1_4_6,"Then you just use Jiang Nanguai's name, be careful in the future, don't kill these useful people at will.",ถ้าเช่นนั้น เจ้าก็แค่แอบอ้างชื่อของ เจียงหนานไกว่ ไปก่อน ต่อไประวังให้มากขึ้น อย่าฆ่าคนที่เป็นประโยชน์ต่อเราโดยไม่จำเป็นอีก!
School-2150-3_1_4_7,Yes.,รับทราบ
School-2150-3_1_5_1,"Hehe, I didn't expect the idea you came up with to be so interesting, I must join in the fun!",หึๆๆ ข้าไม่นึกเลยว่าเจ้าหัวเหล็กจะคิดแผนได้สนุกขนาดนี้! ข้า 'เฒ่าประหลาด' คงต้องร่วมวงสักหน่อยแล้ว!
School-2150-3_1_6_1,"(I didn't expect Jiang Nanguai and his Dirty Street to be so powerful, I thought it was just a place where ruffians gathered...)",(ไม่นึกเลยว่า เจียงหนานไกว่ กับตรอกเล้าหมูจะมีอิทธิพลขนาดนี้ ข้านึกว่ามันเป็นแค่ที่กบดานของพวกนักเลงเท่านั้น...)
School-2150-3_1_7_1,"I understand the situation, I will set off for Chuxiang City now.",เข้าใจสถานการณ์แล้ว ข้าจะออกเดินทางไปยังเมืองฉู่เซียงเดี๋ยวนี้
School-2150-3_1_8_1,"{PlayerName}, I'll wait for you at the door, if you're ready, come with me.",{PlayerName} ข้ารอเจ้าอยู่ที่หน้าประตู หากเตรียมตัวพร้อมแล้ว ออกเดินทางไปพร้อมกัน
School-2150-3_1_9_1,"{PlayerName}, are you ready?",{PlayerName} เจ้าเตรียมตัวเรียบร้อยหรือยัง?
School-2150-3_option1_1,"I'm ready! <color=#097a76>(12 shichen, heading to Chuxiang City)</color>",พร้อมแล้ว! <color=#097a76>（12 ชั่วยาม เดินทางไปเมืองฉู่เซียง）</color>
School-2150-3_option1_2,Prepare again.,ขอเตรียมตัวอีกหน่อย
School-2150-3_1_10_1,"Alright, let's go.",ดี! งั้นไปกันเถอะ!
School-2150-3_2_1_1,"{PlayerName}, I'll go to Dirty Street first, you can wander around if you want, but meet up at Dirty Street as soon as possible.",{PlayerName} ข้าจะไปตรอกเล้าหมูก่อน หากเจ้าจะเดินเล่นก็เชิญ แต่รีบไปพบข้าที่นั่นด้วย
School-2150-3_2_2_1,"{PlayerName}, didn't I tell you to get ready and come with me? Why did you run here first?",{PlayerName} ข้าไม่ได้บอกให้เจ้ารอไปพร้อมกันหรือ? แล้วทำไมเจ้าถึงมาก่อนเอง?
School-2150-3_2_2_2,"Sigh, forget it, I'll go to Dirty Street first, you... you figure it out yourself.",เฮ้อ ช่างเถอะ ข้าจะไปตรอกเล้าหมูก่อน ส่วนเจ้าจะทำอย่างไรก็แล้วแต่เจ้า
School-2150-3_2_3_1,"Little brat, see you later at Dirty Street.",เจ้าตัวแสบ เราไปพบกันที่ตรอกเล้าหมูในภายหลัง!
School-2150-3_2_4_1,"Little brat, you finally came. That stinky bull-nose has been talking about today's plan until my ears are calloused.",เจ้าหนู ในที่สุดก็มาสักที! เจ้าเฒ่าจมูกวัวพล่ามเรื่องแผนวันนี้ซะจนข้าหูชาไปหมดแล้ว!
School-2150-3_2_5_1,"Are you the Boss of Dirty Street, Jiang Nanguai?",เจ้าคือ เจียงหนานไกว่ หัวหน้าตรอกเล้าหมูหรือ?
School-2150-3_2_5_2,"Who else could I be if not me? Are you the little brat that stinky bull-nose mentioned?\nHmph, you're still wet behind the ears, can you handle it?","ไม่ใช่ข้าแล้วจะเป็นใคร? แล้วเจ้าก็คือเด็กเวรที่เจ้าเฒ่าจมูกวัวพูดถึงสินะ?\nฮึ เด็กขนยังไม่ทันขึ้นดี เจ้าว่าตัวเองไหวหรือ?"
School-2150-3_2_5_3,"Whether I can handle it or not isn't something you can determine by talking, you'll know when you see it with your own eyes.",ว่าข้าทำได้หรือไม่นั้น ไม่ใช่แค่พูดแล้วจะรู้ รอดูด้วยตาของเจ้าเองก็แล้วกัน!
School-2150-3_2_5_4,"Hahaha, a little brat with personality, not bad, not bad, I like it.",ฮ่าๆๆ เจ้าเด็กเปรต นิสัยใช้ได้ ข้าชอบ!
School-2150-3_2_6_1,"Sigh, you really know how to boss people around... \nThe Cold medicinal pills you gave me have all been distributed... ","เฮ้อ เจ้านี่ใช้คนเก่งจริงๆ...\nยาสลายความชื้นที่เจ้าฝากข้าแจกจ่าย ข้าส่งไปหมดแล้ว..."
School-2150-3_2_6_2,What Cold medicinal pills?,ยาสลายความชื้นคืออะไรนะ?
School-2150-3_2_6_3,"The condition for this old freak to cooperate was for me to help him distribute these mud pills he scraped off his body in the city, and he even called them ""Cold medicinal pills"", it would be more appropriate to call them death pills... ",เงื่อนไขที่เจ้าเฒ่าประหลาดนั่นยอมร่วมมือ คือให้ข้าช่วยแจกไอ้เม็ดยาที่มันขูดจากคราบไคลตามตัวของมันไปทั่วเมือง แล้วตั้งชื่อซะหรูว่า ‘ยาสลายความชื้น’ ข้าว่าควรเปลี่ยนเป็น ‘ยาส่งไปเฝ้ายมบาล’ มากกว่า...
School-2150-3_2_6_4,"Hmph, if stinky bull-nose wants my help, he naturally has to help me too!",หึ เจ้าเฒ่าจมูกวัวมาขอให้เฒ่าประหลาดช่วย ก็ควรต้องช่วยเฒ่าประหลาดบ้างเหมือนกัน!
School-2150-3_2_6_5,"Yes, yes... Now that everyone is here, we should start soon.",ใช่ๆ... ว่าแต่ ตอนนี้ทุกคนมากันครบแล้ว เราคงต้องเริ่มได้แล้วสินะ
School-2150-3_2_6_6,"Hey, while stinky bull-nose was away, I've already sent people to spread the word, now we're just waiting for those fools to take the bait.",เฮ้ เจ้าเฒ่าจมูกวัวไม่อยู่ ข้าก็ให้คนแพร่ข่าวลือไปเรียบร้อยแล้ว ทีนี้ก็แค่รอดูว่าไอ้พวกโง่นั่นจะหลงกลเมื่อไหร่
School-2150-3_2_6_7,"Good, as expected of the Street master, very thoughtful.",ยอดเยี่ยม สมแล้วที่เป็นเจ้าตรอกเล้าหมู วางแผนรอบคอบจริงๆ
School-2150-3_2_6_8,"{PlayerName}, you go and confirm the effect of these rumors afterwards.",{PlayerName} เจ้าจงไปตรวจสอบดูว่าแผนการแพร่ข่าวลือนั้นได้ผลหรือไม่
School-2150-3_2_6_9,What do I need to do?,ข้าต้องทำอะไรบ้าง?
School-2150-3_2_6_10,"You go to a place where there are many passersby during the day and see the effect. If the effect is not enough, you can add fuel to the fire, and see how the disciples of the three religions react.",ตอนกลางวัน เจ้าจงไปยังที่ที่มีผู้คนพลุกพล่านแล้วสังเกตผลลัพธ์ หากยังไม่แรงพอก็เติมเชื้อไฟเข้าไปอีก ดูว่าพวกศิษย์สามสำนักใหญ่จะมีปฏิกิริยาอย่างไร
School-2150-3_2_6_11,Understood!,รับทราบ!
School-2150-3_2_6_12,"I have other things to do, I'll leave everything in the city to you. Let's meet here again after you've completed your task.",ข้ามีเรื่องอื่นต้องทำ ที่เหลือในเมืองฝากเจ้าแล้ว เสร็จภารกิจเมื่อไหร่ กลับมาพบกันที่นี่
School-2150-3_2_7_1,"Little brat, let's quickly discuss the plan, I can't wait any longer!",เจ้าตัวแสบ! มาเร็ว มาคุยเรื่องแผนกันเถอะ! ข้ารอไม่ไหวแล้ว!
School-2150-3_2_7_2,Why are you more excited than me... ,เฒ่าประหลาด ท่านดูตื่นเต้นยิ่งกว่าข้าอีกนะ...
School-2150-3_2_7_3,Who doesn't want to see those high and mighty people fall into the mud? Let's hurry up!,ใครกันจะไม่อยากเห็นพวกชนชั้นสูงที่วันๆ ทำตัวดี ดูถูกคนอื่น ต้องมาเผชิญหน้ากับความอับอาย? ไม่ต้องพูดมาก ลงมือกันเถอะ!
School-2150-3_2_7_4,"Okay, first let's make up some rumors... ",เอาล่ะ ก่อนอื่น เราต้องแต่งข่าวลือกันก่อน...
School-2150-3_2_7_5,"Make up rumors? Easy, the monks of Shifa Temple peeping at the wives of Confucius Temple scholars bathing, or the wives of scholars peeping at the monks bathing. Writing this kind of stuff is as easy for me as peeing anywhere!",แต่งข่าวลือ? เรื่องง่าย! พระจากอารามซื่อฟาแอบดูเมียของบัณฑิตจากวัดขงจื้อ หรือจะเป็นเมียของบัณฑิตจากวัดขงจื้อแอบดูพระอาบน้ำดี? ข้าแต่งเรื่องแบบนี้ง่ายยิ่งกว่าถ่ายหนักข้างทางเสียอีก!
School-2150-3_2_7_6,"Your rumors are all vulgar, and they're all so outrageous, do people really believe them... ",ข่าวลือของเฒ่าประหลาดมีแต่เรื่องสัปดนทั้งนั้น แบบนี้จะมีใครเชื่อไหมเนี่ย...
School-2150-3_2_7_7,"People love to spread these vulgar rumors. And what's wrong with being outrageous? Anything that comes out of my mouth turns into gold! I thought of another one, the wife of the scholar peeping at the scholar and the monk bathing together!",พวกคนทั่วไปก็ชอบเรื่องพรรค์นี้กันทั้งนั้น! แถมข่าวลือจะไร้สาระแค่ไหนก็ไม่สำคัญ เพราะถ้าออกมาจากปากข้า ต่อให้เป็นขี้วัวก็กลายเป็นทองได้!
School-2150-3_2_7_8,You really don't care about your reputation... ,เฒ่าประหลาด ท่านนี่มันช่างไม่แคร์อะไรเลยจริงๆ...
School-2150-3_2_7_9,"I thought of another one, the wife of the scholar peeping at the scholar and the monk bathing together!",ข้านึกออกอีกเรื่องหนึ่ง! เมียของบัณฑิตแอบดูบัณฑิตอาบน้ำกับพระพร้อมกัน!
School-2150-3_2_7_10,It seems you really hate bathing... ,ดูท่าทางเฒ่าประหลาดจะมีปมเรื่องการอาบน้ำแฮะ...
School-2150-3_2_7_11,"Jiang Nanguai is silver-tongued, and in no time he has made up ten pages of rumors about the three religions.\nFrom stealing chickens and dogs to having affairs with other people's wives, everything is included.","เจียงหนานไกว่พูดน้ำไหลไฟดับ ไม่นานก็แต่งข่าวลือเกี่ยวกับสามสำนักใหญ่ได้ยาวถึงสิบหน้า\nตั้งแต่ขโมยไก่ขโมยหมาไปจนถึงแอบมีชู้กับเมียชาวบ้าน มีครบทุกแนว!"
School-2150-3_2_7_12,"Alright, I've already sent them to spread these words.",เรียบร้อย! ข้าสั่งให้คนของเรานำข่าวลือพวกนี้ไปแพร่กระจายแล้ว
School-2150-3_2_7_13,"Next, let's see the effect in a place where there are many passersby during the day.",ต่อไปก็รอดูผลกระทบในช่วงกลางวัน ตามที่ที่มีผู้คนพลุกพล่านกันเถอะ
School-2150-3_2_8_1,"Huh? Little brat, what are you doing here?",หืม? เจ้าตัวแสบ มาทำอะไรที่นี่?
School-2150-3_2_8_2,"Well, the thing is, my master has a plan... ",เฒ่าประหลาด เรื่องมันเป็นแบบนี้ ประมุขของข้ามีแผนการหนึ่ง...
School-2150-3_2_8_3,You tell Jiang Nanguai about Tie Mianren's plan... ,เจ้าถ่ายทอดแผนของ บุรุษหน้ากากเหล็ก ให้เจียงหนานไกว่ฟัง...
School-2150-3_2_8_4,"Hahaha, interesting, interesting, that iron shell head can actually come up with such an interesting plan! Alright, alright, the old monster will definitely help.",ฮ่าๆๆๆ สนุกดี สนุกดี! ไม่อยากเชื่อว่าไอ้หัวเหล็กนั่นจะคิดแผนที่น่าสนใจขนาดนี้! ไม่มีปัญหา เฒ่าประหลาดคนนี้ย่อมช่วยเต็มที่!
School-2150-3_2_8_5,Why are you more excited than me... ,เฒ่าประหลาด ท่านดูตื่นเต้นยิ่งกว่าข้าอีกนะ...
School-2150-3_2_8_6,Who doesn't want to see those high and mighty people fall into the mud? Let's hurry up!,ใครกันจะไม่อยากเห็นพวกชนชั้นสูงที่วันๆ ทำตัวดี ดูถูกคนอื่น ต้องมาเผชิญหน้ากับความอับอาย? ไม่ต้องพูดมาก ลงมือกันเถอะ!
School-2150-3_2_8_7,"Okay, first let's make up some rumors... ",เอาล่ะ ก่อนอื่น เราต้องแต่งข่าวลือกันก่อน...
School-2150-3_2_8_8,"Make up rumors? Easy, the monks of Shifa Temple peeping at the wives of Confucius Temple scholars bathing, or the wives of scholars peeping at the monks bathing. Writing this kind of stuff is as easy for me as peeing anywhere!",แต่งข่าวลือ? เรื่องง่าย! พระจากอารามซื่อฟาแอบดูเมียของบัณฑิตจากวัดขงจื้อ หรือจะเป็นเมียของบัณฑิตจากวัดขงจื้อแอบดูพระอาบน้ำดี? ข้าแต่งเรื่องแบบนี้ง่ายยิ่งกว่าถ่ายหนักข้างทางเสียอีก!
School-2150-3_2_8_9,"Your rumors are all vulgar, and they're all so outrageous, do people really believe them... ",ข่าวลือของเฒ่าประหลาดมีแต่เรื่องสัปดนทั้งนั้น แบบนี้จะมีใครเชื่อไหมเนี่ย...
School-2150-3_2_8_10,"People love to spread these vulgar rumors. And what's wrong with being outrageous? Anything that comes out of my mouth turns into gold! I thought of another one, the wife of the scholar peeping at the scholar and the monk bathing together!",พวกคนทั่วไปก็ชอบเรื่องพรรค์นี้กันทั้งนั้น! แถมข่าวลือจะไร้สาระแค่ไหนก็ไม่สำคัญ เพราะถ้าออกมาจากปากข้า ต่อให้เป็นขี้วัวก็กลายเป็นทองได้!
School-2150-3_2_8_11,You really don't care about your reputation... ,เฒ่าประหลาด ท่านนี่มันช่างไม่แคร์อะไรเลยจริงๆ...
School-2150-3_2_8_12,"I thought of another one, the wife of the scholar peeping at the scholar and the monk bathing together!",ข้านึกออกอีกเรื่องหนึ่ง! เมียของบัณฑิตแอบดูบัณฑิตอาบน้ำกับพระพร้อมกัน!
School-2150-3_2_8_13,It seems you really hate bathing... ,ดูท่าทางเฒ่าประหลาดจะมีปมเรื่องการอาบน้ำแฮะ...
School-2150-3_2_8_14,"Jiang Nanguai is silver-tongued, and in no time he has made up ten pages of rumors about the three religions.\nFrom stealing chickens and dogs to having affairs with other people's wives, everything is included.","เจียงหนานไกว่พูดน้ำไหลไฟดับ ไม่นานก็แต่งข่าวลือเกี่ยวกับสามสำนักใหญ่ได้ยาวถึงสิบหน้า\nตั้งแต่ขโมยไก่ขโมยหมาไปจนถึงแอบมีชู้กับเมียชาวบ้าน มีครบทุกแนว!"
School-2150-3_2_8_15,"Alright, I've already sent them to spread these words.",เรียบร้อย! ข้าสั่งให้คนของเรานำข่าวลือพวกนี้ไปแพร่กระจายแล้ว
School-2150-3_2_8_16,"Next, let's see the effect in a place where there are many passersby during the day.",ต่อไปก็รอดูผลกระทบในช่วงกลางวัน ตามที่ที่มีผู้คนพลุกพล่านกันเถอะ
School-2150-3_2_9_1,Hmm? Who is this stinky brat? What are you looking for the old monster for?,หืม? เจ้าตัวแสบเป็นใคร? มาหาเฒ่าประหลาดทำไม?
School-2150-3_2_9_2,"I am from Nine Factions Sect{PlayerName}, I have a business to discuss with the Street master.",ข้าคือ {PlayerName} แห่งนิกายเก้าฝ่าย มีธุระจะมาคุยกับเจ้าตรอกเล้าหมู
School-2150-3_2_9_3,"Nine Factions Sect? What's the matter, the old monster is the Street master.",นิกายเก้าฝ่าย? มีเรื่องอะไรก็ว่ามา ข้านี่แหละเจ้าตรอกเล้าหมู!
School-2150-3_2_9_4,"So you are the Street master, this is the thing... ",ที่แท้ท่านก็คือเจ้าตรอกเล้าหมู เรื่องมันเป็นแบบนี้...
School-2150-3_2_9_5,You tell Jiang Nanguai about Tie Mianren's plan... ,เจ้าถ่ายทอดแผนของ บุรุษหน้ากากเหล็ก ให้เจียงหนานไกว่ฟัง...
School-2150-3_2_9_6,"Hahaha, interesting, interesting, that iron shell head can actually come up with such an interesting plan!",ฮ่าๆๆๆ สนุกดี สนุกดี! ไม่อยากเชื่อว่าไอ้หัวเหล็กนั่นจะคิดแผนที่น่าสนใจขนาดนี้!
School-2150-3_2_9_7,How come you are more excited than me... ,ท่านดูตื่นเต้นยิ่งกว่าข้าอีกนะ...
School-2150-3_2_9_8,Who doesn't want to see those high and mighty people fall into the mud? Let's hurry up!,ใครกันจะไม่อยากเห็นพวกชนชั้นสูงที่วันๆ ทำตัวดี ดูถูกคนอื่น ต้องมาเผชิญหน้ากับความอับอาย? ไม่ต้องพูดมาก ลงมือกันเถอะ!
School-2150-3_2_9_9,"Okay, first let's make up some rumors... ",เอาล่ะ ก่อนอื่น เราต้องแต่งข่าวลือกันก่อน...
School-2150-3_2_9_10,"Make up rumors? Easy, the monks of Shifa Temple peeping at the wives of Confucius Temple scholars bathing, or the wives of scholars peeping at the monks bathing. Writing this kind of stuff is as easy for me as peeing anywhere!",แต่งข่าวลือ? เรื่องง่าย! พระจากอารามซื่อฟาแอบดูเมียของบัณฑิตจากวัดขงจื้อ หรือจะเป็นเมียของบัณฑิตจากวัดขงจื้อแอบดูพระอาบน้ำดี? ข้าแต่งเรื่องแบบนี้ง่ายยิ่งกว่าถ่ายหนักข้างทางเสียอีก!
