School-2150-4_4_4_2,"You're running for your life, your mind a blank, the words of those people echoing over and over in your head... ",เจ้ากำลังหนีเอาชีวิตรอด สมองว่างเปล่า คำพูดของพวกเขาดังก้องซ้ำแล้วซ้ำเล่าในหัว...
School-2150-4_4_4_3,"How dare you commit such a crime, you deserve to be cut into pieces!",บังอาจนักที่ก่อกรรมทำชั่วเยี่ยงนี้ สมควรถูกแหวะเนื้อเถือหนังให้ตายอย่างทรมาน!
School-2150-4_4_4_4,Why would you choose to be a dog of Yan Kingdom instead of being a good Han man!,เหตุใดเจ้าจึงเลือกเป็นสุนัขรับใช้ของแคว้นเยี่ยน แทนที่จะเป็นจอมยุทธ์ผู้กล้าหาญแห่งแผ่นดินฮั่น!
School-2150-4_4_4_5,"Killing him is too easy, break his limbs and feed him to the pigs!",ฆ่ามันน่ะง่ายเกินไป! หักแขนขาของมันแล้วโยนให้หมูกิน!
School-2150-4_4_4_6,"The king's assassin, such a demon, should never be reincarnated!",ผู้ปลงพระชนม์องค์ฮ่องเต้ มารร้ายเช่นนี้ ไม่ควรได้เกิดมาอีก!
School-2150-4_4_4_7,I won't rest until I kill you!,ข้าจะไม่หยุดพัก จนกว่าจะสังหารเจ้า!
School-2150-4_4_4_8,"{PlayerName}, you deserve to die!",{PlayerName} เจ้าสมควรตาย!
School-2150-4_4_5_1,"{PlayerName}, you really disappoint me... ",{PlayerName} เจ้าทำให้ข้าผิดหวังจริงๆ...
School-2150-4_4_6_1,"No, I really didn't know he was the emperor, if I knew, I definitely wouldn't... ",ไม่! ข้าไม่รู้จริงๆ ว่าเขาคือองค์ฮ่องเต้ หากรู้แต่แรก ข้าย่อมไม่มีวัน...
School-2150-4_4_6_2,"No one can hear your rebuttal, but you keep saying it over and over again.\nYour steps still haven't stopped, from day to night, from plains to hills... \nUntil your lips are cracked, until your feet are bleeding... \nYou finally stumbled and fell into the water, losing consciousness... ","ไม่มีผู้ใดได้ยินคำแก้ตัวของเจ้า แต่เจ้ากลับพร่ำพูดมันซ้ำแล้วซ้ำเล่า…\nฝีเท้าของเจ้ายังคงไม่หยุด ตั้งแต่รุ่งอรุณจรดราตรี จากที่ราบสู่ขุนเขา...\nจนกระทั่งริมฝีปากแห้งแตก จนฝ่าเท้าอาบโลหิต...\nสุดท้าย เจ้าสะดุดล้มลงสู่ธารน้ำ หมดสติไปในที่สุด..."
School-2150-4_5_1_1,"After an unknown period of time, you finally open your eyes... ",ไม่รู้ว่าผ่านไปเนิ่นนานเพียงใด… ในที่สุด เจ้าก็ค่อยๆ ลืมตาขึ้น...
School-2150-4_5_1_2,This is... ,นี่คือ...
School-2150-4_5_2_1,"Child, you're finally awake... ",หนุ่มน้อย ในที่สุดเจ้าก็ฟื้น...
School-2150-4_5_2_2,"Granny, I... ",ยาย... ข้า...
School-2150-4_5_2_3,"You fell into the water, if it wasn't for the Ferryman who saved you, you would have... ",เจ้าพลาดท่าตกน้ำ หากมิได้ผู้เฒ่าพายเรือช่วยชีวิตไว้ ป่านนี้เจ้าคง...
School-2150-4_5_2_4,"Well, never mind, the sect leader is looking for you, you better go.",เอาเถอะ ไม่เป็นไร ประมุขนิกายกำลังหาเจ้าอยู่ รีบไปเถอะ
School-2150-4_5_2_5,The sect leader... is looking for me?,ประมุขนิกาย... กำลังตามหาข้าอยู่?
School-2150-4_5_3_1,"Yes, sigh, the sect leader wants to see you as soon as you wake up, it's really hard.",เฮ้อ... ใช่แล้ว! ประมุขนิกายอยากพบเจ้าทันทีที่ฟื้นขึ้นมา ช่างเป็นเรื่องลำบากเสียจริง!
School-2150-4_5_4_1,You're finally awake.,ในที่สุดเจ้าก็ฟื้น
School-2150-4_5_4_2,I... ,ข้า...
School-2150-4_5_4_3,"You fell into the water, luckily we found you in time, otherwise I couldn't save you.",เจ้าพลาดท่าตกน้ำ โชคดีที่พวกเราพบเจ้าทันเวลา มิเช่นนั้น ข้าคงช่วยเจ้าไม่ได้...
School-2150-4_5_4_4,"By the way, the sect leader is looking for you, you better go.",จริงสิ! ประมุขนิกายกำลังตามหาเจ้า รีบไปเถอะ!
School-2150-4_5_4_5,The sect leader... is looking for me?,ประมุขนิกาย... กำลังตามหาข้าอยู่?
School-2150-4_5_5_1,"Junior brother, you're awake?",ศิษย์น้อง เจ้าฟื้นคืนสติแล้วหรือ?
School-2150-4_5_5_2,I... what happened?,ข้า... เกิดอะไรขึ้น?
School-2150-4_5_5_3,"You drowned, luckily you have a big life.\nThe sect leader is looking for you, don't keep him waiting too long.","เจ้าจมน้ำ โชคดีที่เจ้ามีวาสนา\nประมุขนิกายกำลังเรียกหาเจ้า รีบไปเถิด อย่าให้ท่านต้องรอนาน!"
School-2150-4_5_5_4,The sect leader... is looking for me?,ประมุขนิกาย... กำลังตามหาข้าอยู่?
School-2150-4_5_6_1,"Kid, you seem to have suffered a lot, the sect leader is looking for you, go quickly.",หนุ่มน้อย เจ้าดูอิดโรยยิ่งนัก ประมุขนิกายกำลังรอพบเจ้า ไปเถิด
School-2150-4_5_7_1,"Sigh... poor child, I don't know how much you've suffered on this journey... ","เฮ้อ... เด็กน้อยผู้โชคร้าย, ข้าไม่อาจรู้ได้ว่าเจ้าต้องทนทุกข์ทรมานมากแค่ไหนบนเส้นทางนี้..."
School-2150-4_5_8_1,"... You should rest well during this period, otherwise your body won't be able to take it.",... ช่วงนี้เจ้าควรพักผ่อนให้มากๆ มิฉะนั้นร่างกายของเจ้าจะไม่ไหว
School-2150-4_5_9_1,"Why do you look like a dead man? After you see the sect leader, let me give you some advice.",ทำไมเจ้าถึงได้ดูเหมือนคนตายเช่นนี้? หลังจากที่เจ้าได้พบประมุขนิกายแล้ว ข้าจะให้คำชี้แนะเจ้า
School-2150-4_5_10_1,"(In opera tone) Let me dance for you to relieve your worries, okay?","(ร้องทำนองงิ้ว) ""ขอให้ข้าได้ร่ายรำเพื่อคลายความทุกข์ในใจเจ้า เจ้าว่าดีไหม?"
School-2150-4_5_11_1,"The sect leader is still calling me, better not run too far.",ประมุขนิกายยังคงเรียกหาข้าอยู่ ข้าคงไปไกลไม่ได้
School-2150-4_5_12_1,"Kid, you... you better look in the mirror, it's a pity I don't have a mirror to sell here, otherwise I would definitely sell you one at a high price.","หนุ่มน้อย, เจ้า... เจ้าควรไปส่องกระจกดูตัวเองเสียบ้าง น่าเสียดายที่ข้าไม่มีกระจกมาขายที่นี่ ไม่เช่นนั้นข้าจะต้องขายให้เจ้าในราคาสูงแน่นอน"
School-2150-4_5_13_1,"The sect leader is still calling me, better not wander around.",ประมุขนิกายยังคงเรียกหาข้าอยู่ ข้าคงไม่อาจเดินเตร็ดเตร่ไปไหนได้
School-2150-4_5_14_1,"Junior brother... You should rest well, your complexion is frightening... ",ศิษย์น้อง... เจ้าควรพักผ่อนให้มากๆ สีหน้าเจ้าดูไม่ดีเลย...
School-2150-4_6_1_1,Sect leader... ,ท่านประมุข...
School-2150-4_6_1_2,"{PlayerName}, it's good that you're back, I already know about everything that happened.",{PlayerName} เจ้ากลับมาแล้วสินะ ดีแล้ว ข้ารู้เรื่องราวทั้งหมดที่เกิดขึ้นแล้ว
School-2150-4_6_1_3,What... happened... ,เกิด... อะไรขึ้น...
School-2150-4_6_1_4,"Right, Me gave the current emperor to... ",จริงสิ ข้าทำให้ฮ่องเต้องค์ปัจจุบันต้อง...
School-2150-4_6_1_5,"Now the news is spreading like wildfire, everyone in the world knows that you are the murderer of the current emperor, no matter good or evil, everyone wants to kill you for their satisfaction.",บัดนี้ข่าวลือได้แพร่สะพัดดั่งไฟลามทุ่ง ทั่วทั้งยุทธภพต่างรู้กันหมดแล้วว่าเจ้าคือฆาตกรผู้ปลงพระชนม์ฮ่องเต้องค์ปัจจุบัน ไม่ว่าจะเป็นฝ่ายธรรมะหรืออธรรม ทุกคนล้วนต้องการเอาชีวิตเจ้าเพื่อความสะใจ
School-2150-4_6_1_6,"Your current appearance and name, can't be seen by anyone anymore.",รูปโฉมและนามของเจ้าในยามนี้ ไม่อาจให้ผู้ใดได้ประสบพบเห็นอีกต่อไป
School-2150-4_6_1_7,"... So what should Me do, live alone in the Nine Factions Sect?",...แล้วข้าควรทำเช่นไร อยู่อย่างโดดเดี่ยวในนิกายเก้าฝ่ายไปเช่นนี้หรือ?
School-2150-4_6_1_8,"No, with your talent, it would be a waste to spend the rest of your life in the Nine Factions Sect.",หาได้เป็นเช่นนั้นไม่ ด้วยพรสวรรค์อันล้ำเลิศของเจ้า การใช้ชีวิตที่เหลือในนิกายเก้าฝ่ายช่างเป็นการสูญเปล่านัก
School-2150-4_6_1_9,So... what should Me do?,แล้ว... ข้าควรทำอย่างไร?
School-2150-4_6_1_10,"There is only one solution at the moment.\n{PlayerName}, let Me ask you, do you know what the sect leader looks like?","ในยามนี้มีเพียงทางออกเดียวเท่านั้น\n{PlayerName} ข้าขอถามเจ้าสักหน่อย เจ้ารู้หรือไม่ว่าประมุขของเจ้ามีรูปโฉมเช่นไร?"
School-2150-4_6_1_11,I don't know... ,ข้าไม่รู้...
School-2150-4_6_1_12,Why is that?,เหตุใดจึงเป็นเช่นนั้น?
School-2150-4_6_1_13,"Because you, sect leader, wear an iron mask and a cloak, no one can see your true face... ",ก็เพราะท่านประมุขสวมหน้ากากเหล็กและคลุมกายด้วยผ้าคลุม ไม่มีผู้ใดในยุทธภพได้เห็นโฉมหน้าที่แท้จริงของท่าน...
School-2150-4_6_1_14,"That's right, everyone knows that Tie Mianren is the leader of the Nine Factions Sect, but how many people know the true face of Tie Mianren?",ถูกต้อง! ทุกคนในยุทธภพต่างรู้ว่า บุรุษหน้ากากเหล็ก คือประมุขของนิกายเก้าฝ่าย แต่มีสักกี่คนกันที่เคยเห็นโฉมหน้าที่แท้จริงของบุรุษหน้ากากเหล็ก?
School-2150-4_6_1_15,"{PlayerName}, look carefully at the true face of your sect leader.","{PlayerName}, จงมองดูให้ดี นี่คือโฉมหน้าที่แท้จริงของประมุขนิกายของเจ้า!"
School-2150-4_6_1_16,"Tie Mianren takes off his iron mask and cloak in front of you, revealing his true face.",บุรุษหน้ากากเหล็ก ปลดหน้ากากเหล็กและผ้าคลุมต่อหน้าเจ้า เผยให้เห็นโฉมหน้าที่แท้จริง!
School-2150-4_6_1_17,"The sect leader's name is Qin Huizhi, this is my true identity.",นามของประมุขนิกายคือ ฉินฮุ่ยจือ นี่แหละคือตัวตนที่แท้จริงของข้า!
School-2150-4_6_1_18,"{PlayerName}, from today on, this iron mask is yours, put it on, this is the only solution I can think of for you.","{PlayerName}, นับตั้งแต่วันนี้เป็นต้นไป หน้ากากเหล็กนี้เป็นของเจ้า จงสวมมันเสีย… นี่คือทางออกเดียวที่ข้าคิดได้เพื่อเจ้า!"
School-2150-4_6_1_19,……,……
School-2150-4_6_1_20,"Very well, from today on, in the eyes of the world, you are the leader of the Nine Factions Sect, and I am your strategist, usually collecting information outside, and only returning to the sect when something happens, to provide you with strategies.",ดีมาก! นับจากวันนี้เป็นต้นไป ในสายตาของยุทธภพ เจ้าคือประมุขของนิกายเก้าฝ่าย ส่วนข้าเป็นเพียงที่ปรึกษาของเจ้า คอยรวบรวมข่าวสารอยู่ภายนอก และจะกลับสู่นิกายเมื่อเกิดเรื่องสำคัญ เพื่อชี้แนะกลยุทธ์แก่เจ้า!
School-2150-4_6_1_21,"The fact that I am the leader of the Nine Factions Sect is only known to heaven and earth, you and I, and no third person knows.",ความจริงที่ว่าข้าคือประมุขนิกายเก้าฝ่าย มีเพียงฟ้าดิน เจ้าและข้าเท่านั้นที่ล่วงรู้ ไม่มีบุคคลที่สามใดจะรู้ได้!
School-2150-4_6_1_22,"This is the perfect plan I have thought of for you.\nTo help you win over the people, I now pass on this supreme palm technique to you.","นี่คือแผนการที่สมบูรณ์แบบที่สุดที่ข้าคิดไว้เพื่อเจ้า!\nเพื่อช่วยให้เจ้าครองใจผู้คน บัดนี้ ข้าจะถ่ายทอดสุดยอดกระบวนท่าฝ่ามือให้เจ้า!"
School-2150-4_6_1_23,"Thank you, sect leader... ",ขอบคุณท่านประมุข
School-2150-4_6_2_1,"As for the sect's shop, I have already handed it over to Lin Shopkeeper, you can buy what you need from him.",ส่วนร้านค้าของสำนัก ข้าได้มอบหมายให้เถ้าแก่หลินดูแลแล้ว เจ้าอยากได้สิ่งใด ก็ไปซื้อจากเขาเถอะ!
School-2150-4_6_3_1,"As for the sect's shop, I should have handed it over to Lin Shopkeeper, but where he went... you should know better than me.",ส่วนร้านค้าของสำนัก ข้าควรส่งมอบให้เถ้าแก่หลินดูแล แต่เขาหายไปไหน... เรื่องนี้เจ้าย่อมรู้ดีกว่าข้า!
School-2150-4_6_4_1,"Right, during the time you were unconscious, the marshal of Yan Yun Iron Army, Wanyan Wuzhu, has been preparing to send troops to Chuxiang City.",ถูกต้อง ในช่วงเวลาที่เจ้าหมดสติ แม่ทัพใหญ่แห่งกองทัพเหล็กเยี่ยนหยุน หวันเหยียนอู๋จู ได้เตรียมการที่จะส่งกองทัพไปยังเมืองฉู่เซียงแล้ว
School-2150-4_6_4_2,"There is still some time before they besiege Chuxiang City, you should rest well first, when they besiege Chuxiang City, I will give you the next instruction.",ยังมีเวลาอีกสักระยะก่อนที่พวกมันจะล้อมเมืองฉู่เซียงได้ เจ้าจงพักผ่อนให้เต็มที่ก่อนเถอะ เมื่อกองทัพเริ่มล้อมเมืองฉู่เซียง ข้าจะมอบคำสั่งถัดไปแก่เจ้า!
School-2150-4_6_4_3,Okay.,ขอรับ
School-2150-4_6_4_4,"So to avoid suspicion, I'll run away first, I'll come back when I need to contact you.",เพื่อหลีกเลี่ยงความสงสัย ข้าจะหลบไปก่อน เมื่อถึงเวลาต้องติดต่อเจ้า ข้าจะกลับมาเอง!
School-2150-4_6_4_5,……,……
B1000-2150_1,"Little brother, since you want to help the Yan army, you and I will break off our relationship from now on!",น้องชาย! ในเมื่อเจ้าคิดจะช่วยกองทัพเยี่ยน ตั้งแต่นี้ไป เจ้ากับข้า ขาดกัน!
B1000-2150_2,"I absolutely won't help the Yan army, since you want to be a traitor, I don't have a brother like you!",ข้าไม่มีวันช่วยกองทัพเยี่ยนเด็ดขาด! ในเมื่อเจ้าคิดจะเป็นกบฏ ข้าก็ไม่ต้องการพี่น้องเช่นเจ้าอีกต่อไป!
B1000-2150_3,"Since you want to help the Yan dogs, we will be enemies the next time we meet.",ในเมื่อเจ้าคิดจะช่วยพวกสุนัขเยี่ยน เช่นนั้นคราวหน้าเมื่อพบกัน เราคือศัตรูกัน!
B1000-2150_4,"{PlayerName}, since you want to help the Yan people, you are making an enemy of the Ye Family Battalion, from now on you are my enemy!",{PlayerName} ในเมื่อเจ้าคิดช่วยพวกเยี่ยน เท่ากับว่าตั้งตนเป็นศัตรูกับกองทัพตระกูลเย่! นับจากนี้ไป เจ้าคือศัตรูของข้า!
B1000-2150_5,"You're actually going to help those Yan dogs, have you forgotten what you said to me before?\nYou unfaithful villain, don't let me see you again!","เจ้าคิดจะช่วยพวกสุนัขเยี่ยนจริงๆรึ? เจ้าลืมคำที่เคยพูดกับข้าไปแล้วหรือไร?\nเจ้าคนไร้สัตย์ทรยศ! อย่าให้ข้าได้พบเจ้าอีกเป็นอันขาด!"
B1000-2150_6,"I've killed so many Yan dogs, and now my best friend is going to help these Yan dogs! Our brotherhood is over, and we will be mortal enemies when we meet in the future!",ข้าสังหารพวกสุนัขเยี่ยนมานับไม่ถ้วน แต่บัดนี้... สหายรักของข้ากลับจะไปช่วยพวกมัน! ความเป็นพี่น้องของเราถือว่าสิ้นสุดกันเพียงเท่านี้! ต่อไปหากพบกัน เราจะเป็นศัตรูกันจนกว่าจะตายไปข้างหนึ่ง!
B1000-2150_7,"You're helping the Yan people, you're no longer my friend!",เจ้าช่วยพวกเยี่ยนแล้ว ข้าไม่ขอนับว่าเจ้าคือสหายข้าอีกต่อไป!
B1000-2150_8,"My father's death is related to the Yan army. If you help the Yan army, you are against me!",การตายของพ่อข้าเกี่ยวข้องกับกองทัพเยี่ยน หากเจ้าช่วยพวกมัน เท่ากับว่าเจ้ากำลังยืนข้างศัตรูข้า!
B1000-2150_9,"The Yan army is eyeing Chuxiang City, how can this young master help you against my father? If you help the Yan army, this young master will not cover you anymore!",กองทัพเยี่ยนกำลังเล็งเมืองฉู่เซียงอยู่ แล้วนายน้อยผู้นี้จะช่วยเจ้าไปต่อต้านบิดาของข้าได้อย่างไร? หากเจ้าช่วยพวกกองทัพเยี่ยน นายน้อยผู้นี้จะไม่คุ้มครองเจ้าอีกต่อไป!
B1000-2150_10,"Although Monk Me has no ambition to save the world, he does not want to add to the world's troubles. Monk Me is leaving!",แม้หลวงจีนอย่างอาตมาจะไร้ความทะเยอทะยานที่จะช่วยยุทธภพ แต่อาตมาก็ไม่ปรารถนาเพิ่มภาระให้กับยุทธภพ อาตมาขอลาจาก!
B1000-2150_11,"Taoist Me will not join forces with the Yan people. If you work for the Yan people, we will go our separate ways.",นักพรตอย่างข้า ไม่ร่วมมือกับพวกเยี่ยน หากท่านเลือกทำงานให้พวกเยี่ยน เราคงต้องแยกทางกันแล้ว!
B1000-2150_12,"Although I'm not a righteous martial artist, I have my bottom line. I won't betray my country! Goodbye!",แม้ข้ามิใช่นักรบผู้ทรงธรรม แต่ข้าก็มีหลักการของตน! ข้าจะไม่ทรยศแผ่นดิน! ลาก่อน!
B1000-2150_13,"The Yan people are attacking us, and you're helping them? Don't ever come to see me again!",กองทัพเยี่ยนกำลังโจมตีเรา และเจ้ากลับไปช่วยเหลือพวกมันอีก? อย่ามาพบหน้าข้าอีกเลย!
B1000-2150_14,"The Yan people are attacking my land, killing my people, and capturing my emperor, and you are serving them? If our paths are different, we cannot make plans together. The next time we meet, it will be a battle!",ชาวเยี่ยนบุกโจมตีแผ่นดินของข้า สังหารผู้คนของข้า และจับองค์ฮ่องเต้ของข้าเป็นเชลย และเจ้ากลับไปรับใช้พวกมัน? หากเส้นทางของเราแตกต่าง เรามิอาจวางแผนร่วมกันไม่ได้ การพบกันครั้งหน้า จะเป็นสนามรบ!
School-2150-4-1_1_1,"Tsk, there's an ambush... ",ชิ มีคนซุ่มโจมตี...
