﻿DLC1Colon,：,：
DLC1CurrentTime,"Year {0}, Month {1}","ปี {0}, เดือน {1}"
DLC1PassTime,{0}M passed,ผ่านไปแล้ว {0} เดือน
DLC1ExpectedIncome,Estimated Coins: {0},ประมาณการรายรับ: {0}
DLC1ProvinceBelong,Affiliation:,สังกัด:
DLC1ProvinceStability,Stable:,ความมั่นคง:
DLC1SLGCoin,Coins:,เงิน:
DLC1SLGSpecial,Resources:,ทรัพยากร:
DLC1PerMonth,/month,/เดือน
DLC1ActionAttackTitle,Strike Out,โจมตี
DLC1ActionAttackContent,"Form a team to launch an attack on a plot of land or to block an enemy's attacking team.\nWhen <color=#a94e37>Defense</color> is needed against enemy attacks, form a team, select the attacked plot as the starting point, and then click on the enemy's <color=#a94e37>attacking team</color> to defend.","สร้างกลุ่มลูกศิษย์เพื่อเริ่มการโจมตีพื้นที่ หรือป้องกันการโจมตีของกลุ่มศัตรู\nการ <color=#a94e37>ป้องกัน</color> การโจมตีของศัตรู, เมื่อสร้างกลุ่มแล้ว ให้เลือกพื้นที่ที่ถูกโจมตีเป็นจุดเริ่มต้น จากนั้นคลิกที่ <color=#a94e37>กลุ่มศัตรู</color> ที่กำลังโจมตีเพื่อทำการป้องกัน"
DLC1ActionCureTitle,Heal,รักษา
DLC1ActionCureContent,Allow injured or MP-depleted Disciple to recover HP and MP.,ทำให้ลูกศิษย์ที่ได้รับบาดเจ็บหรือมีพลังภายในขาดหาย ฟื้นฟู HP และ MP
DLC1ActionCheckTitle,Info,ข้อมูล
DLC1ActionCheckContent,Info about the Disciple under your sect.,ดูรายละเอียดของลูกศิษย์ในสำนัก
DLC1ActionAppeaseTitle,Benefit,ช่วยเหลือผู้คน
DLC1ActionAppeaseContent,"Let the Disciple under your sect recover the <color=#a94e37>stability</color> of the target location.\nThe higher the Level of the city, the less likely the stability will decrease.\nThe decrease in stability is directly related to the number of hostile forces of the sect. The more enemies you have, the faster the stability of the plot decreases.","ทำให้ศิษย์ในสำนักฟื้นฟู <color=#a94e37>ความมั่นคง</color> ในพื้นที่เป้าหมาย\nยิ่งเมืองมีระดับสูง ความมั่นคงจะยิ่งลดช้าลง\nความมั่นคงลดลง สัมพันธ์กับจำนวนกองกำลัง ที่เป็นศัตรูกับสำนัก ยิ่งมีศัตรูมาก ความมั่นคงก็ลดลงเร็วมาก"
DLC1ActionJourneyTitle,Event,เหตุการณ์
DLC1ActionJourneyContent,The place to undertake special events.,จุดรับเหตุการณ์พิเศษที่เกิดขึ้น
DLC1ActionComprehendTitle,Grasp,เรียนรู้
DLC1ActionComprehendContent,Grasp or forget martial arts.,สามารถให้ศิษย์เรียนรู้วรยุทธ์ หรือ ลืมวรยุทธ์ได้
DLC1ActionPractiseTitle,Learn,ฝึกฝน
DLC1ActionPractiseContent,Improve the martial arts Experience of the Disciple.,เพิ่มค่าประสบการณ์ยุทธ์ให้กับลูกศิษย์
DLC1ActionExperienceTitle,Experience,ประสบการณ์
DLC1ActionExperienceContent,Experience Content,เนื้อหาประสบการณ์ในการฝึกฝน
DLC1ActionResearchTitle,Meditation,ทำสมาธิ
DLC1ActionResearchContent,"Let the Disciple meditate to generate <color=#a94e37>meditation points</color>. Only 1 Disciple can do this per month.\nThe higher the Intelligence, the more meditation points produced.","ให้ลูกศิษย์นั่งสมาธิ เพื่อสร้าง <color=#a94e37>แต้มสมาธิ</color> สามารถส่งลูกศิษย์ไปนั่งสมาธิได้เพียง 1 คนต่อเดือนเท่านั้น\nยิ่งมีสติปัญญาสูงแต้มสมาธิก็ยิ่งมากขึ้น"
DLC1ActionRewardTitle,Reward,รางวัล
DLC1ActionRewardContent,Reward Content,เนื้อหารางวัล
DLC1ActionRecruitTitle,recruit,รับสมัคร
DLC1ActionRecruitContent,Here you can recruit talents.,ที่นี่สามารถรับสมัครผู้มีความสามารถได้
DLC1ActionManageTitle,Manage,บริหารสำนัก
DLC1ActionManageContent,"Allows the sect's Disciple to <color=#a94e37>promote</color> to inner sect Disciple, can <color=#a94e37>expel</color> unsatisfactory Disciples (not available in story mode), can <color=#a94e37>rename</color> sect's Disciples.","สามารถให้ศิษย์ในสำนัก <color=#a94e37>เลื่อนตำแหน่ง</color> เป็นศิษย์ภายใน, สามารถ <color=#a94e37>ขับไล่</color> ศิษย์ที่ไม่พอใจออกไป (ไม่สามารถใช้ได้ในโหมดเรื่องราว), สามารถ <color=#a94e37>เปลี่ยนชื่อ</color> ให้ศิษย์ในสำนักได้"
DLC1ActionFeatureTitle,Traits,คุณลักษณะ
DLC1ActionFeatureContent,Adjust the <color=#a94e37>sect talent</color> for the target Disciple.,ปรับเปลี่ยน <color=#a94e37>ทักษะพิเศษของสำนัก</color> สำหรับลูกศิษย์ที่เลือก
DLC1ActionSupportTitle,Supply,เสบียง
DLC1ActionSupportContent,Let the Disciple recover the HP and MP of the <color=#a94e37>stationed Disciple</color> at the target location.,ทำให้ลูกศิษย์ในสำนักฟื้นฟู HP และ MP ของ <color=#a94e37>ลูกศิษย์ที่ประจำการ</color> ในสถานที่เป้าหมาย
DLC1ActionDevelopTitle,Planning,วางแผน
DLC1ActionDevelopContent,Unlock new features or gains for the sect.,ปลดล็อกทักษะพิเศษใหม่หรือการเพิ่มพลังสำหรับสำนัก
DLC1ActionForeignAffairsTitle,Diplomacy,การทูต
DLC1ActionForeignAffairsContent,Interact with other sects.,ติดต่อกับสำนักอื่น
DLC1ActionTradeTitle,Trade,แลกเปลี่ยน
DLC1ActionTradeContent,"Buy goods from the Merchant.\nPay attention to the Merchant's stay time.","แลกเปลี่ยนหรือซื้อสินค้าจากพ่อค้า\nโปรดสังเกตเวลาคงอยู่ของพ่อค้า"
DLC1ActionItemTitle,Item,สิ่งของ
DLC1ActionItemContent,"Modify the Disciple's Outfit, use consumables for the Disciple, use consumables for the sect.","ปรับเปลี่ยนอุปกรณ์สวมใส่ของศิษย์, ใช้ของบริโภคสำหรับศิษย์, ใช้ของบริโภคสำหรับสำนัก"
DLC1UICancel,Cancel,ยกเลิก
DLC1UIPageManageUpgrade,Promotion,เลื่อนขั้น
DLC1UIPageManageFire,Leave the door,ออกจากสำนัก
DLC1UIPageManageCheck,Info Details,ดูรายละเอียด
DLC1UIPageManageSalaryNext,Cost after promotion/month,ค่าใช้จ่ายหลังเลื่อนขั้น/เดือน
DLC1UIPageManageSalaryCurrent,Current cost/month,ค่าใช้จ่ายปัจจุบัน/เดือน
DLC1UIPageManageRank,Position,ตำแหน่ง
DLC1UIPageManageLv,Level,ระดับ
DLC1UIPageManageName,Name,ชื่อ
DLC1UIPageManageTitle,Disciple Management,จัดการลูกศิษย์
DLC1CurrencySLGCoinTitle,Coin,เงิน
DLC1CurrencySLGCoinContent,"Obtain through <color=#a94e37>land, diplomacy, trade</color> and other methods.","ได้รับผ่าน <color=#a94e37>พื้นที่, การทูต, แลกเปลี่ยน</color> และวิธีอื่นๆ"
DLC1CurrencySLGTributeTitle,Meditation points,แต้มสมาธิ
DLC1CurrencySLGTributeContent,"Generated by sending Disciples to <color=#a94e37>meditate</color>, consumed in the <color=#a94e37>planning</color> panel.","ได้รับโดยการส่งลูกศิษย์ไปทำ <color=#a94e37>สมาธิ</color> เพื่อสร้างแต้มสมาธิ, และใช้ใน <color=#a94e37>หน้าจัดการวางแผน</color>"
DLC1CurrencySLGFoodTitle,Food,อาหาร
DLC1CurrencySLGFoodContent,"Obtain through <color=#a94e37>land, diplomacy, trade</color> and other methods.","ได้รับผ่าน <color=#a94e37>พื้นที่, การทูต, แลกเปลี่ยน</color> และวิธีอื่นๆ"
DLC1CurrencySLGMineTitle,Mineral resources,ทรัพยากรแร่
DLC1CurrencySLGMineContent,"Obtain through <color=#a94e37>land, diplomacy, trade</color> and other methods.","ได้รับผ่าน <color=#a94e37>พื้นที่, การทูต, แลกเปลี่ยน</color> และวิธีอื่นๆ"
DLC1CurrencySLGDrugTitle,Herb,สมุนไพร
DLC1CurrencySLGDrugContent,"Obtain through <color=#a94e37>land, diplomacy, trade</color> and other methods.","ได้รับผ่าน <color=#a94e37>พื้นที่, การทูต, แลกเปลี่ยน</color> และวิธีอื่นๆ"
DLC1CurrencySLGWoodTitle,Wood,ไม้
DLC1CurrencySLGWoodContent,"Obtain through <color=#a94e37>land, diplomacy, trade</color> and other methods.","ได้รับผ่าน <color=#a94e37>พื้นที่, การทูต, แลกเปลี่ยน</color> และวิธีอื่นๆ"
DLCQuickBattleConfirm,Start a quick battle?,เริ่มการต่อสู้แบบด่วน?
DLC1NoOwnerGround,No Man's Land,ดินแดนไม่มีเจ้าของ
DLC1TaskPrize,Reward:,รางวัล:
DLC1AttackCost,Attack cost:,ค่าโจมตี:
DLC1AppeaseCost,Benefit People Cost:,ค่าช่วยเหลือผู้คน:
DLC1SupportCost,Supply Cost:,ค่าทรัพยากร:
DLC1AttackTip,Choose the starting point of the attack,เลือกจุดเริ่มต้นของการโจมตี
DLC1AttackTip1,Please select the Characters to attack together (up to 6),กรุณาเลือกตัวละครที่จะออกโจมตีร่วมกัน (สูงสุด 6 คน)
DLC1AttackDoAction,Strike Out,โจมตี
DLC1CureTip,Please select the Character to Heal,โปรดเลือกตัวละครที่จะรักษา
DLC1AppeaseDoAction,Benefit People,ช่วยเหลือผู้คน
DLC1AppeaseTip,Please select the Character to Benefit People,โปรดเลือกตัวละครที่ช่วยเหลือผู้คน
DLC1AppeaseTipTarget,Please select the location for the benefit of the people,กรุณาเลือกสถานที่ที่จะช่วยเหลือผู้คน
DLC1ComprehendTip,Please select the character to comprehend the martial arts,กรุณาเลือกตัวละครที่จะเข้าใจวรยุทธ์
DLC1FactionKungfu,Sect martial arts,วรยุทธ์สำนัก
DLC1SupportDoAction,Resupply,จัดส่งเสบียง
DLC1SupportTip,Please select the character to resupply,กรุณาเลือกตัวละครที่จะทำการจัดส่งเสบียง
DLC1SupportTipTarget,Please select the location for resupply,กรุณาเลือกสถานที่จะจัดส่งเสบียง
DLC1ResearchTip,Please select the Character for meditation,กรุณาเลือกตัวละครที่จะทำสมาธิ
DLC1ResearchGetReward,Will get: {0} meditation points,จะได้รับ: {0} แต้มสมาธิ
DLC1ResearchTip1,"The higher the Character's Intelligence, the more meditation points obtained",หากตัวละครมีสติปัญญาสูง จะได้รับจำนวนแต้มสมาธิมากขึ้น
DLC1CostNeed,Required:,ต้องการ:
DLC1ResearchDoAction,Meditation,ทำสมาธิ
DLC1Comprehension,Intelligence{0},สติปัญญา{0}
DLC1PractiseTip,Please select the character to learn martial arts,กรุณาเลือกตัวละครที่จะฝึกฝนวรยุทธ์
DLC1PractiseUnlearned,Not learned,ยังไม่ได้ฝึกฝน
DLC1PractiseDoAction,Learn,ฝึกฝน
DLC1PractiseGet,EXP+{0},ค่าประสบการณ์+{0}
DLC1Position1,Sect Leader,เจ้าสำนัก
DLC1Position2,Inner Sect Disciple,ศิษย์ในสำนัก
DLC1Position3,Outer Sect Disciple,ศิษย์นอกสำนัก
DLC1ManageTitle,Disciple Management,จัดการลูกศิษย์
DLC1FeatureTip,Please select the character to modify the traits,กรุณาเลือกตัวละครที่จะปรับเปลี่ยนคุณลักษณะ
DLC1FeaturePre,Innate traits,คุณลักษณะเริ่มต้น
DLC1FeatureFactionSelect,Select sect traits,เลือกทักษะพิเศษของสำนัก
DLC1FeatureCanUsePoint,Available points,แต้มที่สามารถใช้ได้
DLC1FeatureSave,Save,บันทึก
DLC1RecruitDoAction,Recruit,รับสมัคร
DLC1RecruitSalary,Recruitment cost,ค่ารับสมัคร
DLC1RecruitStayTime,Run away after {0} months,จะจากไปในอีก {0} เดือน
DLC1RecruitMore,More Disciples,ลูกศิษย์เพิ่มเติม
DLC1RecruitCost,Consumable,ใช้ 
DLC1RecruitCost1,The number of Disciples visiting next month will increase by one,เดือนหน้าจะมีศิษย์ใหม่มาเยือนเพิ่มอีก 1 คน
DLC1QuickBattleTitle,Auto Battle,ต่อสู้อัตโนมัติ
DLC1QuickBattleRemain,Remaining number: {0},จำนวนที่เหลืออยู่: {0}
DLC1CureDoAction,Start healing,เริ่มการรักษา
DLC1RecruitBeGoodAt,Specializes in,ถนัด
DLC1RecruitPrescription,Duration,ระยะเวลา
DLC1FeatureChangedTip,"Modified the characteristics of {0}, do you want to save?",ได้ปรับเปลี่ยนคุณลักษณะของ {0} แล้ว ต้องการบันทึกหรือไม่?
DLC1ManageUpgradeTip,Do you want to promote {0} to an inner disciple?,ต้องการเลื่อนตำแหน่ง {0} เป็นลูกศิษย์ภายในหรือไม่?
DLC1ManageFireTip,Do you want {0} to leave the sect?,ต้องการให้ {0} ออกจากสำนักหรือไม่?
DLC1AskMakeAllie,"{0} wants to form an alliance with you, do you accept?",{0} ต้องการร่วมมือเป็นพันธมิตรกับท่าน ต้องการยอมรับหรือไม่?
DLC1AskPeace,"{0} wants to make peace with you, do you accept?",{0} ต้องการเจรจาสันติภาพกับท่าน ต้องการยอมรับหรือไม่?”
DLC1LogBlank,{0},{0}
DLC1LogGeneric,%l%{0},%l%{0}
DLC1LogLevel,%lc%{0}Level has been raised to {1}.,%lc%{0} เลื่อนระดับขึ้นเป็น {1}
DLC1LogKungfuLevel,%lc%The {1} of {0} has been raised to {2}.,%lc% {0} ของ {1} เพิ่มขึ้นเป็น {2}
DLC1LogItem,%lc% obtained {0}.,%lc% ได้รับ {0}
DLC1LogItemLose,%l%Lost {0}.,%l% สูญเสีย {0}
DLC1LogCurrency,%lc% obtained {0}{1}.,%lc% ได้รับ {0}{1}
DLC1LogCurrencyLose,%l%Lost {0}{1}.,%l% สูญเสีย {0}{1}
DLC1LogBuff,%lc% obtained feature {0}.,%lc% ได้รับทักษะพิเศษ {0}
DLC1LogKungfu,%lc% obtained {0}.,%lc% ได้รับ {0}
DLC1LogRelation,"%lc% Relations with {0} have increased by {1}, currently at {2}.","%lc% กับ {0} ความสัมพันธ์เพิ่มขึ้น {1}, ขณะนี้อยู่ที่ {2}"
DLC1LogTrade,"%lc% traded with {0}, obtained {1}{2}.",%lc% ค้าขายกับ {0} ได้รับ {1}{2}
DLC1LogTraderVisted,%lc% {0} has arrived.,%lc% {0} ถึงแล้ว
DLC1LogTradeLeave,%l%{0} has run away.,%l% {0} ได้ออกไปแล้ว
DLC1LogMaxMember,"%ls%The current number of Disciples has exceeded the sect limit, all Disciples' Mood decreases by <color=#a94e37>{0}</color> points.",%ls% จำนวนศิษย์ปัจจุบันเกินขีดจำกัดของสำนักแล้ว ลูกศิษย์ทั้งหมดค่าอารมณ์ลดลง <color=#a94e37>{0}</color> แต้ม
DLC1LogBeAttacked,"%ls% {0} is about to attack my {1}, be on guard.",%ls% {0} กำลังจะโจมตีฝ่ายเรา {1} โปรดระวัง
DLC1LogAllieExit,%ls% {0} is no longer an ally of this sect.,%ls% {0} ไม่ใช่พันธมิตรของสำนักเราอีกต่อไป
DLC1LogFactionEliminate,
DLC1LogTitleMaxMember,Disciples exceed limit,ลูกศิษย์เกินขีดจำกัด
DLC1LogTitleBeAttacked,Being attacked,ถูกโจมตี
DLC1LogTitleAllieExit,Alliance ended,สิ้นสุดการเป็นพันธมิตร
DLC1LogTitleFactionEliminate,Sect destroyed,สำนักถูกทำลาย
DLC1ArenaFighting,In battle,กำลังต่อสู้
DLC1JourneyTimeLess,Duration: {0} months,ระยะเวลา: {0} เดือน
DLC1JourneyMemberNum0,Limit: {0} people,จำกัด: {0} คน
DLC1JourneyMemberNum1,Limit: {0}-{1} people,จำกัด: {0}-{1} คน
UIPageJourney_Content_UITipFeature_btnGo_Text(TMP),Depart,ออกเดินทาง
UIPageJourneySelectMax,%lc%Exceeding the number limit,%lc% เกินจำนวนที่กำหนด
UIPageJourneySelectMin,Insufficient number of people,จำนวนไม่เพียงพอ
DLC1AiAttack,%l%{0} is preparing to attack {1}'s {2}.,%l% {0} เตรียมโจมตี {1} ที่ {2}
DLC1AiFactionStatusNoneSuccess,%l%{0} and {1} have successfully negotiated peace.,%l% {0} กับ {1} เจรจาสำเร็จ
DLC1AiFactionStatusNoneFail,%l%{0} and {1} failed to negotiate peace.,%l% {0} กับ {1} เจรจาล้มเหลว
DLC1AiFactionDeadTitle,Sect destroyed,สำนักถูกทำลาย
DLC1AiFactionDeadContent,%ls% {0} has disappeared from the martial arts world.,%ls% {0} ได้หายสาบสูญไปจากยุทธภพแล้ว
DLC1ChronicleInfo_MemberAdd,Disciple {0} has joined the sect.,ศิษย์ {0} เข้าร่วมสำนัก
DLC1ChronicleInfo_MemberPromoted,Disciple {0} has been promoted to an inner disciple.,ศิษย์ {0} ได้เลื่อนตำแหน่งเป็นศิษย์ภายใน
DLC1ChronicleInfo_MemberLeaved,Disciple {0} has been expelled from the sect.,ศิษย์ {0} ถูกขับไล่ออกจากสำนัก
DLC1ChronicleInfo_ProvinceAdd,{0} has been occupied.,ยึดครอง {0}
DLC1ChronicleInfo_ProvinceLost,{0} has been lost.,สูญเสีย {0}
DLC1ChronicleInfo_FactionEnemy,We have entered a hostile state with {0}.,เข้าเป็นศัตรูกับ {0}
DLC1ChronicleInfo_FactionDefeated,{0} has been annihilated., {0} ถูกกวาดล้างแล้ว
DLC1ChronicleInfo_FactionTrading,We have established a trade relationship with {0}.,ตกลงค้าขายกับ {0}
DLC1ChronicleInfo_FactionTradingEnd,We have terminated our trade relationship with {0}.,ยกเลิกความสัมพันธ์ทางการค้า กับ {0}
DLC1ChronicleInfo_FactionAllie,We have become allies with {0}.,กลายเป็นพันธมิตรกับ {0}
DLC1ChronicleInfo_FactionAllieEnd,We have terminated our alliance with {0}.,ยกเลิกความสัมพันธ์พันธมิตรกับ {0}
DLC1ChronicleInfo_GameWin,"Dominating the Martial World, game victory!",ยึดครองยุทธภพสำเร็จ ชนะเกม!
DLC1ChronicleInfo_GameLose,"Our sect has been annihilated, game over!",สำนักถูกทำลายแล้ว เกมล้มเหลว!
DLC1ForeignAgreeTradeCommon,"We, {0}, agree to trade with {1}!",เรา {0} ตกลงที่จะค้าขายกับ {1}!
DLC1ForeignBeFriendCost,Do you want to spend {0} money to reconcile with {1}?,ต้องการใช้เงิน {0} เพื่อเจรจากับ {1} ไหม?
DLC1ForeignAgreeReconciledCommon,"We, {0}, agree to a temporary ceasefire with {1}!",เรา {0} ตกลงที่จะสงบศึกชั่วคราวกับ {1}!
DLC1ForeignRefuseReconciledCommon,"We, {0}, refuse to reconcile with {1}. To the death!",เรา {0} ปฏิเสธที่จะเจรจากับ {1} สู้ตายไปเลย!
DLC1ForeignAgreeAlignedCommon,"We, {0}, agree to form an alliance with {1}!",เรา {0} ตกลงที่จะเป็นพันธมิตรกับ {1}!
DLC1ForeignRefuseAlignedCommon,"We, {0}, refuse to form an alliance with {1}. Sorry!",ขออภัย เรา {0} ปฏิเสธที่จะเป็นพันธมิตรกับ {1}！
DLC1ForeignRelationAddForMe,Our relationship with this sect: {0}<color=green>+{1}</color>,ความสัมพันธ์กับสำนักนี้: {0} <color=green>+{1}</color>
DLC1ForeignAgreePresentCommon,Thank you for {0}'s gift!,ขอบคุณสำหรับของขวัญจาก {0}!
DLC1TraderStayTime,Stay for {0} months,อยู่ที่นี่ {0} เดือน
DLC1TraderCommingTime,Visit after {0} months,จะมาเยือนอีก {0} เดือน
DLC1Difficult0,Easy,ง่าย
DLC1Difficult1,Normal,ปกติ
DLC1Difficult2,Hard,ยาก
DLC1Difficult3,Nightmare,ฝันร้าย
DLC1SelectFactionStartGame,Start Game,เริ่มต้นเกม
DLC1SelectFaction,Select Faction,เลือกฝ่าย
DLC1SelectFactionStartGameTip,Eliminate {0} at any difficulty to unlock this force.,กวาดล้าง {0} ในระดับความยากใดๆ จะปลดล็อกกองกำลังนี้
DLC1SelectedFaction,Selected Faction,ฝ่ายที่เลือก
DLC1SelectFactionOriginCharacters,Initial Faction Character,ตัวละครเริ่มต้นของสำนัก
DLC1SelectFactionKungfus,Faction Martial Arts,วรยุทธ์ของสำนัก
DLC1SelectFactionFeatures,Faction Traits,คุณลักษณะของสำนัก
DLC1SelectOriginResources,Initial Resources,ทรัพยากรเริ่มต้น
DLC1ForeignBtnBeFriend,Make friends,ผูกมิตร
DLC1ForeignBtnTrade,Trade,การค้า
DLC1ForeignBtnReconciled,Reconciliation,เจรจา
DLC1ForeignBtnAlliance,Alliance,พันธมิตร
DLC1ForeignFactionCharacters,Faction Character,ตัวละครของสำนัก
DLC1ForeignTradeEstimated,Trade Estimate,ประเมินการค้า
DLC1ForeignTrading,Trading,กำลังทำการค้า
DLC1ForeignAlliancing,Forming Alliance,อยู่ระหว่างการเป็นพันธมิตร
DLC1ForeignTradedGetResource,Expected monthly gain after trade:,คาดว่าแต่ละเดือนหลังทำการค้าจะได้รับ: 
DLC1ForeignSelectItems,Select Item,เลือกสิ่งของ
DLC1ForeignPresent,Gift,ของขวัญ
DLC1ForeignRelationForMe,Relationship with our sect: {0},ความสัมพันธ์ในสำนัก: {0}
DLC1PvcTipNoBody,There is no Disciple stationed here.,ที่นี่ไม่มีลูกศิษย์ประจำการอยู่
DLC1TraderTitle1,Name,ชื่อ
DLC1TraderTitle2,Price,ราคา
DLC1TraderTitle3,Stock,มีสินค้า
DLC1TraderBtnBuy,Buy,ซื้อ
DLC1ComprehendKungfuUnlockTip,{0} Level Unlock,ปลดล็อกระดับ {0}
